id,timestamp,token,manual,time,lines,views
nfNIvw3Cz5A,318.7,2:58 Pm,true,2:58pm,"that the autopilot was now disconnected||At 2:58 Pm the following transmission was made by Kiruna tower “And HAZE 01, descend||altitude 5,000",109823
Z-ZvujQVOyE,815.3,2:58 pm,true,2:58pm,That are there in the world||2:58 pm Let's go to Mumbai||3:03 pm,72842
iCgp1qiZ-wc,505.8,2:58 pm,true,2:58pm,"exceptions, since I have a life to live||out of this office and now is 2:58 pm and I||have to go shut my computer down and leave",14179
k4SUxILplkI,339.1,2 58 pm,false,2:58pm,entered the dash in convenience store at||2 58 pm Moore selected a bottle of iced tea from||the beverage cooler and approached the,391203
Y3gCPduKm-E,1145.8,2 58 pm,false,2:58pm,of 2021 sorry 2022 December 27th||at 2 58 pm EST||thank you,333613
qn66EGp053k,1203.4,2 58 pm,false,2:58pm,curse the roundhouse 32||2 58 pm saturday hill||rock and roll daniel you need to see,144692
urw0eIrk5Do,449.2,2 58 pm,false,2:58pm,to live out of this office and now it is||2 58 pm and i have to go shut my||computer down and leave to make it just,129342
eazMC5hAnL0,162.9,2 58 pm,false,2:58pm,um 2019 october 1st yeah||um 2019 um october 8th lydia forsen 2 58 pm most of the people will demand to||bring justice to victims of sexual,67230
GQ_U23TfC30,1093.5,2 58 pm,false,2:58pm,to Christ Medical Center in Oklahoma||where he was pronounced dead at 2 58 pm and he actually didn't live over there||he lived in the hundreds but the,83840
ipPdwsSNK-k,528.6,2 58 pm,false,2:58pm,I'll pass that certain limit and it's||been two hours we hit 2 58 pm thank God||I'm afraid to content never doing this,60583
pe1gHrkOptQ,531.9,2 58 pm,false,2:58pm,video about to make that one after this||it's 2 58 pm and i've really wanted to||lay on a trade today and this is about,22253
bsdrWdtDlZ8,56.2,2 58 pm,false,2:58pm,quality as well as||just a real hublot it's 2 58 pm let's||get down to business,27837
xAYQsq-lbrw,572.1,2 58 pm,false,2:58pm,taylor contacted police a second time at||2 58 pm in hopes of getting the amber||alert reactivated,396767
sWyY9WsmhH4,2263.8,2 58 pm,false,2:58pm,free of charge for now another one so||this is from 2 58 pm sometime later||quote media now describing the shooter,17706
EQAmweE0EkQ,40.2,2 58 pm,false,2:58pm,okay dude it honestly really sucks||because it's 2 58 pm for me right now||which you know you'd think everyone,13901
iCgp1qiZ-wc,507.4,2 58 pm,false,2:58pm,to live out of this office and it's now||2 58 pm and i have to go shut my||computer down and leave to make it just,14179
02Y45KSydsc,180.1,2 58 pm,false,2:58pm,18 minutes after noon||well less than three hours later 2 58 pm also yesterday this article||yellen extends,13002
OhFRkgf4oRk,137.9,2 58 pm,false,2:58pm,the next week which is today actually so||at 2 58 pm today january 20th i got an||email from four uh the title is it's,15678
Bh0sEEjT9DA,105.5,2 58 PM,false,2:58pm,standing in for the petitioners that is||labor party and himself time 2 58 PM the||lawyers argue over the Motions fired and,12343
86cOsHyORMM,248.6,2 58 PM,false,2:58pm,the last time her cell phone was active||was at 2 58 PM when it pinged just north||of almajac Boulevard two miles from her,10514
BQ8GcXQQQJQ,222.7,2 58 PM,false,2:58pm,new family||on December 10 2021 at 2 58 PM Cruz||magued was fixing something at the,12632
YxGZQHVRP5k,31.4,2 58 PM,false,2:58pm,cancer season will begin when the sun||enters cancer on June 21st at 2 58 PM universal time which will be at 7 58 a m||if you are on Pacific,19001
uqT-CnAgSG0,473.7,2:58 P M,true,2:58pm,"They all have to come from somewhere, you know?||2:58 P M - The Learning Center of Hanson Street reports a man across the way stands||at his",763477
hBmevfQ4dc8,5.2,2:58 p m,false,2:58pm,oh my god so today is October 27th||2:58 p m right now I had my 40 week||appointment and my midwife at 2 p m,914193
uqT-CnAgSG0,472.1,2:58 p m,false,2:58pm,it they're all have to come from||somewhere you know 2:58 p m the||learning center of Hanson Street reports,763477
LoUna_6LtyY,441.7,2:58 p m,false,2:58pm,feels really good it feels really light||hi guys so right now it is 2:58 p m I||know I started kind of late but yeah I,303951
lUF0SE7gkjc,2793.9,2 58 p m,false,2:58pm,curriculum father of fire jeweled curse||the road house 2 58 p m okay||i don't see why that would be covered up,314085
Uv_lw12u5S0,732.1,2:58 p m,false,2:58pm,flight and this dude demands the armrest||this is at 2:58 p m how are you playing three pro point||matches at 210 220 and 2:45 p,280483
Uv_lw12u5S0,739.9,2:58 p m,false,2:58pm,if you||were sitting on an airplane at 2:58 p m if that is not suspicious activity I||don't know what suspicious activity is,280483
vf3d61vcSmA,1090.2,2 58 p m,false,2:58pm,this is a tweet at 2||2 58 p m in the||afternoon i think yeah i think you were,256154
zGEpfGFxiXg,619.9,2 58 p m,false,2:58pm,see right there||2 58 p m baby||bay area transparency and i'm out,259578
_H0BZpbWZWc,313.8,2 58 p m,false,2:58pm,crafts in his house at||2 58 p m all right so all you have to do||is add a hot,178259
IrdjZvRGBZM,699.1,2:58 p m,false,2:58pm,there at somebody we have to be there at||1:30 meat time is at 2:58 p m and then||we perform at 4:28 p m,138348
cfEKYiRSzMI,392.2,2:58 p m,false,2:58pm,so I want to send it now||so there it goes okay they got it 2:58 p m so I'll turn the camera on whenever||I get a reply hello hey that,108279
D8jbTMyfJA4,198.2,2:58 p m,false,2:58pm,dispose of the liquefied petroleum gas||inside the u TLX a 301 3 at 2:58 p m however something caught an inspectors||eye some of the LPG was leaking out of,120009
AAhmHNQqeYc,125.6,2:58 p m,false,2:58pm,the in-game clock in military time||showing that the mission begins at 2:58 p m in the demo below the time you'll||find the total amount of GMP which,89227
cBBhQlJqF1w,1201.2,2:58 p m,false,2:58pm,Overlord hunting would be in their best||interest but your art is sitting at 2:58 p m if you're a perfect man and man||that juicy juicy chunk of overlords,86140
3g86X0M5xIQ,1244,2:58 p m,false,2:58pm,to state law but the coroner wasn't||informed of these remains until 2:58 p m almost three hours after the rains||of first found therefore the coroner and,76232
fisKCcvArLg,773.2,2:58 p m,false,2:58pm,put down the phone yeah you've got me||2:58 p m we informed the victims that||the special show up had been cancelled,70776
_QDjWCOCiV4,143,2:58 p m,false,2:58pm,and we ended with 60||at 2:58 p m so about 19||in 17 minutes,62382
bmpMxHjekCk,276.4,2 58 p m,false,2:58pm,because it is||2 58 p m so i'm looking a little i'm||looking fabulous,51336
KlgJGrkHPWs,823.1,2 58 p m,false,2:58pm,he's quite fast as well yeah||this zerg is actually at 2 58 p m for a||diamond it's not bad like he's,112078
HNoqqSe8dFs,201.7,2 58 p m,false,2:58pm,the sunlight would look like on this||object at 2 58 p m um||at 0 or on 0 8 21,110620
7RrWubcHgug,634.2,2 58 p m,false,2:58pm,m and i haven't caught we||have since well it's like 58 to 2 58 p m in the big brother house does||anybody else do that when they're,43766
mse8Rz8PWmc,1384.8,2 58 p m,false,2:58pm,our husbands chelsea and i in an hour||it's 2 58 p m and we are recording that podcast||episode at four,47939
uf7wOBdzemQ,214.6,2:58 p m,false,2:58pm,started watching the sim stream and then||it got to be 2:58 p m had to go up at||3:00 and then I was like wait a minute,40814