id,timestamp,token,manual,time,lines,views
zOCkTBuY3Lw,207.4,3:49PM,true,3:49pm,28 people in Moldova experienced||sudden deaths between 2:25PM and 3:49PM Investigation suggests that no contact of||any kind had taken place,86330
fPxh4Jp4dAY,1546.2,3 49 pm,true,3:49pm,phone moved towards where the bike was found||at 3 25 till 3 49 pm so about a half an hour||there were seven truck door events and six,61723
AKj-Jl3_Ark,85.2,3 49 PM,true,3:49pm,the MacArthur Boulevard exit in||Oakland around 3 49 PM And my||first thought is number one,24801
6mUj_vWFJEg,115.9,3 49 pm,true,3:49pm,reached Shahnaz pump at 3 39 minutes||The driver started his journey to Bogra at 3 49 pm with the passengers from Kallyanpur counter||Today I am traveling on that bus,31918
liy0SC6DzRI,2640.2,3 49 PM,false,3:49pm,residential neighborhood he was arrested||at 3 49 PM approximately three miles away from||Marjory Stoneman Douglas High School,7305271
zAqVAila2yA,572.2,3 49 pm,false,3:49pm,it's gone||look the last save was at 3 49 pm and my||computer time is 4 32,2843527
E2P7Fu2w0ts,41.8,3 49 pm,false,3:49pm,on wednesday september 2nd 2020 at||approximately 3 49 pm uniformed mpd officers were in the area||of the 200 block of orange street,794494
eh4f2hTgh-s,367.1,3 49 PM,false,3:49pm,finally getting attention this story||from just the other day at 3 49 PM the||U S may try to ban it so saith multiple,175859
TOTYdHwGzC8,827.9,3 49 PM,false,3:49pm,real trouble a Friday during vacation at||3 49 PM why would I ever get a text what||did I say we're not on,213262
lsuy2hX_M1A,583.8,3 49 pm,false,3:49pm,me that you really need to go outside||and then you demanded walkies now at 3 49 pm is that right i think he's tired||what do you think we knew app,78879
t2bGh8r55Q4,1676.1,3 49 PM,false,3:49pm,roughly also from Steven's Eddie this is||at 3 49 PM says now about a dozen||anti-lgbtq protesters are outside of,77486
2N5vvc2YTpM,220.5,3 49 pm,false,3:49pm,pm||so guys it's about um 3 50 3 49 pm and we have 35||percent battery charge on the smartphone,68627
fPxh4Jp4dAY,1546.2,3 49 pm,false,3:49pm,where the bike was found||at 3 25 till 3 49 pm so about a half an||hour there were seven,61723
llkdiy1XuPs,1985.2,3 49 PM,false,3:49pm,Justin just could not help||by 3 49 PM Jade texted Alan I just need||to get him inside Plan B does not end,65300
zOCkTBuY3Lw,209.5,3 49 PM,false,3:49pm,experienced sudden deaths between 225||and 3 49 PM investigation suggest that||no contact of any kind had taken place,86330
nRnsKiGTR8U,429.7,3 49 pm,false,3:49pm,she departed her house on West Hick||Street at 3 49 pm while Angelica was at work the house she||rented caught on fire the state would,37116
PgYzqthTvJY,1983.4,3 49 pm,false,3:49pm,phone records do seize back as Alibi up||as well 21 calls were made between 3 49 pm and 8 54 PM placing Tim in Warren||some do question whether Tim had,30767
7m7z7EjMwgc,85,3 49 pm,false,3:49pm,I guess a long time ago because he||literally DM me this at 3 49 pm and||right now from when I'm recording it's,37141
xegG90vhk3E,59.6,3 49 PM,false,3:49pm,collection but the crazy day doesn't||stop there at 3 49 PM the xmod bobert||visited us and gave us his mod rank,17933
8MZkP3dUxYs,677.9,3 49 PM,false,3:49pm,of 2020||at 3 49 PM Palmer period Harold||period Colorado period Springs,16518
7XAfxUExKH0,10.4,3 49 pm,false,3:49pm,the incident happened at a house in||tamanputra pogun at around 3 49 pm a team of personnel responded to the||distress call and restrained the dog,15283
dUiAMWgQId8,70.1,3 49 pm,false,3:49pm,reinforcing the petitioner's suspicions||there was a power outage at 3 49 pm at the wenchi high court||but the inspection exercise was not,14425
hKtnYZ8X8UE,2222.7,3 49 pm,false,3:49pm,it is november 8th||at 3 49 pm and we are just outside of||detroit michigan thank you,14078
s8KEasI3iEM,523.9,3 49 PM,false,3:49pm,Faithful Rim that last photo by the way||was taken at 3 49 PM the ones we've all||seen of JJ and Tyler and then JJ Talley,15474
s8KEasI3iEM,587.2,3 49 PM,false,3:49pm,show that photo of Tyler JJ and Alex||that was taken at 3 49 PM that day then||they show an overhead view of,15474
o4E9wRPeZLM,207,3 49 pm,false,3:49pm,never heard before the date of this||pick is 6 24 and the time is 3 49 pm so||i looked up 624 kjv and the first verse,13157
Cxx-ymEM0N4,292.4,3:49 p m,true,3:49pm,you||go to the alarms app you can add a new alarm let's say 3:49 p m can select||whether it's on or off and you can select which day of,58097
s4lBuEe6Tpc,11.9,3 49 p m,false,3:49pm,hour ago near Smith Valley Nevada the||exact time it hit 3 49 p m it was||actually centered on the California side,489728
PI1Z0WrlKx0,482.2,3 49 p m,false,3:49pm,1st||page 48 line 8 at 3 49 p m that's||stupid having sex is actually proven,460206
CuNl8tO_dj8,601.6,3 49 p m,false,3:49pm,it's a lot later now guys it is||currently 3 49 p m and I don't know if||you guys know but on February 3rd was,906067
vYGH4S8XLhU,305.8,3 49 p m,false,3:49pm,today um from||from greek god x at 3 49 p m today oh no||you were the most beautiful woman in the,315941
3B1A8GKCzAQ,673.1,3 49 p m,false,3:49pm,it check check||check it's only 3 49 p m i don't know||what else to do with my day,315793
hNJ6X_OoakI,325.1,3 49 p m,false,3:49pm,yeah overall i think we had a great time||all right so it is 3 49 p m in the||afternoon and the battery percentage of,335982
cg4nbXCRwZw,516.4,3 49 p m,false,3:49pm,like 4 p m||3 49 p m it was so much fun i'm so glad||i got to see everybody,283507
S_Z_CUNo19Y,42.1,3:49 p m,false,3:49pm,something I'm not really sure about||the time well okay there it is at 3:49 p m he says we distributed the Magnus||Carlsen,257329
StMujXsZnZ8,404.6,3 49 p m,false,3:49pm,monday||at 3 49 p m we don't even know what the gym looks||like at that time because we,234637
JaGDg2gVhvg,191.6,3 49 p m,false,3:49pm,and the most like yeah||so it's 3 49 p m right now let me do it||let me do it it's 3 49 i,206392
sn2Kk-OKuco,12.3,3 49 p m,false,3:49pm,it is||3 49 p m wednesday november 7th||17 2021,147264
kz629JArcLc,320.3,3 49 p m,false,3:49pm,here to los angeles for the local time||it's 3 49 p m please talk to the gates||before you leave the aircraft i don't,104176
FTpCxlI7nu0,410,3 49 p m,false,3:49pm,going to begin the experiment same as||last time it's 3 49 p m so you can||really see what kind of time frame we're,232626
D2Z8AK_Umt8,993.8,3 49 p m,false,3:49pm,and||3 49 p m and i don't know how to||describe,98085
SSQbkinde40,12.2,3 49 p m,false,3:49pm,are you serious they really don't want||me to win right now it's 3 49 p m not am as you can tell back here and||in my clothing rack i'm,85057
xRGW73LpTes,918.7,3 49 p m,false,3:49pm,new dawn a new day so it is||3 49 p m right now so that means since||we're doing another 12 hour little go,162377
xedWGlsH0KQ,651.5,3 49 p m,false,3:49pm,while now so it's almost four o'clock||it's 3 49 p m and it's already gotten so||dark outside,66217
jcAcGMTvWKg,56.6,3 49 p m,false,3:49pm,from greek god x at||3 49 p m today oh no||you were the most beautiful woman in the,61516
jSUgl4Q3owk,84,3 49 p m,false,3:49pm,bay area according to the usgs||it struck at 3 49 p m in the area of||smith valley nevada and that's a few,56683
QFB7ForMN9o,50.1,3:49 p m,false,3:49pm,gasp for breath for more than an hour||before he was pronounced dead at 3:49 p m this drawn-out execution prompted||Arizona Governor Jan Brewer to order a,49640
ZjboYT7YifI,75.4,3 49 p m,false,3:49pm,tuesday november 2nd 2021||it is 3 49 p m and 77 degrees and sunny||so it's pretty nice out today so it'll,77665
2vwjBcwH7lc,652.6,3 49 p m,false,3:49pm,we are beating the clock we're set to||arrive at 3 49 p m i called the wonderful girl that worked||there and she,49204
_7QOOKqCB8E,437.2,3:49 p m,false,3:49pm,I wrote obviously you were born on||October 23rd 1995 at 3:49 p m 9 pounds||and 21 and a half inches it was a long,39860
5xoBzQe9EWk,1140.4,3:49 p m,false,3:49pm,that history was made ah||March 12th 2019 at 3:49 p m Eastern||Time texted me and said or hit me on,37931
eOGHxCQdkKM,107.9,3:49 p m,false,3:49pm,secretary is withdrawing Wow boom that||was just a couple hours later at 3:49 p m so Jimmy what was the gops||opposition cuz I mean I don't know like,35237
otxt-OxWzt4,141.6,3:49 p m,false,3:49pm,just do like a few little errands it is||3:49 p m i saw Benny I was a gonna eat||before we left I was gonna have,33740