id,timestamp,token,manual,time,lines,views
Hjg5rKt6CBo,673.8,1:56 PM,true,1:56pm,"*Transition to Friday,||September 14th @ 1:56 PM PST*||The raid had begun, but in a way the",844887
nnPzI8MTSdo,152.7,1:56 pm,true,1:56pm,"An unnamed||83-year-old succumbed to her condition at 1:56 pm||Within 17 minutes, Basharat was recorded making",202604
Ir8A9NQAxMo,593.5,1:56 PM,true,1:56pm,"according to the affidavit||He sent his last email from his work computer at 1:56 PM||on Friday, the 15th",112410
UWNKaEAGaDk,446.4,1 56 pm,false,1:56pm,phone||it said 1 56 pm without saying a word i||showed her the time on daryl's phone,1571025
RdFHNUhNj58,396.2,1 56 pm,false,1:56pm,carry streams are science plays on||youtube for the first time at 1 56 pm guiding viewers to resurrect firey once||again is my favorite team in the yellow,1108906
Gtk8QPvx-bE,334.9,1 56 PM,false,1:56pm,anything to do with his oatmeal friend||logged off from his work computer at 1 56 PM which was highly unusual he||normally worked until 5 PM and then at,421179
nnPzI8MTSdo,158.1,1 56 PM,false,1:56pm,England an unnamed 83 year old succumbed||to her condition at 1 56 PM within 17||minutes basharat was recorded making,202604
kxHmwA_q_14,104.6,1 56 pm,false,1:56pm,medalist meccan tapa lining up in the||women's 100 meter hurdles at 1 56 pm alongside compatriot and 2015 world||champion daniel williams,159136
BduKMo8zSe8,186.6,1 56 pm,false,1:56pm,for example on mine it says latest||backup today at 1 56 pm to this computer||this tells me that i now have a complete,211820
Ir8A9NQAxMo,595.1,1 56 pm,false,1:56pm,sent his last email from his work||computer at 1 56 pm on friday the 15th||his employer told police this was highly,112410
WDpKqCQ__Yw,113.4,1 56 pm,false,1:56pm,the plane was allowed to descend to 000||feet at 1 56 pm the plane passed the||echo waypoint,122375
wO0iMpIU9LI,2947.9,1 56 p m,true,1:56pm,for the life that he took from felicia williams||on december 9th 2004 at 1 56 p m god blessed||me with the eight pound one ounce healthy baby,526164
-XuNtLf5FFM,860.7,1:56 p m,true,1:56pm,"being heard over five miles away||By 1:56 p m , a few hundred Americans had returned to the perimeter fence||Due to the reinforcement of",378866
RJ9QmZJF8vA,1115.2,1:56 p m,false,1:56pm,coming home and pulling in a driveway||and this is that looks like 1:56 p m and Here I am pulling into the garage||I'm I just fast forward this,4552775
-QIUut1RgM4,457.7,1:56 p m,false,1:56pm,it's actually not morning I slept in so||late um its 1:56 p m i slept till about||12:30 and i've just been on my phone,2181974
TtK23_Wg_tQ,282.5,1 56 p m,false,1:56pm,night six o'clock yesterday||it is 1 56 p m today it's got 25 000||freaking likes,600305
wO0iMpIU9LI,2951.3,1 56 p m,false,1:56pm,on december 9th 2004||at 1 56 p m god blessed me with the||eight pound one ounce,526164
3Dqfoe3mFRM,624.7,1 56 p m,false,1:56pm,really excited about that that's me now||also too it's 1 56 p m if we go down to||our 1k tag we've caught,526595
ipOeKaNXbL0,1098,1:56 p m,false,1:56pm,I'll check back with you guys shortly||okay my friend so it is 1:56 p m and we||just got some work done we got a new,429536
MSBDdXUMfpM,603.5,1 56 p m,false,1:56pm,even gotten on here and talked to you||guys yet it's tuesday it's 1 56 p m i||have class in,418179
RqP11TYmSo0,341.9,1:56 p m,false,1:56pm,with you keep leading that was today at||1:56 p m well the way he's got lots of||criticism from folks for that particular,287934
C1hFJimHDj8,654.2,1 56 p m,false,1:56pm,an hour ago||at 1 56 p m it's already 2||46,196394
K2Rvw3p7gJE,63.8,1 56 p m,false,1:56pm,now around 1 51 p m||and 1 56 p m large institutions loaded||up,167298
l8wAkzyHZto,362.5,1:56 p m,false,1:56pm,fuck the sneeze up Sam don't you do||as we're saying that at 1:56 p m is the||time of the day on Monday is the time of,146452
vPeYSvK4Lx0,831.8,1 56 p m,false,1:56pm,sends an email to his work||um and and he does that at 1 56 p m so this gives you a time stamp of||the last time we think that he,143296