id,timestamp,token,manual,time,lines,views
uocgoJxGLy0,164.6,1 59pm,false,1:59pm,postponed indefinitely 2pm released||their first official album titled 1 59pm to symbolize jaypak's absence it's safe||to say that 2pm fans had to,132677
bPa_9Ka4XPE,712,1:59 PM,true,1:59pm,"if we had that here||You could go to your boss at 1:59 PM||and be like,",178493
EKz7EGKm_6c,663.2,1 59 pm,false,1:59pm,november 30 from 12 midnight up to 1 59||am and 12 noon to 1 59 pm the price of||the note 11s will be only,964646
8qMYNupknhI,21.1,1 59 PM,false,1:59pm,grab one so be sure to be on the website||right at 1 59 PM this gloss I'm making||right now is Holly she is a vibrant red,340796
CPIKvhkgJF4,596.3,1 59 pm,false,1:59pm,please and||she sent this message at 1 59 pm and||then at 2pm op replies i don't really,314811
YnknK8l-QrQ,363.2,1 59 pm,false,1:59pm,this off the charger at about 9 A M||this morning and it's now 1 59 pm and if we go to battery health you'll||see I still have that accessibility,274144
QVYkFSCf6FA,192.6,1 59 pm,false,1:59pm,and eventually they accepted||at 1 59 pm and 42 seconds utc flight||1344 was cleared to descend from 7000,284509
bPa_9Ka4XPE,713,1 59 pm,false,1:59pm,had that here you could go to your boss||at 1 59 pm and be like I love to keep||working sir but I'm a law-abiding,178493
RUnbL2Cp1yY,17.7,1 59 pm,false,1:59pm,fast this one is we're going to time it||as i start it's 1 59 pm let's get after||it the rate limiter for speed in this,176621
RCOUeK509Gs,435.6,1 59 PM,false,1:59pm,first grade class at about 12 50 PM when||recess was over at 1 59 PM Abigail was||teaching a lesson when the boy produced,160860
29eaeVeIYDw,538.4,1 59 pm,false,1:59pm,email to the entire building time to be||sent at 11 1 59 pm on Christmas Eve the||email detailed hope he was having an,124818
PuGKXBw5M_k,2344.7,1 59 pm,false,1:59pm,ahead and conclude the interview right||now||the time is 1 59 pm undefined,142243
DkZKG-SQ1WU,1622.3,1:59 p m,false,1:59pm,the multiple times he said it would||arrive she calls Chris again at 1:59 p m to request the garage doors||passcode but Chris tells her the doors,3734996
OT0Usd3kMw4,460.9,1:59 p m,false,1:59pm,changing||I feel amazing it is now 1:59 p m and||they're about to give me pitocin soon,1639405
hT0kXWd4jV0,545.8,1:59 p m,false,1:59pm,share of the damn agent world record 53||seconds at 1:59 p m universal||coordinated time that day this happened,1083473
TTZx0J8eRpc,309.2,1:59 p m,false,1:59pm,Solomon and call it all the part drops||1:59 p m so today is crunch time just||got NYX trailer I'm standing right now,280464
SjKBTPB1KWc,69.5,1:59 p m,false,1:59pm,foot and you can even see right there||1989 they were purchased at 1:59 p m the whole total came out to be 77||dollars and 99 cents down so here,236026
kOGOsVkpo2I,160.9,1:59 p m,false,1:59pm,welcome you to Cancun for the local time||at 1:59 p m mixed oh thank you we've||arrived in Cancun Mexico we're going to,205919
_OErhW4Ihfo,88.6,1 59 p m,false,1:59pm,artist was um later transported to a||hospital and then pronounced dead at 1 59 p m man if you on the east coast man||that's probably like 3 59 or,136473
cy4kHaCqU5Y,473,1:59 p m,false,1:59pm,any news how happened jay from jay||tanita friday 1:59 p m subject more||trouble Corbin had a concussion too,131039
NO_1OBzvtYY,51.8,1 59 p m,false,1:59pm,not quite though hello there everyone||right now on astoria it's 1 59 p m on||thursday july 30th,138039
okKcU9tqHkA,416.1,1 59 p m,false,1:59pm,more badoofs to catch||okay and it's already 1 59 p m means we||are already one,135852
e_EZ40q1Nc8,161.3,1 59 p m,false,1:59pm,and um my brother was pronounced dead at||1 59 p m this afternoon after they||transported him to the hospital,107329
ufpG1N0Bn_s,86.6,1 59 p m,false,1:59pm,munez said the victim was transported to||a hospital and pronounced dead at 1 59 p m according to a law enforcement source||lapd investigators are examining,100314