id,timestamp,token,manual,time,lines,views
hbFY6JbFXHI,636.7,10:15pm,true,10:15pm,"say one more||time how beautiful this city is, and show the last sunset, at 10:15pm no less",1235754
0dpigDQn0ls,180.8,10:15pm,true,10:15pm,"He arrived at the road||bridge which sat alongside the railway crossing at around 10:15pm to find it completely submerged||Worse still, the railway bridge looked on the verge of",457839
5Trv2BHMw4Q,782.6,10 15pm,true,10:15pm,"We got the photos from the CCTV cameras||At 10 15pm , the Black Scorpion members were at their usual coffeeshop at Ang Mo Kio||At 10",472927
ofMTsd3LtmU,745.5,10:15pm,true,10:15pm,"Dave Meltzer of the Wrestling Observer nearly 12,000 pre-sale||codes were requested by 10:15pm eastern last night - virtually guaranteeing a sell-out||next week",194476
WcKMo4ulev4,121,10:15pm,true,10:15pm,Booth knew the play they||were watching by half and he shot Lincoln at 10:15pm when a comedic line was delivered||and when Lincoln was laughing,169544
JKCfqST0wYI,941.2,10:15pm,true,10:15pm,"And now our night time walks are going on||It is now 10:15pm||Alayna, say bye to Ajay uncle",163245
7nYLVrJMuJc,787.2,10 15pm,true,10:15pm,"What time were the withdrawals made?||10 15pm , 11 05pm, and 10 35am||Those aren't normal working hours",180142
HJmO6uYwYBQ,323.9,10-15pm,true,10:15pm,"a co-worker offered to drive her home after work, she politely declined||At around 10-15pm , Laurel set her goodbye and stepped out of the bustling in||The night was cool",128894
o4QyP8XDJ64,451.3,10:15pm,true,10:15pm,“The quarter-hour with Johnny Gargano's return to WWE||10:15pm slightly grew the||P18-49 audience in a quarter that usually loses,122677
I6029I0kcLA,1097.3,10 15PM,true,10:15pm,"Her starboard side engine was damaged||By 10 15PM , the great battlecruiser was underway again||By the end of that epic day, the three",732346
_0FunV5l57s,955.6,10:15 PM,true,10:15pm,"""I'm cool if you're cool ""||- It's about 10:15 PM I have to take Earl out one more time||to make sure he doesn't",8261917
iX4JVcGjfP8,333.8,10 15 pm,true,10:15pm,", but has stated that he was at home during the time||of the murders, approximately 10 15 pm But we’ll come back to that later||The first officers on the scene witnessed",4137522
E2siaEDLJao,0.1,10:15 pm,true,10:15pm,"December 20, 1968 - Around 10:15 pm 17 year old David Faraday and 16 year old Betty Lou||Jensen parked at a",3817968
BDeJDtkS39s,867.8,10:15 PM,true,10:15pm,pressure on the outer structure of the lower visitor center facility||10:15 PM July 4th - The prime labiod junction just west of the Septum Falls geobiological||feature flexes,1850628
OJYMt5VHZ60,129,10:15 PM,true,10:15pm,"My American Cousin, Booth entered||the box, pulled out a Derringer pistol, and at 10:15 PM ,||shot Lincoln in the back of the head",1682714
lzXaof41JWs,495.2,10:15 pm,true,10:15pm,in the oven and it's going to bake||for one hour and it is 10:15 pm This is not a dish that you start at 9:30 pm||Now the temptation,1338165
sGoFCHvAhUQ,944.1,10 15 pm,true,10:15pm,"minutes to spend there||I feel we would be able to return by 10 or 10 15 pm||Rest, I will share with you the visuals of the place",638987
JNWs4hqCwZ8,862.5,10:15 pm,true,10:15pm,That's my phone and not the battery||The time is 10:15 pm||But they have opened the shop because of me,503104
upn-vmjfAX8,381.2,10:15 pm,true,10:15pm,The collision had occurred at||about 10:15 pm The police concluded that speed||and limited visibility had been major contributing,514655
3fQ0ALou2SI,605.4,10:15 pm,true,10:15pm,"in Las Vegas||The shooting occurred from 10:05 to 10:15 pm , while singer Jason Aldean was giving the||closing performance",522203
AbjdKCsTm44,537.6,10:15 PM,true,10:15pm,"William Peirce, where he recounted the terrible event||At approximately 10:15 PM , Peirce phoned a physician||in Gambier named Dr",395557
fDJL5stg8Hc,1322.6,10:15 PM,true,10:15pm,"ROBERT STACK||VOICEOVER : At approximately 10:15 PM ,||Fred and Jacob were seen leaving the bar",340601
Pp17ElrsZOk,2155.7,10:15 PM,true,10:15pm,"And that was the last I saw of him alive||ROBERT STACK: 10:15 PM , the two teenagers||drive away with Kenneth Olden and his 1983 Mustang",354107
0wmAg-L5slo,388.4,10:15 PM,true,10:15pm,creating space for Booth to make his approach||It was about 10:15 PM when Booth made it to the box||He then entered the vestibule,270013
k8m6Hv1mYDw,1248.3,10 15 pm,true,10:15pm,"I have already checked in at the hostel||It's around 10 15 pm||They said the hostel is empty, just one or two people",604697
KF9HzoiQgZ0,247,10:15 pm,true,10:15pm,"his wife Mary Todd Lincoln at Ford's Theatre in Washington, D C||at around 10:15 pm on the night of April 14, 1865||An army surgeon who happened to be at",200578
arkgxduVA8g,49,10 15 pm,true,10:15pm,and heads to walmart walmart security footage||captures the family entering walmart around 10 15 pm roughly 30 minutes later security footage||then catches jessica again this time storming at a,193509
RSdMHZRr_zw,85.6,10 15 pm,true,10:15pm,has been seen at all bus counters for two days||My tourmate will leave at 10 15 pm But hasn't come in front of the counter yet||Upon entering the counter you,138934
RSdMHZRr_zw,112.6,10 15 pm,true,10:15pm,And this counter is fully air-conditioned||Called from the counter at 10 15 pm Passengers of Coach No||500 to take their respective seats,138934
wOxTHUs_iBE,59.3,10:15 PM,true,10:15pm,RESPONDED TO A 911 CALL AROUND||10:15 PM FOR A FIGHT IN||PROGRESS,144349
4xDd89XTV3Q,71.6,10 15 pm,true,10:15pm,him within 24 hours of the crime||On the 8th of July 2009 at about 10 15 pm Yogeswary and her daughter were walking home when she was attacked by a snatch thief,168355
FZWxPSx-AuU,59.4,10:15 pm,true,10:15pm,"our bus is already here||10:15 pm departure, arrived 30 mins early||This is the pickup point",122251
5uMWals5MxA,15.4,10 15 PM,false,10:15pm,largest tsunami of modern times on July||9 1958 at 10 15 PM a magnitude 7 8||earthquake caused a rock slide of around,12332006
q86aQiINdyo,1045.3,10 15 pm,false,10:15pm,washington dc theater during the||production at around 10 15 pm a man||snuck into the private seating area and,5142468
eHp7JEu4lKg,1204,10 15 pm,false,10:15pm,episode of house of the dragon every||sunday at about 10 15 pm eastern time on||the alt shift x youtube channel,2488757
eHp7JEu4lKg,1204,10 15 pm,false,10:15pm,episode of house of the dragon every||sunday at about 10 15 pm eastern time on||the alt shift x youtube channel,2488757
ZGDwT_o5ZrI,670.7,10 15 PM,false,10:15pm,Skinner found himself home alone again||at around 10 15 PM while playing games||on Steam with his friends he starts to,2019114
Elqp2tP1jW4,83.6,10 15 pm,false,10:15pm,we left the plane in sydney||10 15 pm and i landed in oslo norway at 10 15 p m||sydney time so flying,1321688
ri__arPb8LQ,526.3,10 15 PM,false,10:15pm,operation||at around 10 15 PM just as the vigilance||of the police surveillance teams began,1265316
pq5A3npVWVU,1622.7,10 15 PM,false,10:15pm,show streams after every house of the||Dragon episode at 10 15 PM eastern time||bye for now,832433
IT1lNTPGOqw,264.2,10 15 pm,false,10:15pm,for their lives among them by the time||the concert ended at 10 15 pm eight||people had died of compressive,717057
czRhlaVlXZU,86.9,10 15 pm,false,10:15pm,emergency surgery||and was pronounced dead at 10 15 pm he was identified as 25 year old marquis||simmons,484981
JCUR3q7tbIY,64.4,10 15 pm,false,10:15pm,and to get the turkish crew aboard||by 10 15 pm the plane and most of its||crew are at the gate,607614
0dpigDQn0ls,183.6,10 15 pm,false,10:15pm,alongside the railway crossing at around||10 15 pm to find it completely submerged||worse still the railway bridge looked on,457839
OMt9bHLnMSw,341.1,10 15 pm,false,10:15pm,what came next is unclear but when the||aircraft landed in reno at 10 15 pm cooper was no longer on board||with the four in the cockpit they had no,429273
AbjdKCsTm44,537.4,10 15 pm,false,10:15pm,terrible event||at approximately 10 15 pm pearce phoned||a physician in gambir,395557
5Trv2BHMw4Q,782.5,10 15 pm,false,10:15pm,cameras||at 10 15 pm the black scorpio members||were at their usual,472927
2k4EkTb2ghA,1134.3,10 15 PM,false,10:15pm,after every episode of House of the||dragon at 10 15 PM eastern time so come||and join the fun thank you all for,377959
Lyab929XDxo,1054.3,10 15 pm,false,10:15pm,october 24th 2020 action time||hey siri what's the time it's 10 15 pm all right||now we're gonna start this right now one,373516
o3Hux5PEf5Q,5.4,10 15 pm,false,10:15pm,relatively quiet in the scenic latoya||bay it was 10 15 pm and despite how late||it was it was still about an hour before,379613
WxssXJ7eH3s,165.3,10 15 pm,false,10:15pm,and to get the turkish crew aboard||by 10 15 pm the plane and most of its||crew are at the gate,386816
MSNM07POPsM,335.4,10 15 pm,false,10:15pm,right she told police that she put her||son to bed at 10 15 pm and left to go to||7-eleven to purchase the laundry,393065
u7GCpxocc8c,352.4,10 15 pm,false,10:15pm,antarctic empire here lies technoblade||logging off one final time 10 15 pm 4 10||20,369437
_Viot1KWbXg,333,10 15 pm,false,10:15pm,charged with two misdemeanor counts of||retail theft and battery at 10 15 pm thursday june 16th police said the||suspected thief entered the 7-eleven and,321186
2KfujMNy6EI,1486.2,10 15 pm,false,10:15pm,to his home with him that night was last||seen at 10 15 pm very very reliable gentlemen as i was||explaining to you guys earlier,309956
q4a2PeY-6aU,139.8,10 15 pm,false,10:15pm,appeared to play his whole set and||finished at 10 15 pm videos are now||going viral on social media that show,293282
6sEky-YBeAE,337.6,10 15 pm,false,10:15pm,crunch meeting with his accountants and||turned up at 10 15 pm while heard||claimed that was one of the assault,284799
YLmDE_JYUNU,184.1,10:15 p m,true,10:15pm,"with a white envelope containing Nicole's mother's glasses||At 10:15 p m , Nicole Simpson's neighbor hears a dog bark||and cry while he is watching TV",19992866
vSvVkGqD6m0,1143.1,10:15 p m,true,10:15pm,"According to The Charley Project,||Karlie's final text to her boyfriend, at 10:15 p m ,||claimed that the substance she smoked had been laced",3398649
7TtEiIjoRfY,813.6,10:15 p m,true,10:15pm,"and we are really ready to go to bed,||because it's actually 10:15 p m ,||and I'm exhausted, so",2153744
3nBOGVUNzfw,363.8,10:15 p m,true,10:15pm,games of friends on Steam this went on for a few hours then out||about 10:15 p m shit went down he starts to hear some relatively loud||banging loud enough that he,794078
Q5FKU89WQ0U,465.4,10:15 p m,true,10:15pm,It was a horrible tragedy||The blaze broke out at 10:15 p m It was believed at the time about 35 people||were on the ride,373486
THblaUG3vgM,7.7,10:15 p m,true,10:15pm,At around 10:15 p m on the 9th of June 1979 a fire broke out on the ghost train||at,412274
rKG2iSymMfQ,260.3,10:15 p m,true,10:15pm,"with this like fake fur coat thing||Mmmm yes Charles, please pick me up from the gala at 10:15 p m||Thank you",193430
B5ySYiUGqw8,691.3,10:15 p m,true,10:15pm,to alert them of the disappearance||An alarm is raised and police are called at 10:15 p m||15 minutes pass before the local authorities arrive,185246
DqyE4J6oreA,1124.1,10:15 p m,true,10:15pm,"But yeah, I'm just chilling in my room||It's 10:15 p m , just barely having dinner||All I had today as you saw were,",154199
ErZFPLpnsCA,517.8,10:15 p m,true,10:15pm,"at about 9:38 p m||during Travis' performance, but he kept performing until about 10:15 p m ,||a 37-minute gap, according to The New York Times and the Houston Chronicle",130188
BwogPbikwoY,400.7,10:15 p m,true,10:15pm,I'm a grown woman if I want a bottle of||vodka at 10:15 p m I should be allowed to buy it||stupid stupid rule it's legal for women,103492
hYQb_X28VY4,221.3,10:15 p m,true,10:15pm,"a chilly 30 degrees with light fog||and passing clouds in Jefferson County at around 10:15 p m||on Wednesday, April 19th, 2023",112831
1ot7dALnE-8,355,10:15 p m,true,10:15pm,"How much time till the store opens?||Well, it's 10:15 p m||right now, and store opens at 7:00 a m ,",817920
YLmDE_JYUNU,183.1,10:15 p m,false,10:15pm,containing that Cole's mother's glasses||at 10:15 p m Nicole Simpson's neighbor||hears a dog bark and cry while he is,19992866
_0FunV5l57s,955.4,10:15 p m,false,10:15pm,hi I'm cool I'm cool if you're cool||so it's about 10:15 p m I have to take||Earl out one more time to make sure he,8261917
ndxX_Lm7svM,240.5,10:15 p m,false,10:15pm,captures the family walking in around||10:15 p m that's Jessica in red and||Matthew following in the gray sweatshirt,6163287
iX4JVcGjfP8,333.7,10:15 p m,false,10:15pm,has stated that he was home during the||time of the murders approximately 10:15 p m but we'll come back to that later||the first officers on the scene,4137522
ICy5El3Trm8,482.9,10 15 p m,false,10:15pm,cooper passed into legend||when they landed in reno at around 10 15 p m the police and fbi conducted an armed||search of the cabin,4140082
E2siaEDLJao,0,10:15 p m,false,10:15pm,December 20th 1968 around 10:15 p m 17-year old David Faraday and 16||year-old Betty Lou Jensen parked at a,3817968
paPfnOn-nN4,289,10:15 p m,false,10:15pm,captures the family walking in around||10:15 p m that's Jessica in red and||Matthew following in the gray sweatshirt,3616277
vSvVkGqD6m0,1144.8,10:15 p m,false,10:15pm,Project Carly's final text her boyfriend||at 10:15 p m claimed that the substance||she smoked had been laced perhaps Carly,3398649
ZkeLu5GQob4,6.6,10 15 p m,false,10:15pm,his leg tonight i got a feeling||at 10 15 p m this is a little more than||two hours before the fight even happened,2733478
2dsX4Moy7ws,603.9,10:15 p m,false,10:15pm,surprisingly irritatingly late this time||of year doesn't set until around 10:15 p m so there's a ton of hiding to do||during daylight when you can be,2705523
-3PiOfMQ48c,270.8,10 15 p m,false,10:15pm,today is monday||currently 10 15 p m oh nicole wants||everything back hey guys so we're,2504163
AHqshwRc1xY,99.6,10:15 p m,false,10:15pm,been up and I was playing MLB and it's||10:15 p m now um I'm kind of already||tired but yeah let's go downstairs to,1825460
BDeJDtkS39s,868.5,10 15 p m,false,10:15pm,lower visitor center facility||10 15 p m july 4th||the prime labiad junction just west of,1850628
-_VRz4vmijw,45.6,10:15 p m,false,10:15pm,from Europeans I mean right now I'm||recording this video like 10:15 p m so||over there in Europe it's actually like,1775363
zG2RkKBHX0M,2065.1,10 15 p m,false,10:15pm,beginning of the night||roughly 10 30 p m 10 15 p m i saw||theft of duplicate ballots where they,1672949
OJYMt5VHZ60,131.4,10:15 p m,false,10:15pm,pulled out a Derringer pistol and at||10:15 p m shot Lincoln in the back of||the head booth had no way of knowing it,1682714
pX9jTuN11yQ,256.8,10 15 p m,false,10:15pm,state who is a republican||he said that as of 10 15 p m wednesday||about 90 000 ballots still needed to be,1429340
7-NKdWV5SCg,914,10:15 p m,false,10:15pm,that the power was increasing too||sharply it was restarted again at 10:15 p m the 24th saw some rather dangerous||behavior has operated attempted to try,1423382
ANrZMG76Qxk,1081,10:15 p m,false,10:15pm,MIT Friday||December 12th at 10:15 p m only on||Showtime and showtime anytime showtime,1249992
9WISoAU1xd8,883.1,10:15 p m,false,10:15pm,date they drove out to Lake Herman Road||a well-known Lovers Lane at around 10:15 p m on December 20th 1968 a little||after 11:00 p m,1208918
Kr_VkF7ahes,1584.4,10 15 p m,false,10:15pm,house of the dragon livestream every||sunday at about 10 15 p m eastern time||and doing an explained video like this,1172917
MXL-ZUPe2uc,29.4,10 15 p m,false,10:15pm,that it is October 15th and his flight||number 1015 has been delayed to 10 15 p m what are the odds of that Justin||joins the queue to board the flight and,1381133
zlvHLssCJtg,700.3,10:15 p m,false,10:15pm,tractor just drove by update traffic is||moving kind of it's 10:15 p m it's a mudslide and the road is closed||all night the problem is that,1081978
Elqp2tP1jW4,86.4,10 15 p m,false,10:15pm,pm||and i landed in oslo norway at 10 15 p m sydney time so flying for 24 hours so||please if i can humbly ask and,1321688
KmfX6RE2WAQ,1596.5,10 15 p m,false,10:15pm,of the dragon live stream every sunday||at about 10 15 p m eastern time and||doing an explained video like this each,973461
dv0yDmOqUKw,681.8,10:15 p m,false,10:15pm,bar live at 6:30 p m||and 10:15 p m for||all you need to know about tonight's,919068
KmfX6RE2WAQ,1596.5,10 15 p m,false,10:15pm,of the dragon live stream every sunday||at about 10 15 p m eastern time and||doing an explained video like this each,973461
hcTr58e0h7o,898.6,10 15 p m,false,10:15pm,that's if thunderstorm warning remains||in effect until 10 15 p m eastern daylight time for eastern||cherokee,881356
gNxnstquR9k,338.8,10:15 p m,false,10:15pm,on July 2nd which was last Saturday||around 10:15 p m what can you tell me||about anything you know about this,863901
6O_Uenx2AT0,364.8,10:15 p m,false,10:15pm,and we||started our meal around 10:15 p m and||by midnight we were having coffee we go,839571
qhaX6ICPQS8,269.5,10:15 p m,false,10:15pm,jewelry stores open it's 10:00 p m||10:15 p m in-game time we only need 1 K||but you know money's money so,829189
3nBOGVUNzfw,363.8,10:15 p m,false,10:15pm,this went on for a few hours then out||about 10:15 p m shit went down he||starts to hear some relatively loud,794078
Ky7d66uvC-Q,570.7,10:15 p m,false,10:15pm,a beeline for the hotel no one will ever||know but around 10:15 p m Rothstein||stumbled out of the service elevator,688303
Z4o54_XcxUY,296.4,10:15 p m,false,10:15pm,was a waitress at the Metropolitan store||10:15 p m Jackie is seen leaving the store walking||over the overpass on Wellington Road two,680108
cTXifYJVvAU,1393,10:15 p m,false,10:15pm,to managed to do the||rest of the video it's 10:00 it's 10:15 p m life's how long did I sleep for||just slept for 12 hours I missed,636703
0PHr3Vi0B-k,213.9,10 15 p m,false,10:15pm,Tuesday night amid reports of an active||shooter just before 10 15 p m once||inside officers begin to evacuate The,621482
0YSPCwVQIDY,207.6,10 15 p m,false,10:15pm,when i'm going to bed tonight so right||now it's 10 15 p m and this is what i'm wearing||to bed i have worn this,611520