id,timestamp,token,manual,time,lines,views
0k8JTiLkbw8,30,10 31 pm,true,10:31pm,but with a data mine that came out||yesterday at 10 31 pm on reset era||we may actually now know how many games are coming,101236
XG2gBa7rWXM,857.7,10 31 pm,false,10:31pm,tragedy||but at 10 31 pm that silence was||shattered as the front door's lock was,1762521
8DydG7gfViM,103.6,10 31 pm,false,10:31pm,information out||yesterday september 15th at 10 31 pm pst love b scott reported saying||cardi b reportedly looked past offset's,421619
lP7iTZv2An4,639.2,10 31 pm,false,10:31pm,watching tv on the couch by yourself at||10 31 pm eating nutella||i was eating candy bars watching the,305818
obPzfbo-fj4,1005.3,10 31 pm,false,10:31pm,my name is mary||it's currently 10 31 pm i'm outside of coleman coliseum||um waiting to see if i made the cheer,300266
7g1nbvGDPEY,513.8,10 31 pm,false,10:31pm,looked at the clock||10 31 pm i froze||my heart dropped in my chest out of the,218980
GiWQeNlOgMM,477.7,10 31 pm,false,10:31pm,be able to check the time||10 31 pm just as i was reaching down to put my||phone up back into my pocket,128576
pVMXMZjIIy4,203.7,10 31 PM,false,10:31pm,top||at 10 31 PM around 1 hour 10 minutes||later misheard is seen on the LAPD body,105996
pVMXMZjIIy4,224.9,10 31 PM,false,10:31pm,the photos show that in the two or so||hours between 8 23 pm and 10 31 PM misheard wore at least three different||tops meaning that within the same time,105996
0k8JTiLkbw8,32.2,10 31 pm,false,10:31pm,that but with a data mine that came out||yesterday at 10 31 pm on reset era we||may actually now know how many games are,101236
qI2IPxDdgvE,363.8,10 31 PM,false,10:31pm,the Manchester bombing happened at 2231||or 10 31 PM so the song was released||exactly 22 minutes before the bombing,569612
NMqe7RYVGH8,290,10 31 PM,false,10:31pm,then he would tweet at 6 54 p m emojis||or somebody running from gunshots 10 31 PM I'm bored as hell this was the next||day at 1102 a m Dirk,228439
7rqutwRekTw,176.5,10:31 p m,true,10:31pm,What happens at 10:31 a m?||Or 10:31 p m ?||That can't be right,14312990
OAiNnmkHukc,327.3,10:31 p m,false,10:31pm,mentioned nine years ago right you're on||New Year's Eve 2006 at 10:31 p m was he||sick um you know it kind of was super,25006888
7rqutwRekTw,176.1,10 31 p m,false,10:31pm,what happens at 10 31 a m||or 10 31 p m that can't be right||why does it say town,14312990
3nYPWmMCGUs,880.1,10:31 p m,false,10:31pm,off the radar screen||it is 10:31 p m Twist Air flight 111||bound for Geneva after departing New,1737287
1fpYhXGPxkg,1342.5,10:31 p m,false,10:31pm,there are 20 messages found messages||from someone important at 10:31 p m you||should subscribe to TECA so TV for more,682831
Bx5bgWL4BjU,250.1,10:31 p m,false,10:31pm,they're pumping gas it is without a||10:31 p m we're running a little late||but not really,366180
_xoX99omE1g,1013.4,10 31 p m,false,10:31pm,here look you can't see the time but it||is 10 31 p m and we're finally eating||dinner so,257223
nymVcBIwlbM,1132.6,10:31 p m,false,10:31pm,Georgia we are charging up right now||it is 10:31 p m kids are sleeping as||you can see over here both weeping thank,182076
n0TMNoaB6jg,341.6,10:31 p m,false,10:31pm,down to a list of 10 games I scheduled||to tweet for 10:31 p m on Sunday||December 8 2019 I would have scheduled,223492
hDffoiFd86U,4.2,10:31 p m,false,10:31pm,hello happy new one team this new moon||is happening on December 17th at 10:31 p m Pacific time my time and 1:31 a m||Eastern Standard Time on December 18th,178549
CFl6YXcsVvg,23,10:31 p m,false,10:31pm,did was like the game was created on||November 3 2014 at 10:31 p m but the||game was officially released in 2016 so,147296
B3d_EYuSlMc,1371.3,10:31 p m,false,10:31pm,there's nothing else to report right now||it's 10:31 p m Tuesday as I write this||and I'm going to go to sleep I will,151542
uUEXlWoV1yM,371.5,10:31 p m,false,10:31pm,else||10:31 p m 7th of July 2011||That awkward moment when Facebook tells,148898
u-dWMeCWg_0,387.9,10:31 p m,false,10:31pm,get a 58 an 420||and 5:30 to 10:31 p m in the night baby||I feel okay when did I go skydiving,123047
qUTang3e1_g,5,10 31 p m,false,10:31pm,the video just let you guys know i||actually just woke up currently it's 10 31 p m i was up super late last night||working on videos and ended up going to,110202
-GkRuFU_sUg,932.6,10:31 p m,false,10:31pm,2015||it 10:31 p m that's right about the||current time and so I'm going to go in,124863
8fjJzTnyO1k,288.5,10 31 p m,false,10:31pm,have to polish out no big deal super||late it is 10 31 p m so I'm headed home||so I can get back here tomorrow in the,124693
NDLnf95w1Xs,653.3,10 31 p m,false,10:31pm,funny when the last three hours||10 31 p m and we're in the yard oh||hammer in the shovel we're actually sat,192980