id,timestamp,token,manual,time,lines,views
Huju5McKgIU,142.4,12:15pm,true,12:15pm,"not make it too crowded at any given time||So right now it’s about 12:15pm , the cafeteria isn’t too packed||It’s definitely starting to get a little bit",612802
UnpSDfHn8fs,40.2,12:15pm,true,12:15pm,"this one: the USS Constitution, currently afloat here||She was launched into Boston Harbor at 12:15pm on October 21st, 1797, making her both the||oldest still-floating, still-commissioned naval ship",982990
ZTZSW1XZ6Kw,31.8,12 15pm,true,12:15pm,"so yeah, you gotta get here early||Yeah so it's about 12 15pm now||It just opened and already there's quite a few people in front of",248694
G-XpCUozFVM,493.5,12:15pm,true,12:15pm,"when she arrived at her execution site the guillotine stood ready for her||At around 12:15pm on the 16th October 1793, Marie Antoinette stepped onto the scaffold||to greet Charles Henry",278081
rarpkV5c_eA,866.4,12:15pm,true,12:15pm,I Googled what it was all about but to no avail||It's 12:15pm and thoughts in my stomach have turned to lunch||so I think what I'll,241261
tUJkYXhVSeM,156.5,12:15pm,true,12:15pm,"final journey||She arrived at the guillotine on the 16th October 1793 at 12:15pm , and as she was led||up the steps of the scaffold, the former Queen stood",287145
k3tVuolHwAU,237.2,12:15pm,true,12:15pm,"hair was cut off||At 12:15pm she walked onto the scaffold to greet Charles Henri Samson, her executioner||who had also",252456
BsBsBaZi87M,217.7,12:15 PM,true,12:15pm,"eight||But, like, it's only 12:15 PM , and I heard Danny from accounting, he gets it to you by 1PM||So, like, I'm kind of still ahead right?",5317487
zh2dO7-tgwQ,418.6,12:15 pm,true,12:15pm,at how sweet everything was||It is 12:15 pm and Sam wants to get a drink||even though I feel like I am not,3887040
mZEEZXF76zE,161.3,12:15 pm,true,12:15pm,Ordering||Uber Eats ETA is 12:15 pm||- Oh,2452282
2L--ZgqX4o4,77.8,12:15 pm,true,12:15pm,"and swim at Cheviot Beach||Holt and another member of the group started swimming around 12:15 pm||According to his friends, Holt was seen going out into deeper and deeper water, and",1861480
koR-N2yeKf8,82.2,12:15 PM,true,12:15pm,and for that I will go to Intercity option||I will give time 12:15 PM I can only book a seat||2 or 3 but I need all seats because,702737
9qzpcDVMDd4,170.3,12:15 pm,true,12:15pm,ride around Evansdale||The girl's grandmother saw the girls riding the bike at around 12:15 pm near downtown||Evansdale,394053
8cZsLB59NgY,2289.6,12:15 PM,true,12:15pm,Have fun||ROBERT STACK: 12:15 PM Can you take these bags to security?||We're checking out,545506
F2U47EKRSUg,421.5,12:15 PM,true,12:15pm,"It turned out to be her body found on the side of the road||Tuesday, 12:15 PM , Detective Welliver||drove over to see Alyssa's mother",343591
aJxyeShRsUk,234.3,12 15 PM,true,12:15pm,"for the road's condition or for the condition of the bus||AnyWay, it's 12 15 PM and we're at the A K||Khan bus counter",241595
pBMcoMtxNaY,335.1,12:15 PM,true,12:15pm,"RETRIEVE||AT AROUND 12:15 PM , THE SUREST||GO BY LAW ENFORCEMENT",115862
IAqFBKFJUCE,131.4,12:15 pm,true,12:15pm,"Finally, I reached Foster's village||The time is 12:15 pm||He told me it will take 3 hours, but it took more than 6 hours",161540
UiClEIDDihs,332.2,12 15 PM,false,12:15pm,Hancock State Prison in Sparta||in March 2020 a fight broke out at 12 15 PM leading to the death of Pastrana||according to the Georgia Department of,5398503
q5t2XNO8ZH0,566.3,12 15 PM,false,12:15pm,back on and got back to work about an||hour later at around 12 15 PM Stefan was||still hacking away at The Rock when,4999760
t8POAHfEHsY,121.3,12 15 pm,false,12:15pm,a dude named toa legend january 27th||12 15 pm 46 seconds into the minute||i uploaded the video at 12 15 p m this,3395246
DW1Erjfz7LE,105.3,12 15 pm,false,12:15pm,unsuccessful in getting into his desired||university the following day at 12 15 pm he is in the library he bumps into a guy||and sees that the book,2295728
Vz2-VVMbXv0,559.2,12 15 pm,false,12:15pm,he would perform the executions in pairs||and at around 12 15 pm kramer along with dr fritz klein were||fetched from their cells,1122556
gDhpEaqUelI,331.7,12 15 pm,false,12:15pm,with the man||at around 12 15 pm just minutes before||the bakery sighting also being the time,1260466
VLBQddqdzkQ,943.6,12 15 pm,false,12:15pm,his life to take his own||and by 12 15 pm this tragic event had||finally ended,2071933
8HE0u4KXVQM,465.8,12 15 PM,false,12:15pm,doubt the most hated woman in France at||about 12 15 PM her head was placed on||the block of a guillotine and whoosh the,1079384
gPTgNXjHKT4,597.8,12 15 pm,false,12:15pm,for||i'm in canada it's 12 15 pm i've been||watching your videos for i think around,805406
9DIvoIIW2dA,521.9,12 15 pm,false,12:15pm,gardens red is delmon heights and black||is west side project march 5th 2014 12 15 pm two young men from west side||projects are crossing the street keon,844695
egpyaH_QS7w,1123.5,12 15 pm,false,12:15pm,dissolved||the house will remain in recess until 12 15 pm we are going to take your telephone||calls until,647584
C7nw8B6wNO4,307,12 15 pm,false,12:15pm,troops were anxious to jump into combat||and at about 12 15 pm the floodgates||opened and players from both sides,643832
_f7mdA7MO6I,1071.2,12 15 pm,false,12:15pm,richard but were also unsuccessful in||their efforts at 12 15 pm two divers who||both had extensive experience and,346207
OXhEBfK3Njc,931.2,12:15 P M,true,12:15pm,when she accidentally stepped on her executioner's toe||At 12:15 P M Marie was beheaded||Although Marie Antoinette no doubt played a pivotal role in the revolution,2339678
1DVIbWrkSM8,291.8,12:15 p m,true,12:15pm,Street in downtown Atlanta||Sources say that around 12:15 p m a hotel housekeeper was assigned to clean the room||NBA Youngboy and female friend Starr,1524063
SE4mmQ955PA,17.1,12:15 p m,true,12:15pm,"Twice now||No, actually it's 12:15 p m ,||but we just signed the kids out a little early,",980731
zOEze9SbDxc,1753.6,12:15 p m,true,12:15pm,"egregious assault on our democracy||NICK SCHIFRIN: 12:15 p m , President Trump departs from his teleprompter and urges the||crowd to fight",314345
b_J68e7wHk8,144.8,12:15 P M,true,12:15pm,EVERYTHING STARTING ON JANUARY||20th AT 12:15 P M BECAUSE||THAT’S HOW I WOULD APPROACH IT,292476
yS9CwN0LEkk,29.7,12:15 p m,true,12:15pm,"influence around 5:30 a m||He was said to have been released by about 12:15 p m||While TMZ reports that he was released without bail, Radar Online claims that the Beverly",249675
ZCP-ieR5Zf0,62.5,12:15 P M,true,12:15pm,ON JOBS||12:15 P M||HE HAS LURCH WITH THE,146506
_J_D-vXrRTc,108.7,12:15 p m,true,12:15pm,"both laugh||- Someone tweeted us being like, it's 12:15 p m||Are you all right?",123037
bkGfjtu4HBA,322.2,12:15 p m,false,12:15pm,even do some push-ups this guy wants to||hang out with Judy 12:15 p m creepy guy||wants to hang out do some push-ups what,14145749
t8POAHfEHsY,126,12 15 p m,false,12:15pm,12 15 pm 46 seconds into the minute||i uploaded the video at 12 15 p m this||dude watched 46 seconds of the video and,3395246
v-C6FTGYdMc,316.6,12 15 p m,false,12:15pm,sorry||12 15 p m you can see an object covered with a red||path here at the end of,3523367
mZEEZXF76zE,159.7,12:15 p m,false,12:15pm,option ready 3 2 1||I mean we're easy ta is 12:15 p m oh my approach is called 2019 and that||always changes we're gonna be down,2452282
2L--ZgqX4o4,79.7,12:15 p m,false,12:15pm,another member of the group started||swimming around 12:15 p m according to||his friends Holt was seen going out into,1861480
1DVIbWrkSM8,292.3,12:15 p m,false,12:15pm,street in downtown Atlanta sources say||that around 12:15 p m a hotel||housekeeper was assigned to clean the,1524063
3RFDKpwdbEA,149.4,12:15 p m,false,12:15pm,spread along the ground||at around 12:15 p m the released||asphalt ignited near the storage tanks,1548546
-65GtCwfy24,401.1,12:15 p m,false,12:15pm,title and should||purchasable by 12:15 p m it takes a||little bit of time to get through the,1103279
SE4mmQ955PA,17.2,12:15 p m,false,12:15pm,my head dude madam twice now I know||actually it's 12:15 p m but we just||signed the kids out a little early,980731
J9sl49ZwMSc,38,12:15 p m,false,12:15pm,address something I haven't had caffeine||today it's 12:15 p m I know you did||coffee okay so you how to fold that team,828827
3gKCoxUhKUw,110.8,12:15 p m,false,12:15pm,and Wednesday||from 12:15 p m to 9:00 p m||that's only,777768
F56iGZ5b6cw,1085.4,12:15 p m,false,12:15pm,returned to the house this Polaroid||camera around 12:15 p m they were||discussing the house when her spouse,741907
bLmzy8ZPgtc,673.5,12:15 p m,false,12:15pm,aircraft flying low and slow over the||highway at approximately 12:15 p m according to the witness the pilot was||flying at about 300 feet above the,793431
6jLXSHmxdCM,182.3,12:15 p m,false,12:15pm,go on holiday I have my KFC order from||the 13th of October 2017 at 12:15 p m which if you're wondering what I ordered||from KFC it was a golden gage,624980
i1ZeS4GE5o4,84.2,12 15 p m,false,12:15pm,appointment on time||so my first appointment isn't until 12 15 p m but it takes a little bit to get||over there,516388
CrYPowvbX7Q,118.3,12 15 p m,false,12:15pm,be right here okay guys it is currently||about 12 15 p m and our 24 hours in the||tiny house,716230
SrMkkhO8UfY,304.2,12 15 p m,false,12:15pm,look at them cookies||it's 12 15 p m and the whole Squad is||still awake Cholo Boy is playing a game,672474
82jz9gCtEIE,323.4,12:15 p m,false,12:15pm,meeting an 8 a m||meeting of 12:15 p m Samsung CES 2018 press conference at||2:00 p m,440109
AVdCqY7U4aU,2316.6,12 15 p m,false,12:15pm,all right guys so we just finished up we||got here at uh 12 15 p m and it is now 1am so just about 13 hours||we've been here,482689
6rFy5XQvUc0,297.9,12:15 p m,false,12:15pm,detangling a little bit so it is now||12:15 p m as you guys can see I'm gonna||try to live this on as much,451465
QDU4S4sfb_g,105.8,12:15 p m,false,12:15pm,they see that your essay looks the part||anyway at 12:15 p m I head to the||restaurant bills for lunch with a lovely,449133
QRMi7tlBtLU,82.5,12:15 p m,false,12:15pm,an alt or something like that and so||yeah we're like at 12:15 p m we got||like what - in two hours until the train,387679
9qzpcDVMDd4,173,12:15 p m,false,12:15pm,saw the girls riding their bike at||around 12:15 p m near downtown||Evansdale the girls were seen at about,394053
JgtU5wSuMQw,2749.9,12 15 p m,false,12:15pm,swat teams that are trained with||ballistic shields at 12 15 p m they only||decided to breach that door at 12 50 p m,373091
zKTM84GDEp8,216.6,12:15 p m,false,12:15pm,says if the time stamp is correct you||sent this email to yourself at 12:15 p m presumably a very short time before he||departed the White House for the last,338342