id,timestamp,token,manual,time,lines,views
FCJxBAqHLnM,621.5,12:20pm,true,12:20pm,"a train leaves Manchester for London||at a speed of 30 metres per second at 12:20pm ,||and another train leaves Birmingham for Newcastle",1504811
lXcaiw5JixQ,661.8,12:20pm,true,12:20pm,"Alright, then I will hit the gym and be right back||Now it is around 12:20pm and I am back home after workout||This is going to be my 6th meal",1011641
IZO5Fz9wPfY,314.8,12:20pm,true,12:20pm,"If we go into the city, there would be more 10kms to ride||Time is 12:20pm||Then also, there is a foggy climate",749000
5m2bQxUAUgw,66.8,12:20PM,true,12:20pm,"NFIRNGN ACVE SOTER||RECEIVED AT 12:20PM , BASED ON||THE TIMELINE OF THE MASSACRE",223138
xXXv18D2wd8,985.5,12:20pm,true,12:20pm,All||the bombers made a clean getaway around 12:20pm||The damage inflicted on the RAAF base was,192871
hVxzA8_LRR4,973.7,12:20pm,true,12:20pm,"after the consolidation||around 12:20pm , it moved upside after breaking the previous day's high and closed there||actually, if",125862
_zrorXYgh-A,2419.1,12:20 PM,true,12:20pm,"to be confronted with this||NARRATOR: At 12:20 PM , Ferry pushes over||from 3,000 feet using his guns to draw a bead on",1365624
ei7wf6FT7J8,85.5,12:20 pm,true,12:20pm,I woke up just 5 minutes back||Right now it's 12:20 pm and I have a lecture at 1:00 pm||For that I have to quickly,400284
r1DtX48TKuI,296.8,12:20 PM,true,12:20pm,"of your cell again all day||Alright, 12:20 PM , line up and orderly file out into the rec yard||Then you'll be following",196749
mX9JcwhqTo4,578,12:20 pm,true,12:20pm,"It is understood when touching on this||See, the time shows 12:20 pm No problems even it is mid noon||Even these pipes are not affected with heat",127186
mX9JcwhqTo4,578,12:20 pm,true,12:20pm,"It is understood when touching on this||See, the time shows 12:20 pm No problems even it is mid noon||Even these pipes are not affected with heat",127186
0lDqDrsACtk,600.1,12:20 pm,true,12:20pm,Nata is 100 kms left and its 12:20 pm So there is no steep road only plain road is there||truck passed||So Im,119236
p_8o51YOZY4,2419.1,12:20 PM,true,12:20pm,"to be confronted with this||NARRATOR: At 12:20 PM , Ferry pushes over||from 3,000 feet using his guns to draw a bead on",227810
pTn6Ewhb27k,734.9,12 20 pm,false,12:20pm,this reply sent to 12 10||the message is received on earth at 12 20 pm so both parties know the||synchronization was successful,19665101
eqZGFiT418s,24.5,12 20 PM,false,12:20pm,breakfast which is a large buffet from 8||AM to 12 20 PM there are six class||periods with breaks for hot chocolate,11857748
fBVawooXiK0,359.2,12 20 pm,false,12:20pm,a train leaves Manchester for London||at a speed of 30 meters per second at 12 20 pm and another train leaves||Birmingham for Newcastle at a speed of,2003221
pVYTWMyUTFU,1670.5,12 20 PM,false,12:20pm,help he leaves and goes to B and Q||Friday the 20th of February at 12 20 PM Nathan Matthews heads to a shop and||purchases two bottles of drain cleaner,1385617
DTo-NPdeRgQ,419.1,12 20 pm,false,12:20pm,was raised||and by 12 20 pm the outlet works were||engaged,768857
PPzy2IRA0GE,578.3,12 20 pm,false,12:20pm,the murders of both Sean and Jim||at roughly 12 20 pm on June 27th 2020 28||year old Warren Crossen was captured on,882885
9j6jMtgevI0,249.5,12 20 pm,false,12:20pm,this ill-fated me 17 v5 military chopper||crashed in kunor at 12 20 pm yesterday||and this is how things unfolded,278474
9j6jMtgevI0,317,12 20 pm,false,12:20pm,in wellington||12 20 pm the mi 17 chopper crashed into a gorge||in the jungle close to a tribal,278474
ifSNyiZdVuU,437,12 20 pm,false,12:20pm,their various destinations when gunfire||suddenly erupted the time was around 12 20 pm and in the aftermath of the||shooting six people were left suffering,257376
s9Mbi2Ve9vE,486.8,12 20 PM,false,12:20pm,incredible speeds||by 12 20 PM vice admiral Sydney||Fremantle learned via a wireless message,196644
Y15lvyyKS44,574.2,12 20 PM,false,12:20pm,being monitored by her dive partner at||12 20 PM she dipped under the water and||worked her way down the wall using it as,288698
r1DtX48TKuI,296.7,12 20 pm,false,12:20pm,outside of your cell again all day||alright 12 20 pm line up orderly file||out to the rec yard,196749
xXXv18D2wd8,990.4,12 20 pm,false,12:20pm,all the bombers made a clean getaway||around 12 20 pm the damage inflicted on the raf base was||extensive but casualties were light,192871
e9Jh8MPC7XY,511.7,12 20 PM,false,12:20pm,the amusement park||around 12 20 PM Abaya brimming with||anticipation boarded the Giant Wheel,186306
RCOUeK509Gs,315.7,12 20 PM,false,12:20pm,based on this appropriate warning||at 12 20 PM rumors were spreading that||the six-year-old boy had a weapon his,160860
OkibnStPjw8,107.9,12 20 pm,false,12:20pm,a train leaves Manchester for London||at a speed of 30 meters per second at 12 20 pm and another train leaves||Birmingham for Newcastle at a speed of,238726
0YRQ_tKCUPw,31.8,12 20 pm,false,12:20pm,police custody the official word coming||in from the doctors is that at 12 20 pm the ex-prime minister was brought to||hospital,106147
4xzLhLbagn0,1825.8,12 20 PM,false,12:20pm,loss on Friday April 23 2021 at around||12 20 PM CJ was shot and killed on||Alberta Street in Compton,178726
AGvOtCYSIBo,104.9,12:20 p m,true,12:20pm,"today cuz I'm gonna be wearing it all day with timesI||It is currently 12:20 p m||I wanted to start this a little bit earlier, but",437612
utMJ6SMWFFE,174.7,12:20 p m,true,12:20pm,"11:55 in here||This is getting pretty, but your flight time has changed the 12:20 p m So am I never gonna get home more like your flight time has changed to",416414
T4Cx23SloIU,118.4,12:20 p m,true,12:20pm,"4 drawings are held twice daily, seven days a week||Midday drawings are held at 12:20 p m and evening drawings are||at 10 p m",240234
UClkhSanm_0,118.5,12:20 p m,true,12:20pm,"3 drawings are held twice daily, seven days a week||Midday drawings are held at 12:20 p m and evening drawings are at 10 p m||Central Time",233738
oaNe_rtwWEk,692.1,12:20 p m,true,12:20pm,race day to day and on the||weekend racing today is expected to begin at 12:20 p m Denis Walters||reports Richard long more general manager of the Jamaica Racing Commission,117575
oANvEklxWGc,327,12:20 p m,true,12:20pm,say they did not know about the 911 call||A few minutes later at 12:20 p m park as can be seen walking away||from the school,127470
o_pXIm232l8,191.1,12:20 p m,false,12:20pm,at the speed of 30 meters per second at||12:20 p m and another train leaves||Birmingham for Newcastle are the speed,3713006
FBO3Kqv-3Ag,176.3,12:20 p m,false,12:20pm,London at the speed of 30 meters per||second at 12:20 p m and another train||leaves Birmingham for Newcastle at a,2771824
MKnwzeGsH_s,146.5,12 20 p m,false,12:20pm,it was||12 20 p m with plenty of time left in||the day i stayed inside i knew it would,2358350
sj32mxbLLJU,195.4,12:20 p m,false,12:20pm,London at a speed of 30 meters per||second at 12:20 p m and another train||leaves Birmingham for Newcastle at a,1970431
vISPbjWqFiU,179.2,12:20 p m,false,12:20pm,you should reach your destination by||12:20 p m arrived and Luke's parents||house and now I'm set up everything,1820577
LaWxl9N4ubc,281,12:20 p m,false,12:20pm,London at the speed of 30 meters per||second at 12:20 p m and another train||leaves Birmingham for Newcastle at a,1598307
peH-Rf4NB5Y,1113.4,12:20 p m,false,12:20pm,carjacking of a truck||at 12:20 p m on began looking for the||vehicle on the ground and from the air,1314490
97GVcUGdpf8,80.7,12 20 p m,false,12:20pm,here's a confirmation email march 26 at||12 20 p m is when they received my order||and obviously while i was waiting for,1081086
gDhpEaqUelI,258.2,12 20 p m,false,12:20pm,to purchase pasties as well as a meat||pie at around 12 20 p m with a one-pound note and while||insignificant on the surface there were,1260466
65rUlirPCjI,2594.3,12 20 p m,false,12:20pm,the end of the world is almost here||april 19 1993 12 20 p m after a 51-day siege in waco texas||the branch davidian compound is a,1071327
_XYiVsYGqmw,589.9,12:20 p m,false,12:20pm,the speed of 30 meters per second at||12:20 p m and another train leaves||Birmingham for Newcastle at a speed of,1021412
haMGrP0tViI,727.6,12:20 p m,false,12:20pm,want it to happen but you||I'll do it so it is indeed 12:20 p m we||got ourselves 31 slots down I don't know,963359
55xr6GPo-NY,164.6,12:20 p m,false,12:20pm,not go to class so I had tell in the||21st December and 12:20 p m my labor||started on the 20th at about 6:00 a m,867467
FdYWili3n3U,315.3,12:20 p m,false,12:20pm,fine it was this was at midnight||I got chef is like around 12:20 p m right okay you know what it's cool what||a big man let's do,861498
lq2HcCCZe4Q,359,12 20 p m,false,12:20pm,a train leaves manchester for london||at a speed of 30 meters per second at 12 20 p m and another train leaves||birmingham for newcastle at a speed of,706565
3VHvoClQe8o,3107.4,12:20 p m,false,12:20pm,that's a quite significant developers at||12:20 p m on Friday the party room||reconvened,694026
vj7axiD8YRQ,46.6,12:20 p m,false,12:20pm,birthday but anyways I just woke up it||is 12:20 p m I know you're thinking||Amanda really twelve o'clock you wake up,639823
7hv2hTUfc5s,72.3,12:20 p m,false,12:20pm,twenty minutes now the test was started||at 12:20 p m and around 2 hours later||the iPhone 6 was at 44,526630
pFOmmJRQVB4,429.5,12 20 p m,false,12:20pm,that has taken place earlier this||afternoon at about 12 20 p m near kunur in tamil nadu this this is||at the qatari,512002
8Vey53Tm2vw,815.9,12:20 p m,false,12:20pm,59 feet the location is in white Solomon||Texas and the time was 12:20 p m and||this was in 1995 December 12th nobody,561285
AGvOtCYSIBo,109.9,12:20 p m,false,12:20pm,wearing it all day with timesI it is||currently 12:20 p m I wanted to start||this a little bit earlier but it is me I,437612
8UA75Sy6rJU,49.9,12 20 p m,false,12:20pm,2009 paramedics received a call||right at around 12 20 p m of a||male that lived here that was,448644
utMJ6SMWFFE,176.7,12:20 p m,false,12:20pm,pretty but your flight time has changed||the 12:20 p m so am I never gonna get||home more like your flight time has,416414
VeAIbXUjff4,334.4,12 20 p m,false,12:20pm,from a self-inflicted gunshot wound||about 12 20 p m gardner's attorneys stu||dornan,395611
AcPpyozFohI,298.6,12 20 p m,false,12:20pm,murdered sometime between||12 20 p m and 1 40 p m||we were able to get the receipt so we,600606
AcPpyozFohI,1020.6,12 20 p m,false,12:20pm,stain||and where was ken between 12 20 p m to 1 40 p m the time of his wife's||murder,600606
suCqA6BZXLg,369.3,12 20 p m,false,12:20pm,lasted over three hours and ended||abruptly at 12 20 p m it turned out it was a neighborhood dean||with an air gun shooting at squirrels,305301
rmWx-ThYe0Q,95.9,12:20 p m,false,12:20pm,made it to my hotel room I am in||Long Island New York it is 12:20 p m and I've had a long day per usual very||cold here I think the,280652
Xa7OBm8SRZg,2592.7,12:20 p m,false,12:20pm,here||April 19th 1993 12:20 p m after a||51-day siege in Waco Texas the Branch,322933
5SG_sCb0HhA,4.4,12:20 p m,false,12:20pm,every Wednesday at 12:20 p m 13-year||old amber Offerman Skyped from school||using sign language with her dad who was,264554
cMDEL6xI5w0,184.9,12:20 p m,false,12:20pm,through something I'm trying to go do||the rest of my day 12:20 p m who is it||Casey from the job please text message,266164
Lj4YxVZWLVU,427.4,12 20 p m,false,12:20pm,12:45 p m||1220 hours is equal to 12 20 p m for for the time from 1300 hours to 2359||ours subtract 1200 hours from the,418080
eTuHpR4csHc,212,12 20 p m,false,12:20pm,twitter turned violent on saturday||around 12 20 p m on saturday philip||anderson the main event organizer,236366
hoFMaLWIV7M,980.6,12 20 p m,false,12:20pm,up some keem in here||good morning everyone it's 12 20 p m so it's actually not morning||oops so today we are making,344225