id,timestamp,token,manual,time,lines,views
NjBpj1HdkNw,642.2,2:46 AM,true,2:46am,"upbeat music||we made it Saint George, it is 2:46 AM||11 hours, 17 minutes, 18 seconds",2746122
BYeWJc-VE6U,543.5,2:46 am,true,2:46am,"that he offered my new friend a job||By 2:46 am that morning,||the game was complete",1419900
iKWaCElca4I,456.8,2:46 AM,true,2:46am,"Music||its 2:46 AM now, and we've travel all and came back,||we're very sleepy, now we",923267
_waT9H9sFJ0,86.3,2:46 am,true,2:46am,"and lining up for an all-out assault||And wouldn't you know it, come 2:46 am ,||he wasn't looking too chirpy",844701
BYeWJc-VE6U,543.5,2 46 am,false,2:46am,that he offered my new friend a job||by 2 46 am that morning the game was||complete i had finally earned the right,1419900
t7hoGVBG7_s,1007.8,2 46 am,false,2:46am,with a gentle breeze from the northeast||the buckling made radar contact at 2 46 am an able called the crew to general||quarters at the time the submarine was,330924
I_QNhEvFNeY,4.3,2 46 am,false,2:46am,part one bryce hall went from yo where's||my hug at to reddit 2 46 am taylor||holder went from yester i'll bring her,253026
0WD5KkZmxds,37.4,2 46 am,false,2:46am,the current time||it's 2 46 am i'm getting off around 6||so i'll see you then good morning guys,251300
wx7Cpbn2W-Y,1894.4,2:46 am,false,2:46am,of probably like three hours that night||2:46 am Marcus terrifies demons and||shits Go Go demons nurse get away from,120827
uAyHk_--YOM,161.9,2 46 A M,false,2:46am,in the morning||at 2 46 A M biscuit face||oh this guy I hate this game this game,1092940
JWT_Er6Y2J8,200.5,2:46 a m,false,2:46am,obtained by CBS 11 in Dallas and it||happened at 2:46 a m see him being||ejected from the car that is crazy I,675274
cfn58Addwsk,647,2 46 a m,false,2:46am,are given straight away||at 2 46 a m annie was finally given||antibiotics more than an hour after she,587094
U-AMHid1yEk,1036.5,2 46 a m,false,2:46am,that he offered my new friend a job||by 2 46 a m that morning the game was||complete i had finally earned the right,670747
2mQt9U2f7lQ,582.6,2 46 a m,false,2:46am,'t have a job do i look like i ain't||got it it's 2 46 a m okay||i'm not worried about your job if you're,386969
eBqua65_YpI,442.6,2 46 a m,false,2:46am,2 46 p m||it feels like 2 46 a m i'm gonna do a||little bit of a watch through with will,382437
QPXes0POxRE,367.8,2 46 a m,false,2:46am,sleep hard work and time off ha||what is sleep lexi says at 2 46 a m when||your mom tells you to hang out with your,410903
JBrI6FKErYU,260.4,2:46 a m,false,2:46am,it's recording this we are as of||recording this at 2:46 a m we are at||544 subs now that might not sound like a,235155
zAjuUZlpNfM,162.8,2 46 a m,false,2:46am,going to be Malik Davante but we settled||on the Aaron Devonte Miller born at 2 46 a m 7 ounces||long and as as you came out my womb you,158734
jcwo8jZJys4,225.4,2 46 a m,false,2:46am,back in my parents basement in missouri||at 2 46 a m back when i brought the wallaby into||barcelona when dave almost like was,156485
m18Si16U_Yo,70.6,2:46 a m,false,2:46am,festival on the Las Vegas Strip now at||2:46 a m her account was deleted||entirely but it wasn't until nearly an,106924
m18Si16U_Yo,121.1,2:46 a m,false,2:46am,she then obliterates her accounts at||2:46 a m 45 minutes before the killer's||name is ever released now does that mean,106924