id,timestamp,token,manual,time,lines,views
VWysGxxT4Ug,998.9,7:26pm,true,7:26pm,Laughing||7:26pm||7:26,569577
d9U3iPqzDns,1348.8,7 26 pm,false,7:26pm,of day was not consistent with the map||as i found it at around 7 26 pm trade its pelt into gus for this sweet||chalk horn coat,934827
sE5Hl54bwLM,2402.5,7 26 pm,false,7:26pm,jamaica and belfast||to deliver the coup de grasse at 7 26 pm the cruisers moved in to launch another||torpedo attack on charmhorst,410206
IOKJne13s10,2020,7 26 PM,false,7:26pm,a single trace of Morgan could be found||so at exactly 7 26 PM the lead guide||contacted both police and park rangers,465564
mHhsQZ9hT7I,561.1,7 26 pm,false,7:26pm,he lived||the sun set that evening at 7 26 pm it was around then according to Samer||that he'd last Saw Ravel getting out,405000
X4-qKM2O6zs,866.5,7 26 pm,false,7:26pm,desk clamp and the ladder lamps||at 7 26 pm and yes it works so the win||goes to google assistant,307314
0hWQD4ivp5o,191.1,7 26 pm,false,7:26pm,conrad returned to his apartment he||departed at 7 26 pm in a taxi which took||him to cleveland hopkins international,126649
XTBAaTW5PPM,283,7 26 p m,false,7:26pm,a uh meeting for um||7 26 p m october 20th um oh would you||look at the time hey,2931156
7v6mLilUO4U,26.3,7 26 p m,false,7:26pm,from 6 00 am to what time is it right||now 7 26 p m i've been playing this game for||13 hours today so please guys all i,1440041
_rBO6hiGCxM,63.4,7 26 p m,false,7:26pm,it's gonna take a lot of||trial and error let's see it's 7 26 p m right now who knows how long this||is going to take me but,1017598
597sSGLw_WM,195.4,7 26 p m,false,7:26pm,as Zion Bostic and pronounced dead at||the scene at 7 26 p m a bullet that||grazed the back of his neck another,449439
HKisqCTm60g,1326.1,7 26 p m,false,7:26pm,30||7 26 p m precisely my fault you||don't have a discipline,365149
IpfpvMS34Xg,392.6,7 26 p m,false,7:26pm,time is it||it's 7 26 p m okay right how do you know||i haven't changed out my gym jams,307769
tntDaRno5uE,962.8,7:26 p m,false,7:26pm,alright guys so meal number three it is||at 7:26 p m I'm going to be trying to||eat six of these burritos each Frieda,242302
XUmLfgwWKhs,604.6,7 26 p m,false,7:26pm,local community of the missiles what||guess what time it is 7 26 p m nope Lord||lies it's football time in Texas no lies,236248
pMsVPXzU9oM,933,7 26 p m,false,7:26pm,and it's not dark out all right guys so||it is 7 26 p m right now i just grabbed||duncan i really wanted like a tea and um,251470
48StTOvmibA,185.3,7 26 p m,false,7:26pm,it's 7 30||7 26 p m precisely it's my||fault that you don't have a discipline,256110
6-tavI2gVOo,9.3,7:26 p m,false,7:26pm,controversy this is Kim cotton was||delivered of a healthy baby girl at 7:26 p m both mother and child are well Kim||cotton was Britain's first commercial,228474
hbOgG0rczBk,1144.8,7:26 p m,false,7:26pm,in there as well alright let's go ahead||and take a nap uh at 7:26 p m let's||sleep for twelve hours get a nice long,227895
diS8KPqWBPY,712.5,7 26 p m,false,7:26pm,managed to get in||so right now it's 7 26 p m and my hair is so itchy and my hair is||getting old,151404
_UJED6JGE40,568,7:26 p m,false,7:26pm,7:25 p m||7:26 p m who is she talking to Jim for||17 minutes so let's think they're,141164
xWs6yLb1kBQ,20.8,7 26 p m,false,7:26pm,here in canada||and looking like we got about a 7 26 p m in the evening in my||favorite country indonesia where we are,124807
4jznt_yrS9k,276.2,7:26 p m,false,7:26pm,Marie what time is it officially right||now 7:26 p m we are at another target||location and I'm actually feeling I'm,105069