id,timestamp,token,manual,time,lines,views
HNzcWKvn__c,292.1,7:32 PM,true,7:32pm,new Army Chief Zia-ud-Din Butt and his forced retirement||At 7:32 PM General Musharraf ordered General Iftikhar that the Triple One Brigade||which controls martial law and,968372
SbcKh9q5mqc,90.3,7:32 pm,true,7:32pm,"for a night full of parties and entertainment||However, at exactly 7:32 pm , all hell broke loose||as rumors of a plane taking off without authorization",315634
7EsfLP6Eel8,0.1,7 32 pm,false,7:32pm,at 7 32 pm tonight it's officially my||birthday and we're on a mission to bake||the,4165426
MXSsExiIK-g,40.7,7 32 pm,false,7:32pm,somebody could be doing naughty things||at 7 32 pm there's absolutely zero percent||dude the first person oh my god this,1487071
w60uvrj8PtQ,613.1,7 32 pm,false,7:32pm,withstand||the weight of its mistakes at 7 32 pm the flag of the russian federation||rose in the place of the soviet flag,1233892
Qao3sZC8okE,48.8,7 32 pm,false,7:32pm,have been building for some time around||four years to be exact at 7 32 pm the||red soviet flag with its gold hammer and,1282173
45vLuly-Jng,511.9,7 32 PM,false,7:32pm,initially planned||March 12 2016 at 7 32 PM a harrowing||phone call was made to the authorities,1457342
CFz-OrU8esA,365.4,7 32 pm,false,7:32pm,the right direction for takeoff||at 7 32 pm richard starts rolling up the||runway preparing for takeoff,789522
TynRU1cUsYM,67.8,7 32 pm,false,7:32pm,appeared on the screen||june 5th 2021 7 32 pm then a picture||with an hourglass appeared,340849
oOgVjd_FoVE,1045.2,7 32 PM,false,7:32pm,canaris was booked on May 12th at 6 35||pm and released at 7 32 PM just a couple||possibilities for the discrepancy are,153788
thpEVYxCmK0,117,7 32 pm,false,7:32pm,official tweet from the sims team||tweeted at 7 32 pm yesterday august the||29th so soul simmers tomorrow august,135869
uLGhq51_4Nk,117.4,7 32 pm,false,7:32pm,that phone was used||at 7 32 pm and the phone call was finished at 8 02||pm,132779
f12CIYgihXo,283.8,7 32 pm,false,7:32pm,2007||at 7 32 pm something very very bad happened but I||can't get into too much detail s,128402
1F_D3jhIPfM,378.1,7 32 pm,false,7:32pm,somebody could be doing naughty things||at 7 32 pm there's absolutely||zero percent,110491
HqgcAF6YNT0,533.3,7 32 pm,false,7:32pm,but everything went well||baby is healthy i gave birth at 7 32 pm still don't know the weight i'm||not quite sure if i'm able,107685
MmXZsFV-gP8,868.2,7 32 pm,false,7:32pm,you should all go inside the cabin meet||me by the gas station at 7 32 pm where's the gas station it's down||there,427446
KQhvsvD_NIo,412.4,7:32 p m,true,7:32pm,a maintenance area into a position where he was able to take off and at 7:32 p m That's exactly what he did||He took off without clearance and he ended up,1316173
8oB2d71q14k,238.1,7 32 p m,false,7:32pm,milan to sleep yeah it is 7 30 22||anyways it's 7 32 p m and we had to put||milan to sleep first all right let's go,7561328
HCzfsYg7OcY,61.9,7:32 p m,false,7:32pm,controllers when it barged onto the||runway taking off Friday at 7:32 p m at||the controls 29 year-old Richard Russell,3618521
d4DLzioGq5M,59.4,7:32 p m,false,7:32pm,hint of any action like this from the US||absolutely you know at 7:32 p m local||time,2505762
BVYjyO24EqM,1372.4,7:32 p m,false,7:32pm,you should all go inside the cabin meet||me by the gas station at 7:32 p m got||it alright so we're going into the cabin,1929928
BVYjyO24EqM,1379.5,7:32 p m,false,7:32pm,her at the gas||station at 7:32 p m night for I'm glad||you all came it's truly a pleasure okay,1929928
7fpCTClt4f0,7.4,7 32 p m,false,7:32pm,the end of today's video me bored all||day 7 32 p m oh no you're not going to bed tonight my||guy,1432369
ywLSAfFFFVc,308.7,7:32 p m,false,7:32pm,mission begins on Good Friday and was||all captured on CCTV at 7:32 p m a||barefoot Cory Lovell walks into a,1229357
9TWv5t1Ad1A,640,7:32 p m,false,7:32pm,begin to talk in private messages almost||exactly an hour later at 7:32 p m Eastern Standard Time desmos begins a||new common thread and stickies it having,963443
aEVKGAMB8Q8,63.9,7 32 p m,false,7:32pm,job as usual||at 7 32 p m local time in afghanistan||the u s air force dropped the largest,835876
eEk_CEd8ywM,594.5,7 32 p m,false,7:32pm,she's going we're on a time crunch the||invitation says strictly 7 32 p m o'clock||we didn't this actually took us to the,716060
LKhEOeLvspo,482.1,7:32 p m,false,7:32pm,sign up for this actually I have text of||you signing up at 7:32 p m I say ghost||7:33 p m,485069
5g7JbkOI7jA,884.9,7:32 p m,false,7:32pm,this isn't the gas station 94||7:32 p m yeah and glad y'all came to||truly make it fresh day I'm staying,319871
e20C2Oy12eI,1075.5,7:32 p m,false,7:32pm,so that's the video dinner life right||now it is 7:32 p m team's wrapping up||dinner we're wrapping up today and we'll,315400
7ruIulLr6L4,1396.6,7:32 p m,false,7:32pm,know you should all go inside the||cabin meet me by the gas station at 7:32 p m got it what Cassie should know that||gas station I've never seen okay okay,384650
jMsl0T5-BkM,1483.3,7:32 p m,false,7:32pm,got the notification again here you go||7:32 p m failed so two times of the||tenure failed and failed,267652
X75eAnTTMkA,432,7 32 p m,false,7:32pm,composting experiment right here now it||is 7 32 p m and i specifically waited||until the evening because i want to try,320323
SbcKh9q5mqc,90.2,7 32 p m,false,7:32pm,and entertainment||however at exactly 7 32 p m all hell broke loose as rumors of a||plane taking off,315634
KeNRcXU2QOM,5.8,7 32 p m,false,7:32pm,10 hidden blobfish today you win me||board all day 7 32 p m Oh no you're not||going to bed tonight my guy oh,311789
ABN5IscV5-8,490,7:32 p m,false,7:32pm,play-by-play like and then we switch||over to Nightwing at 7:32 p m like||we're not we're not going to we're not,191910
a7InU7OCrQA,774.2,7:32 p m,false,7:32pm,8th of October mystery so 8 on 8 of||October I use this stopwatch at 7:32 p m and if I press it just appear then||it will show the left sound that,197279
3gWrLEhRkjM,435.3,7 32 p m,false,7:32pm,November 22nd out above the Indian Ocean||at 7 32 p m here we go another unknown||object right there high speed object,171615
vdJAKCf--KE,2312.4,7:32 p m,false,7:32pm,bridge||7:32 p m shipboard time nice work sir||the payoff from redstone really got us,170329
PIV0Q4Q-EGA,994.8,7:32 p m,false,7:32pm,appointment request and I just got the||notification again here you go 7:32 p m failed so two times of the ten you||failed and failed,130587
U-DVP8AShw0,80.7,7:32 p m,false,7:32pm,Eastern time at||7:32 p m Eastern time the ghost City||Weather Service radar indicated a severe,142513
9cRLM8qx5Gw,51.1,7 32 p m,false,7:32pm,know||the huge now it is currently 7 32 p m i'm wrapping up my work day i did a lot||of youtube stuff today,100405
uqVBT3cisoo,649.1,7 32 p m,false,7:32pm,here||time check of the day it's 7 32 p m june june 13||sunday happy sunday okay so,110580