id,timestamp,token,manual,time,lines,views
atygHJANu-8,1082.6,7:33 pm,true,7:33pm,trash can out||2 calls were made by Marco on 5:25 pm and on 7:33 pm The following day on 7:30 am Marco Schulze||is seen driving to their home,159667
mhkn959Tr6g,533.4,7 33 pm,false,7:33pm,disconnected we're calling the police||update 7 33 pm the sign of jeremy||tried calling him but his phone has been,1844842
PMh68jxKzac,688.5,7 33 pm,false,7:33pm,perfect conditions for takeoff||at 7 33 pm richard bieber russell||officially took to the skies from seatac,1023431
b5U78RA_bh4,119,7 33 PM,false,7:33pm,responded to the Luxor Hotel and Casino||this past Saturday at 7 33 PM after a||report of a fight and determined sun and,667320
Bg3-42S80xM,220,7 33 PM,false,7:33pm,around him that day it's my knowledge||yes from 221 to 7 33 PM the defendant||was at dpd headquarters at 2 54 the,598617
kaffk9qHpyQ,274.9,7 33 pm,false,7:33pm,this is a cctv footage you have the time||stamp here 7 33 pm on the third of april||that's last night one of the policemen,125069
C_HWrVeYP5E,1020.3,7:33 p m,false,7:33pm,the things were spiraling out of control||7:33 p m the reactor designers at||Babcock & Wilcox at last get a phone,1313772
Ej1Wegylzaw,311.8,7 33 p m,false,7:33pm,do you know what time it is mister||uh it's 7 33 p m you were supposed to be back here||two and a half hours ago from school,1182110
LKhEOeLvspo,484.8,7:33 p m,false,7:33pm,I say ghost||7:33 p m every slow response time I||must say do it I'm going to play a,485069
mpkIRh_T4sw,1757.5,7 33 p m,false,7:33pm,no that's not true because i was just on||the phone with her at 7 33 p m and then||she was talking smack about me for two,331549
OFjmUOuxCDU,38.1,7 33 p m,false,7:33pm,i've got up until about half seven well||7 33 p m on monday today to make the||best team i can possibly make so here we,357780
VL_1Lh_Ch9A,878.3,7 33 p m,false,7:33pm,fight and i put down delirium||at 7 33 p m i now had every single completion mark||with,396812
-tudC7KCsZg,933.1,7:33 p m,false,7:33pm,thing we're from this video like a||week in advance 11 hours so far 7:33 p m time update it's this time this is||the long I've been doing yeah,191324
pTPEzxAWBto,630.7,7:33 p m,false,7:33pm,that's pretty terrifying when Valentich||did not arrive at King Island at 7:33 p m search and rescue immediately||sprung into action,208434
FCBcbm-jN9M,135,7:33 p m,false,7:33pm,do you remember anything||of course sunset 7:33 p m moon was||waxing crescent dinner was Cornish hen,217392
atygHJANu-8,1156.5,7:33 p m,false,7:33pm,p m||and on 7:33 p m so it's rather||unlikely that within to us he drove 40,159667
3g8TWAS6QVY,639.1,7:33 p m,false,7:33pm,five home assistant today is January||11th 2048 at a 7:33 p m room||temperature 20 degrees Celsius you have,152255
kaffk9qHpyQ,470.5,7 33 p m,false,7:33pm,him inside the temple time stamp also on||your screen right now 7 33 p m on the||3rd of april that's that's last night,125069
zMLRb7-XBbo,203.9,7 33 p m,false,7:33pm,and the girl told us a while ago||or young store and it's currently 7 33 p m so let's try namaka haba and makahana||or even two let's see but,123863
39IidjiXeg8,34.1,7:33 p m,false,7:33pm,Monday the 25th I think it's currently||7:33 p m I never in a million years||thought that I'd be making this video to,108924
BktiosivJfw,549.3,7 33 p m,false,7:33pm,melrose district today||7 33 p m so that's a video of our house||that's our house look that was,100369
WK9E_C3o3hA,505.3,7:33 p m,false,7:33pm,they did won't you huh||you're alive to collect yours 7:33 p m before leaving the area we interviewed||three other witnesses two of them,134598