id,timestamp,token,manual,time,lines,views
Rir2MpfLsRQ,672.1,10:21am,true,10:21am,"The execution took place||at 10:08am, and by 10:21am he had been declared dead||However what happened to the remains of Rudolf Hoss after",278418
M-rLql8-XaY,2362.6,10:21 am,true,10:21am,Narrator: New York||10:21 am||Twenty-two minutes after,197353
Kfh5DrDhon4,62.7,10 21 AM,true,10:21am,THE MOTHER BABY UNIT AFTER||ARRIVING AT THE HOSPITAL AT 10 21 AM ON SATURDAY||OCTOBER 22ND,44150
tzUlyvHdozs,2533.6,10:21 AM,true,10:21am,"remains afloat||At 10:21 AM , Tovey ceases fire||The cruiser Dorsetshire moves in to sink Bismarck with torpedos",40860
Tn_aRSb0Msc,500.5,10:21 AM,true,10:21am,"circled outside the church office, entered, exited, and then passed the children's ministry||At 10:21 AM , Audrey walked down a hallway, looked to the right, where the hallway intersected||with another",11285
-J0m-pystZs,82.7,10:21 AM,true,10:21am,"FIRST TWEET POSTED YESTERDAY||10:21 AM -- IT SAID ""I AM BACK||AKINS GET READY"" -- FOLLOWED",5266
DyXHXXUydts,919.2,10:21 AM,true,10:21am,"Bye||On Thu, May 5, 2022 at 10:21 AM Beth Alvarez wrote:||Hey, everyone",2627
5XexSRNUgbU,964.3,10 21 am,true,10:21am,i need to shut down power to this room||10 21 am hello today i'd like to go||back to something you said stop please,1512
9UTMOrk8tGU,316.1,10:21 AM,true,10:21am,"6th, one day after -- at least -- the reburial pit had already been dug||This is 10:21 AM||About half an hour later, David Crass kicks the letter upstairs to his bosses",1098
9UTMOrk8tGU,322.1,10:21 AM,true,10:21am,"Now reburial instructions are in the letter||They weren't at 10:21 AM||And now the letter is no longer addressed to Vice President Darden, now it's",1098
-8oTnFDBDLU,19.6,10 21 am,false,10:21am,let me just tap him real quick||he won't do anything it is currently 10 21 am and it just got announced that||there are no rules I better go oh my,1890225
Q6pCwD6tW4Y,105.3,10 21 am,false,10:21am,corrections||thursday may 17 2018 at 10 21 am when do you think is the first time you||had a camera,404731
Rir2MpfLsRQ,671.6,10 21 am,false,10:21am,the door when it opened the execution||took place at 1008 am and by 10 21 am he'd been declared dead||however what happened to the remains of,278418
tOH2KNxKMw8,371.5,10 21 am,false,10:21am,9 05 am Rick only calls to the police at||10 21 am state troopers were already on their way||as a call had been automatically placed,115356
rtDhwqq2eQs,184.2,10 21 am,false,10:21am,reappear and walk into a different room||at 10 21 am they are seen walking||through a different hallway past a sign,125232
DWjIXutKLls,166.1,10 21 am,false,10:21am,wasn't a part of her plan though||at 10 21 am the first set of responding||officers arrived at the scene the hunt,337439
r9nugnuWp70,167,10 21 am,false,10:21am,normally do banter||10 21 am on a saturday um but||it i got the time and today's uh you,52827
-F_6eoPIhfk,85.1,10 21 am,false,10:21am,and you can see here that i last did it||yesterday at 10 21 am and what will happen is inside of the||plex web app you'll get a,90064
Q-BJ4ZLyUhI,56.3,10 21 am,false,10:21am,i bet you missed that didn't you right||now in clown town it's 10 21 am on||monday,39561
lu1fKiNNPEg,618.3,10 21 am,false,10:21am,where am I||10 21 am okay||because some of us are,34573
fn9vbEsdeo0,552.2,10 21 am,false,10:21am,my rent payment in the morning you can||see the time stamp there of 10 21 am then later on in the evening I checked||my AmEx site again now it's,43761
KtSVpfvd1oQ,2,10 21 am,false,10:21am,Justin put on his headphones again the||man in the headset continued at 10 21 am bird hit the plane and at that moment||the time jumped to exactly 10 21,24247
OCVxxuG_-a0,51.6,10 21 am,false,10:21am,is||10 21 am and i'm just packing it's day||one,16769
PZuWTPlc6ho,398.2,10 21 am,false,10:21am,did we didn't have a chance to review it||10 21 am attorney for polowski is||referring,15624
iSvHtV2HSSg,166.3,10 21 am,false,10:21am,exposed facility||we did have that soft capture at 10 21 am central time we're pulling in using||that soft capture ring,14174
EPYQpolo_Jo,981.5,10:21 am,false,10:21am,all right what is this monster Anubis||rising 10:21 am i reading all these||mails one of the ones I have like a,11908
LxqZOb68mrA,20,10:21 a m,true,10:21am,the International Space Station||SpaceX's Falcon 9 rocket experienced a problem after liftoff at 10:21 a m||Eastern time,117249
W63W8jnJg9s,440.7,10:21 a m,true,10:21am,Almost an hour in||It's 10:21 a m||right now at this point,22629
dSMhZuKyGm0,332.7,10:21 a m,true,10:21am,"""Good night ""||""It's 10:21 a m , by the way ""||Maybe we've gone too far",17713
DQX1kajzy0M,9.2,10:21 A M,true,10:21am,FROM THE OFFICE OF COMMUNICATIONS||WE ARE HERE PREPARING FOR A LAUNCH SUNDAY MORNING AT 10:21 A M EASTERN TIME||OF SPACEX'S 7TH COMMERCIAL RESUPPLY MISSION TO THE,8401
DQX1kajzy0M,2572.6,10:21 A M,true,10:21am,THANK YOU ALL FOR JOINING US TODAY TO TALK ABOUT PRELAUNCH||PREPARATIONS FOR SUNDAY'S 10:21 A M EASTERN TIME LAUNCH||PREPARATIONS WILL CONTINUE AND OUR BRIEFINGS WILL CONTINUE,8401
L1hzLzkorLw,12.7,10:21 a m,true,10:21am,"magnitude 4 7 earthquake near Wells, Nevada,||today at 12:21 Central Daylight Time or 10:21 a m Pacific Standard Time||That 225 people reportedly said they felt here's",7562
7Hs6VssDHMs,330.5,10:21 a m,true,10:21am,but the next check-in we'll probably what time is it is 10:00||10:21 a m six hours should be enough now you can see by looking at this with||things,5945
tMnhhDkaKG0,86.2,10:21 A M,true,10:21am,"SHAKEOUT THIS MORNING IS GOING||TO HAPPEN AT 10:21 A M||STOP WHAT YOU'RE DOING, DO THE",3765
5VQhaRkyYE8,712.5,10:21 A M,true,10:21am,earlier for a friend of mine||So October 2nd Jerusalem time of 6:21 pm is 10:21 A M Central time||October 3rd Jerusalem of 6:20 p m,1594
C_4eNjKEt4U,445.7,10:21 a m,false,10:21am,like prepping myself right now||10:21 a m that's a random time I||expected I wonder what like made it fall,5894880
5hruIuLLR4o,258.3,10:21 a m,false,10:21am,have to do he's predict that one's going||no it's cool 10:21 a m but what you||don't know is that we're not gonna be,5099187
8-e2xYnAn0c,64.4,10:21 a m,false,10:21am,DNC staffer responded to that email at||10:21 a m the next day with a series of||questions from herself,1103913
q-KxJRslzHM,258.6,10 21 a m,false,10:21am,oh my god||what time is it for me it's currently 10 21 a m just choosing to pogo and jump over the||uh,809542
Z9HpgKwmWsg,268,10:21 a m,false,10:21am,now Brooklyn she's upstairs is what time||is it baby it's 10:21 a m she is||sleeping out I don't know if I should,417093
J42hUurEfpE,2801.9,10 21 a m,false,10:21am,what we're gonna do that's going to eat||it it's currently 10 21 a m my flight starts to board at 11||so i have more than enough time and,285139
T2iNUZsZb_Y,107.2,10:21 a m,false,10:21am,I've in charge it for everybody I said||from 1:45 it's 10:21 a m holy jazz and||today we're gonna go for like we're,203403
5ZXu_Bj8kFs,230.2,10:21 a m,false,10:21am,here you can see it's currently 10 oh||wait a second 10:21 a m and it flickers||back and forth and says the next time,245816
hgEQg8alvME,404.6,10 21 a m,false,10:21am,pisces||this happens at 2 21 am pacific and 10 21 a m uk time this is the||perfect time to set a new beginning set,153292
f2vgulUQd2A,284.1,10:21 a m,false,10:21am,I'm not gonna stop oh I feel so tired||today the time is at 10:21 a m we woke||up about an hour and a half ago,154519
vIiG04sw1ss,361.9,10:21 a m,false,10:21am,to put our boots on we're all right it's||10:21 a m and it's time to explore I am||just so darn nervous about getting,151954
LxqZOb68mrA,22.3,10:21 a m,false,10:21am,SpaceX's Falcon 9 rocket experienced a||problem after liftoff at 10:21 a m Eastern Time Hans connexin||vice-president of mission assurance for,117249
imstYQw372s,546.2,10 21 a m,false,10:21am,this is quite awesome actually yes happy||Vending Company 10 21 a m okay here's||the search I'm totally freaking run I I,127565
pOLNjY6FpPw,78.3,10 21 a m,false,10:21am,up one late morning on a day off at||around 10 21 a m you'll learn why I||remember this four years later in just a,104753
A764VmNQTsI,408.1,10 21 a m,false,10:21am,next day||it is 10 21 a m i just woke up||and i usually wake up a lot sooner than,106581
XdhUVYUrdik,944.8,10 21 a m,false,10:21am,guys makeup and hair is done it's||currently 10 21 a m I ordered food||whilst I was doing my makeup because I'm,107172
14Mmo1rEG00,13.7,10:21 a m,false,10:21am,really early in the morning it is||10:21 a m and the reason I'm up so||early is because I basically slept all,100267
6fMHbR2Nlbw,91.4,10:21 a m,false,10:21am,we're on our way to our practice it is a||beautiful Thursday morning at 10:21 a m get off the bus you guys are getting off||the bus Kathy how cold is,92683
8uRLX7TGSis,1257.3,10 21 a m,false,10:21am,it||it's uh 10 21 a m we're still officially in what i call||the morning bite,125538
bTybfEOvKcU,468.6,10:21 a m,false,10:21am,so so let's go ahead and do that what||time is it Ellis 10:21 a m and we at||the bar drinking I'm Ben um okay so we,80315
t2_xuL_aYrE,231.5,10:21 a m,false,10:21am,or Sephora in fact this morning I got an||email at 10:21 a m Central time and it||says u + Sunday Riley equals perfect,76377
84z8aTOd49c,117.9,10:21 a m,false,10:21am,70 but let's look at the||clock ATL + ticketed him at 10:21 a m so you still had 40 minutes 40 minutes||another viewer emailed us my parking,75397
HldAKF5vWeE,392.2,10:21 a m,false,10:21am,yelling loudly to open the big door||10:21 a m Shelley Allen groves calls||911 and I was still on 911 at this point,66006
HcvXtZoSoY0,176.5,10:21 a m,false,10:21am,satellites now cast away by Sergey||ryazanskiy at 10:21 a m this being the||TNS zero satellite a good deployment a,65074
asuybGFBPa0,903.8,10:21 a m,false,10:21am,pick up Harley's trail again so I can||find it number 14 10:21 a m hello||Madeline I'd like to go back to,63566
MIPW3q5B99I,65.9,10 21 a m,false,10:21am,for testing are possibly on the books||today through the rest of the week at 10 21 a m Eastern Time on July 16th the||Dragon capsule for NASA's crs-25,61801