id,timestamp,token,manual,time,lines,views
_AvSbnbRRCU,268.8,10 34am,true,10:34am,went missing||The vehicle was also captured passing a Light City Bus at about 10 34am on May 9 where a||woman who exited the bus walked past the car,248934
V3dRYH0BQbQ,241.4,10:34am,true,10:34am,"trips, like I'm one of those type A people who really is like, ""at||10:34am , we're going to be doing this thing, and we have 14 minutes to||walk",1111
3MqJzMvHE3E,1114.7,10:34 am,true,10:34am,this constantly in lots of different experiments||But I think the most recent ones at 10:34 am are the ones that I want||Let me grab that,134214
vJrNEZypOjA,323.4,10:34 AM,true,10:34am,"really not going LOL||You can see that the production sent her a message at 10:34 AM and by 11:28 AM she had replied||However, on the show they said they",45341
A-FMvs5DA9M,123.3,10 34 AM,true,10:34am,INTO A WARMER NEXT TO AN||OPERATING ROOM AT 10 34 AM||AUGUST 19TH,18763
ql13x7_LTBg,62.2,10:34 am,true,10:34am,"Launch time will be||between 10:34 am and 11:34 am Pacific ”||Over in Boca Chica, here’s a view of the",12649
2lkK9nL12WQ,82.2,10:34 AM,true,10:34am,"But that will change soon||10:34 AM , here he comes||again",23402
KPn0vXS6Dyw,286.2,10:34 AM,true,10:34am,scheduled to tee off for the first round of the Masters tomorrow||Thursday at exactly 10:34 AM and the entire golf world will be watching Woods suffered||serious leg injuries last year,1830
_I9ZWr4sp8g,1663.6,10 34 am,false,10:34am,sodenheimer returned three minutes later||at 10 34 am on a keypad outside the||cockpit he punched in his access code,1240172
Vb7XzJwvzpE,1496,10:34 am,false,10:34am,I know it's a ten so 34||34 cuz there's a 10 some 10:34 am booyah||max can tell time okay all right balls,528444
ItldnYN6D7g,798.1,10 34 am,false,10:34am,pentobarbital and the warden declared||his time of demise as 10 34 am Hartman||was the 49th inmate put down since Ohio,527361
wTf-gi5qmMU,14.3,10 34 am,false,10:34am,and i apologize||i'm truly sorry it's 10 34 am in the||morning and,150234
7zexgv-CVmM,743.8,10 34 am,false,10:34am,sea wall became completely submerged by||10 34 am there should have been barge||based underwater search efforts a barge,127653
3MqJzMvHE3E,1114.5,10 34 am,false,10:34am,lots of different experiments||but i think the most recent ones at 10 34 am are the ones that i want let me grab||that i'm just going to,134214
xPnPNSKkLdI,1996.6,10 34 am,false,10:34am,busted 10 34 okay||10 34 am booyah max can tell time||even a broken clock is right twice a day,109233
xPnPNSKkLdI,2029.4,10 34 am,false,10:34am,three things i guess the exact||time 10 34 am the exact number of||cigarettes and described what her key,109233
X52P4EyFyBo,1216.1,10 34 am,false,10:34am,currently||10 34 am freya and i||dynamic duo we're off to coffee we're,77453
9LAEni8ceE4,346.1,10 34 am,false,10:34am,I know other than myself has a keema||power at 10 34 am pretty cool Fatiha and||they see Chinese noodles at 3 41 PM you,75232
rjOEDkADG4w,276.1,10:34 am,false,10:34am,okay max study every item carefully||10:34 am out of parking bay okay 1034 am||out of parking bay do I have to,69021
18BvqGibuy0,483.4,10 34 am,false,10:34am,ready allowing Heimer to commence his||hanging at 10 34 am and kill him two||minutes later due to his neck having,70013
wB1XsbIBk10,69.6,10 34 am,false,10:34am,is june 16||2021 10 34 am showing 34 my well 34 minute||29 mile 34 minute commute of the fastest,53185
t6cIsgtBYAU,27.8,10 34 am,false,10:34am,new story||on April 26 2018 at 10 34 am a redditor||of the name Mischief Managed would make,49447
1fsBgwOdALA,527.9,10 34 am,false,10:34am,okay quite the comfortable dog hey guys||it's 10 34 am people are in the office||now danish productions as you guys knew,36932
XYyXJqPTtn8,893.1,10:34 am,false,10:34am,remember right||10:34 am booyah max can tell time nice||amazeballs I literally just got chills,26173
vuCiUBovdsk,15.8,10 34 am,false,10:34am,starving it is currently||10 34 am so she's almost been alive for||12 hours,27117
im-S6v0Jlo0,58,10 34 am,false,10:34am,right into it this is happening on May||5th 2023 at 10 34 am Pacific Standard||Time AKA 1 34 p m eastern time on May,51900
zeDRzkMMrEQ,58,10 34 am,false,10:34am,three hours ago according to central||Daylight Time is currently 10 34 am and||they do not have a moment tenser ball,17211
EQfFa_liC9Q,464.2,10:34 am,false,10:34am,trade using the breakout strategy again||10:34 am one law entry price was fifty||one ninety four exit was fifty one 87,21236
Qo-iQNXDf1c,2748.3,10 34 am,false,10:34am,it's basically just taken the actual||utc from earlier so of course 10 34 am and converted it into of course my||time zone but also,26880
QQ-zWCDEuXc,1243.7,10 34 am,false,10:34am,is may 6th||at 10 34 am and i have a hair||appointment at 12 so that's what i'm,27078
rLFd_EzrpNI,260.2,10 34 am,false,10:34am,the sun so that means it is just coming||up now because it's only 10 34 am it is||not at its highest point in the sky you,25940
nlP_6_LtiqI,265.6,10 34 am,false,10:34am,pentobarbital and the warden declared||his time of demise as 10 34 am our||Hardman was the 49th inmate put down,13760
ql13x7_LTBg,63.4,10 34 am,false,10:34am,space force base this sunday october||17th launch time will be between 10 34 am and 11 34 am pacific||over in boca chica here's a view of the,12649
2lkK9nL12WQ,82.2,10 34 am,false,10:34am,the parking lot||but that will change soon 10 34 am here he comes again as he's approaching||the tesla he pulls his keys out,23402
grsxLO4Yxlc,27.6,10 34 am,false,10:34am,damn mess so||i woke up early it's 10 34 am and i need my nails done because||i can't be looking like this my,10863
dtBwgD8fvYg,2093.9,10 34 am,false,10:34am,20-minute conversation||10 34 am Chris transferred more images||of kessinger into his secret calculator,14480
Vb7XzJwvzpE,1497.2,10:34 a m,true,10:34am,Max||10:34 a m||-,528444
oByv7WOm-HY,648,10:34 a m,true,10:34am,"pacemaker implant,||but I left this Earth and went to heaven on June 27th at 10:34 a m||official cause of death, heart failure",223750
7zexgv-CVmM,741.7,10:34 a m,true,10:34am,"continued to be made||As the Sewol became completely submerged by 10:34 a m ,||there should have been",127653
wy0HUVOaDcw,428.9,10:34 a m,true,10:34am,"company||On 22nd May, at 10:34 a m||Eastern Time, the SpaceShipTwo vehicle took off from Spaceport America in New Mexico with",84443
TYYqIvbcqRk,298.2,10:34 a m,true,10:34am,"are looking at breakouts, for example,||and a breakout happens at 10:34 a m ,||that might be a new entry even for a swing trader",44334
ITHNfq6R2lg,38.5,10:34 A M,true,10:34am,WAS READ||10:34 A M TIME||WAS READ,3428
ITHNfq6R2lg,38.7,10:34 A M,true,10:34am,WAS READ||10:34 A M TIME OF||WAS READ,3428
ITHNfq6R2lg,38.9,10:34 A M,true,10:34am,WAS READ||10:34 A M TIME OF DEATH||WAS READ,3428
ITHNfq6R2lg,39.2,10:34 A M,true,10:34am,TIME OF DEATH||WAS READ||10:34 A M TIME OF DEATH FOR,3428
ITHNfq6R2lg,39.3,10:34 A M,true,10:34am,TIME OF DEATH FOR||10:34 A M TIME OF DEATH FOR,3428
ITHNfq6R2lg,39.9,10:34 A M,true,10:34am,TIME OF DEATH FOR||10:34 A M TIME OF DEATH FOR INMATE,3428
ITHNfq6R2lg,40.4,10:34 A M,true,10:34am,TIME OF DEATH FOR INMATE||10:34 A M TIME OF,3428
ITHNfq6R2lg,40.8,10:34 A M,true,10:34am,DEATH FOR INMATE MURRAY||10:34 A M TIME,3428
YJsjF9c9w6Q,5.5,10 34 a m,false,10:34am,okay if the date is september 17th on a||tuesday and it's 10 34 a m what color||sweater would you be wearing,1737632
xHBfkQ2UoXY,568.6,10:34 a m,false,10:34am,imagine that will help Chris said at||10:34 a m London time goodbye have a||good night,618960
hiZ4m93FYo4,217.4,10:34 a m,false,10:34am,to park you know me well but what is the||exact time I was busted 10:34 a m 10:30||memory like a hawk can tell time I don't,418714
iNEiJQFVw0Y,299.5,10 34 a m,false,10:34am,would||August 3rd 2021 10 34 a m well okay I||forgot mention real quick there was a,395176
Jto17mzP2D8,796.5,10:34 a m,false,10:34am,intelligibly intensity of the shocks is||being amplified 10:34 a m subjects||rambling loud ins and twitching occurs,457250
ZPClaZ2NTVg,599.7,10:34 a m,false,10:34am,Oh||currently 10:34 a m in the morning||let's see how long the wait is it,286223
b3nkrpls8Ak,438,10:34 a m,false,10:34am,parking ticket a parking ticket yeah||it's that 10:34 a m 10:30 4:00 a m||yes oh yeah max can tell time soon that,204767
4iVgVo-b2iM,1217.7,10:34 a m,false,10:34am,just do it straightaway||um and see if this works is 10:34 a m right now and I'm on a world with 130||players the odds of running,209853
FMcdpxyIllg,457.5,10 34 a m,false,10:34am,so this happens on the second as i say||it happens at 10 34 a m pacific and 6 34 p m uk time||now the sun and moon was together,198317
8-Xa3qewbdw,1949.6,10:34 a m,false,10:34am,10:34 effing it's go for it||10:34 a m booyah||max can tell time whoo gasps good guess,187029
qlotZ0ZvftY,754.8,10:34 a m,false,10:34am,I was busted I don't know the time do||with 10:34 10:34 a m oh yeah max can||tell time oh thank you can a broken,156639
U7km8b4tok0,1211.2,10:34 a m,false,10:34am,but plus you really got a time I was||getting everything yeah 10:34 a m booyah max can tell time shut up||pocket that already proves that you're,144635
u4REVbhdlqk,411.5,10:34 a m,false,10:34am,violets enjoying the warm oven hmm hey||guys so it is Saturday it is 10:34 a m me my mom are heading out we're going to||go shopping,145574
3F3o7Gt1CAQ,95.7,10 34 a m,false,10:34am,became the king of low balling people it||is currently the next day at 10 34 a m and i'm starting to get some leads for||some potential couch pickups the classic,174377
MPKsNd_r4mw,1975.5,10 34 a m,false,10:34am,but what is the exact time i was busted||10 34 a m booyah max can tell time even||a broken clock is right twice a day,124091
HJVvB9sGiS8,59.4,10 34 a m,false,10:34am,and let's get into it so it is currently||10 34 a m right now so cat liam 4 drops||in maybe around 20 minutes,120432
n4Qy2jEKBZI,329.1,10:34 a m,false,10:34am,parking ticket 1034 a template for a||yeah 10:34 a m is it Rosie yes is it||really yes it really yes booyah okay,100186
wy0HUVOaDcw,429.1,10 34 a m,false,10:34am,the company||on the 22nd of may at 10 34 a m eastern||time,84443
WcY8KrPy-aU,1158.1,10:34 a m,false,10:34am,you got 86 cents||10:34 a m let's go baby I got it all||got this max you want time Chloe,86112
mLLEafur4po,1259.1,10:34 a m,false,10:34am,specifics what is the exact time I was||anymore but it was 10:30 for 10:34 a m booyah max can tell time think after a||few of those she should known oh,82782
IceLLf-Gjh4,173.6,10:34 a m,false,10:34am,yeah 1175 this is a warning from now||it's the ticket warning for 10:34 a m at Twin Peaks surf Franklin Street okay||you got this max now rewind and blow,81544
IceLLf-Gjh4,283.6,10:34 a m,false,10:34am,well now what right okay max study every||item carefully in film 10:34 a m 10:30||4:00 a m,81544
IceLLf-Gjh4,339.9,10:34 a m,false,10:34am,Parkington I bet you you know me well||but hey it's 10:30 for 10:34 a m booyah||max can tell time even a broken clock is,81544
MbEY1QD6vMY,887,10:34 a m,false,10:34am,I was busted 1034 boom||10:34 a m booyah max can tell time even||a broken clock is Right twice a day,82191
hmLWL_oQJbI,27.7,10:34 a m,false,10:34am,fucking Oh||10:34 10:34 a m booyah max can tell||time even a yep my life is a blip,80065
MaCmGQKwYWo,2427.5,10:34 a m,false,10:34am,oh that's just guess||10:34 a m booyah max can tell time even||a broken clock is Right twice a day,81058
rjOEDkADG4w,323.6,10:34 a m,false,10:34am,know me well||10:34 a m 34 a m||booyah max can tell,69021
yQWF2pzw_zc,90.4,10 34 a m,false,10:34am,when i'm drunk as you know by the||drunken reactions now it is 10 34 a m on a friday morning here in the||uk so obviously i'm not drunk but,70782
yC0LVsPvRIQ,587.6,10:34 a m,false,10:34am,what is the exact time I was busted 1034||10:34 a m booyah max can tell time||she looks really distressed all over my,62781