id,timestamp,token,manual,time,lines,views
x71_Kp3P_1w,36.3,12:27pm,true,12:27pm,targeting a launch of the 14th batch of Starlink satellites on||Sunday 18th October at 12:27pm UTC or 8:27am EDT||HBO is apparently creating a new series which will look,60091
J5_lQvgCkLs,69.9,12:27pm,true,12:27pm,"Hello everyone, it's currently, what time is it?||It's 12:27pm||This is what we do on our break, we just come and lie down, we",19914
tKj3R21l0aY,230.9,12 27 pm,true,12:27pm,button once again and ask what time is it||it's 12 27 pm voice commands are also great||for things like turning on closed captioning,305129
fPxh4Jp4dAY,1942.7,12 27 pm,true,12:27pm,now at 11 20 a m barry called suzanne at 1206||he calls mallory at 12 27 pm he's seen on hotel||surveillance moving two bags to a dumpster another,61723
EyTiQaNoAP8,281.2,12:27 pm,true,12:27pm,"NRO , which is responsible for the US Space||Force, The SpaceX rocket took off at 12:27 pm local time from the Vandenberg Air Force||base in California",42338
1_Dd30jP7zo,307.2,12:27 pm,true,12:27pm,"NRO , which is responsible for the US Space||Force, The SpaceX rocket took off at 12:27 pm local time from the Vandenberg Air Force base||in California",28387
pjjKhaic0pI,2491.3,12 27 pm,true,12:27pm,:26 pm an unknown officer that the teacher was shot in the classroom he responded||12 27 pm he is the team leader||12:28 pm,8673
697yr-MVIco,648,12:27 pm,true,12:27pm,"Alright, see you next time||Hello, it is Friday, February 24th, 2023, currently 12:27 pm ,||um, I just got an email from Columbia, um",6602
lgi0HAejha4,197.2,12:27 pm,true,12:27pm,"is the designated Himri pass||The time is 12:27 pm , 14th of November||You can see that I'm exactly at this point which is",2596
Qo9MX7gzQok,765.6,12 27 pm,true,12:27pm,of time to trek six kilo-meters||we are near the forest office it's 12 27 pm so||it took us 2 hours to track down six kilometers,3495
uVrJprmHHrg,381.7,12 27 pm,false,12:27pm,of brookfield road near clock house||shortly before after 12 27 pm on||saturday the 14th of march,408475
jltrygi76Sc,24.4,12 27 PM,false,12:27pm,in the must move game the session begins||at 12 27 PM not typically when games are||the best but today might be special,410698
TuKqFSy4e5Q,56.4,12 27 PM,false,12:27pm,either completed or in progress||on Thursday September 30th at 12 27 PM officers were on patrol in the 1900||block of West Grand Avenue here in,272762
tKj3R21l0aY,230.9,12 27 pm,false,12:27pm,what time is it||it's 12 27 pm voice commands are also||great for things like turning on closed,305129
HValIO5ekLE,0,12 27 PM,false,12:27pm,on Sunday June 11th at 12 27 PM a man||named Chad Dorman updated his Facebook||cover photo,344510
fnu4uLscIDI,207.8,12 27 pm,false,12:27pm,25 pm new hat ticks domino||then two minutes later at 12 27 pm and||went off sale,161715
8M304Zib4TM,432.8,12 27 pm,false,12:27pm,i'm recording this at 12||at 12 27 pm no sorry a m a m a m so man||i hope this game don,153091
fPxh4Jp4dAY,1947,12 27 pm,false,12:27pm,a m barry called suzanne at 1206 he||calls mallory at 12 27 pm he's seen||on hotel surveillance moving two bags to,61723
x71_Kp3P_1w,36.2,12 27 pm,false,12:27pm,of the 14th batch of starlink satellites||on sunday 18th of october at 12 27 pm utc or 8 27 am edt||hbo is apparently creating a new series,60091
llkdiy1XuPs,1133.2,12 27 PM,false,12:27pm,two types of gloves and spray paint she||was done at this store by 12 27 PM then||she drove the two of them to his home,65300
I4qo36ENB6g,90.8,12 27 pm,false,12:27pm,authorities were immediately contacted||the police arrived at around 12 27 pm and found that she had been stabbed once||in her chest penetrating her heart and,48006
V0lLKpDM4Ag,19.5,12 27 PM,false,12:27pm,older sister went missing||on January 25th 2023 at 12 27 PM a||redditor of the name Caleb Maybe would,41735
jQi1IBdTMwQ,269.4,12 27 pm,false,12:27pm,the ceiling and kills tomoka at exactly||12 27 pm who is also hung with the||onrio's long black hair,89211
BLKaLBlveLY,39.5,12 27 PM,false,12:27pm,venting from the super heavy booster B7||liquid oxygen tank vented at 12 27 PM signaling that B7 cryo testing has been||completed afterward Mission Control,56620
8hyB0SPglE0,59.4,12 27 PM,false,12:27pm,mile away Evacuate the last update we||got right here is at 12 27 PM February||15th everything was still closed so,32345
Qv1VCVTovnU,1901,12 27 pm,false,12:27pm,any other night aside from||right now it's not even night it's uh 12 27 pm but if i recorded this on literally||any other time where i was like i,31930
1_Dd30jP7zo,309.6,12 27 pm,false,12:27pm,us space force the spacex rocket took||off at 12 27 pm local time from the||vandenberg air force base in california,28387
JB44J9YNidU,216.7,12 27 pm,false,12:27pm,the day||so currently it is 12 27 pm if you guys||have watched these mascara videos before,36066
2rtCXey0Xt8,283.4,12 27 pm,false,12:27pm,first round robin order at 11 20 am||right now it is 12 27 pm past the 12 20||mark and i did not receive a round robin,34228
Jy7n3XQ4Pz8,63.3,12 27 pm,false,12:27pm,ate anything good in such a long time||the time right now is 12 27 pm look at||me,18134
z3aGo7HiELc,199,12 27 pm,false,12:27pm,as per official statement the spacex||rocket took off at 12 27 pm on the 3rd||of february from the vandenberg space,16593
JGbJ3S7gMSs,189.4,12 27 pm,false,12:27pm,outside upon the officer's arrival||at approximately 12 27 pm dispatch was||called again,14402
1zmcTzGZ2Qk,1389.8,12 27 PM,false,12:27pm,their focus elsewhere he says February||18 2020 at 12 27 PM she says I have||finished it and the person says when,38995
NuW6p1sp3l8,38.9,12:27 P M,true,12:27pm,"TOMORROW||OF NEW YORK, 12:27 P M TOMORROW IN SYDNEY||IN SYDNEY",810733
ccgC6-EUrww,32.7,12:27 P M,true,12:27pm,"OUT OF||NEW YORK, 12:27 P M||TOMORROW IN",120731
mvbp3mkDzOU,0.4,12:27 p m,true,12:27pm,what's up everyone today is December 27 2014 and as of around 12:27 p m Eastern Standard Time today I am officially on testosterone which is in||my opinion is,26122
IzEHWyLq7so,2365.2,12:27 P M,true,12:27pm,">> TAKE OFF AT 9:27 P M||OUT OF NEW YORK, 12:27 P M||TOMORROW IN SYDNEY",17830
lEEhCfOWcPc,17.9,12:27 p m,true,12:27pm,"Thank you very much for joining me||Please like share and subscribe at 12:27 p m||Pacific Standard Time, there was a magnitude 4 8 Earth",6197
r5iXZGpZFUk,4.3,12:27 p m,false,12:27pm,ladies and gentlemen right now it is||12:27 p m it is hot outside you guys||might have noticed I'm wearing a watch,4311675
DkZKG-SQ1WU,1512.2,12:27 p m,false,12:27pm,security system was purposely triggered||at 12:27 p m receiving another notification on his||phone,3734996
uM94EeRxoJI,551,12:27 p m,false,12:27pm,is||12:27 p m so I'm going to be wearing||the foundation all day and I'm going,1181159
qb2mhLtkqtQ,298.8,12 27 p m,false,12:27pm,to upside out||Captain's Log 12 27 p m I checked all||three of these the spark plugs they all,898106
NuW6p1sp3l8,28.9,12:27 p m,false,12:27pm,New York||12:27 p m tomorrow in Sydney on board||University of Sydney researchers,810733
1OPt958zoqs,316.7,12:27 p m,false,12:27pm,the latest news resuming BBC minutes at||12:27 p m today ash they're said to be||a large number of casualties essentially,560968
vT5oQ95GCDE,691.3,12:27 p m,false,12:27pm,for||12:27 p m West Sun is behind us now||like way,593668
qrDQWBQLXZ8,643.6,12 27 p m,false,12:27pm,record saying that at what's the time||12 27 p m on tuesday february||wednesday february 2nd this is going to,408828
ISBQjgktVYg,255.2,12 27 p m,false,12:27pm,Germany right now||and it is it's 12 27 p m here but||literally like I think,245816
AzR-s1geasI,38.2,12:27 p m,false,12:27pm,Indian Air Force the aircraft took off||from jor Hart at 12:27 p m for the||menchaca advanced landing ground in,157493
AzR-s1geasI,192.9,12 27 p m,false,12:27pm,Force the aircraft got airborne at||around 12 27 p m and as we told you it||lost all contacts with the ground staff,157493
-acf42j5i2w,2363.8,12 27 p m,false,12:27pm,this thing is struggling at this point||um it it is uh 12 27 p m okay||and so uh,169823
OsU9OdmMwwA,1.7,12:27 p m,false,12:27pm,it's 12:27 p m we are at 30 Rockefeller||Plaza with day one of its a nice show||which,123894
qaIWRBe_6XA,129.4,12 27 p m,false,12:27pm,my hair||is tied up saturdays 12 27 p m we are||gonna go to portobello market right now,122343
8IaHlvfo5YA,1001,12 27 p m,false,12:27pm,be 100 complete charged friday at 12 46||p m it's currently wednesday at 12 27 p m i've kept this truck plugged in||constantly when i've had it and only,96637
-q-iExqVDvc,746.6,12:27 p m,false,12:27pm,lunchtime Shannon's family and friends||were very worried about her at 12:27 p m Chris called Nicole Atkinson again at,98135
-q-iExqVDvc,754.8,12:27 p m,false,12:27pm,Chris called Nicole Atkinson again at||12:27 p m the realtor messaged asking||Chris if he finished the basement or do,98135
Or22EcPLUcM,229.3,12:27 p m,false,12:27pm,rifle of an unknown calibre||he took his shot at 12:27 p m this was||also a fatal blow you may be wondering,89631
nBE1-2p-Nkk,1198.8,12:27 p m,false,12:27pm,like twin peaks'||Diane it's 12:27 p m Albert and his||team their work complete are headed back,111579
kEuTNszoIL0,351.5,12:27 p m,false,12:27pm,you it's rewarding||12:27 p m anticipation is in the air||buzz it up and just play something just,73396
vrmxVwgqdP0,583.4,12 27 p m,false,12:27pm,hello guys it is the next day it is||currently 12 27 p m i just got ready i||put on these new false eyelashes that i,67193
BOXg9dBS2yk,5,12 27 p m,false,12:27pm,perfect||right now on dilbert it's 12 27 p m on||friday january 29th 2020,68838
t-OC0pxJfoY,253.4,12 27 p m,false,12:27pm,i like it loves good morning it is||thursday october 15 12 27 p m and i went down a bit late today peril||i'm so happy to meeting,66430
0HQPdAkitnc,216.7,12:27 p m,false,12:27pm,shocked and I thought that was really||really awesome so it is now 12:27 p m and I'm going to take you guys rock my||day if I'm doing,59496
jwcAVY4hH2g,12.3,12:27 p m,false,12:27pm,it is Saturday June 7th||12:27 p m we should have been on the road three||hours ago we had every intention,57612
WWsv-FXDtMA,1208.4,12:27 p m,false,12:27pm,twenty seven to twelve twenty six P||12:27 p m if you gave let's say lunatic||add to some player at 11:27 the,59260
hiUbwEq2H4Y,332.9,12 27 p m,false,12:27pm,that's crazy today is Tuesday September||27th 12 27 p m I have a dinner to go to||this evening I'm actually kind of,57231
wvZjA2bLt3E,227.8,12 27 p m,false,12:27pm,it's several hours later i want to point||it out 12 27 p m is when he makes that comment then he||comes back at 6 42 p m,53905
x8ukpHBbqUo,216,12 27 p m,false,12:27pm,hatching i saw just now here three down||here 12 27 p m 12 17 p m and 12 21 p m||well we'll wait for all,57031
f8A8pbdIAec,579.5,12:27 p m,false,12:27pm,minutes ago it is currently||12:27 p m and I figured I had to give||you guys a quick well you know test,47754
owfqNYgA5do,584.2,12:27 p m,false,12:27pm,little timeline here and so November||22nd all right 12:27 p m beerus at the||store now at 12:54 through 117 Frazee is,43282
97kHp8g1uF0,398.4,12:27 p m,false,12:27pm,works with flash photography so right||now it is 12:27 p m I'm gonna wear this||throughout the day and use my Sony,43850
O8bjOmqIlds,0.6,12:27 p m,false,12:27pm,on Friday the 23rd of May 2014 at 12:27 p m fire crews responded to reports of||a building fire at 167 Memphis Street in||Glasgow,49971
hv-8tjvL41E,1255.8,12:27 p m,false,12:27pm,let's send a message hey how are you||this is the time which is 12:27 p m this is the deck which is my 1 0 1 2019||and yeah let's,34361