id,timestamp,token,manual,time,lines,views
b08f_Nucf4U,1045.9,3 47pm,true,3:47pm,"No||""It's 3 47pm ,||""Jason has had a whole bowl of peppercorns """,334062
X1T7ugZoKMM,23.4,3:47pm,true,3:47pm,talk about the astrology of the second Aquarius New Moon on February 18th||exact at 3:47pm PT||This Aquarius New Super Moon births New Visions and brings Self Mastery,2912
tUGhe0fYyTk,86.9,3 47pm,true,3:47pm,long road to glory||There are always defining moments in any title race and at 3 47pm yesterday there was no doubt Liverpool were staring down the barrel||Read More Transfer news,2278
1V4hGBZ87zU,941.6,3:47 pm,true,3:47pm,All day||3:47 pm hijack Bobby's computer again||alarm rings,13513055
-uTHp4zwYxQ,468.6,3:47 PM,true,3:47pm,"""I can predict that the stock market will crash on September 15th, 2023, at exactly||3:47 PM Eastern Standard Time||This information is highly accurate, and there is no doubt that it",31169
hpjRYpshKoQ,1076.6,3 47 pm,true,3:47pm,2001 space artists wow zingy and sherbet wow||yeah right jason is struggling now no 3 47 pm jason has had a whole ball of peppercorn grandaf||it's four hours since jason,45896
aC6V6wTHUtM,427.3,3:47 PM,true,3:47pm,"Gemini, talkative mentally stimulating restless Gemini, at||3:47 PM Pacific time for two and a half days so we||That",6521
yUf9cq5-n7o,88.4,3:47 PM,true,3:47pm,"gonna be accidents here||This was Jason and his family at 3:47 PM ,||just seconds after the crash",4920
9DjBWLu-__E,349.6,3:47 PM,true,3:47pm,"King's bounty 2 xbox review - Performance Breakdown||SoS-GotCake — Today at 3:47 PM So I go more into the gameplay mechanics than||the performance, there was very little",5581
2IxO6u-5Uo8,1470,3:47 PM,true,3:47pm,"Extreme subzero temperatures conditions detected, all sectors||*Announcement Chime* ASAS: Alert, at 3:47 PM , a national state of emergency was secured by the Prime Minister of Japan||Executive orders",85617
vMWC6HSlG-0,1437.3,3:47 PM,true,3:47pm,We've been out here since daybreak||and it is now 3:47 PM||laughs,2752
WY7kBq85N80,678.1,3:47 PM,true,3:47pm,"by AC/DC ♬||Ok, after Shackler's Revenge song 60, I took another break at 3:47 PM and came back at 5:04 PM||I would've finished a few minutes earlier",2675
WbYKZ0l5GP0,381.8,3 47 pm,false,3:47pm,again||at 3 47 pm with the 10 minute siren||sounding soon thereafter,370682
yF_KIu16p1E,643.8,3 47 pm,false,3:47pm,girlfriend who just bailed him out||on sunday october 8th at 3 47 pm catherine's roommate reported her||missing after being concerned that she,279110
OT0fdJvEKgQ,331,3 47 pm,false,3:47pm,explosives||before departing at 3 47 pm with four||adult males heading north,228094
JftpAuO5rG0,239.1,3 47 PM,false,3:47pm,cyberbullying against who against me||eight years ago at 3 47 PM you wrote and||I quote I never ever ever ever ever want,261555
MoR9qVqfV2g,354.1,3 47 pm,false,3:47pm,explosives||before departing at 3 47 pm with four||adult males heading north,164448
emaFroqyAN0,386.6,3 47 pm,false,3:47pm,explosives||before departing at 3 47 pm with four||adult males heading north,150156
DnMOzKtRs5c,1790.6,3 47 pm,false,3:47pm,on May 22 2022 NADA entered the storage||room at 3 47 pm and left approximately||34 minutes later carrying one of Trump's,131078
1IsY5teBVwk,712.6,3 47 pm,false,3:47pm,bedroom and they saw where she had sent||her last text at 3 47 pm to a friend and||when the neighbors were asked they said,363149
8NFRLFdHdt0,292.4,3 47 pm,false,3:47pm,explosives||before departing at 3 47 pm with four||adult males heading north,88122
zl4syrvRG1g,495.2,3 47 PM,false,3:47pm,reported off-the-scale radioactivity||readings at 3 47 PM the order was given||to evacuate the entire plant,306693
VdeZvTMQV_8,796.4,3 47 pm,false,3:47pm,granted bail and released from East||Perth lockup at 3 47 pm after some delay he eventually found a||taxi directed its driver to mosman park,80453
9Edb5hcSj5A,55.9,3 47 PM,false,3:47pm,the flight carrying 194 passengers and||five crew members landed safely at 3 47 PM local time||there were social media postings by,64130
Xepkvv3g7vI,340.7,3 47 pm,false,3:47pm,where he DM slime shorty on January 13th||at 3 47 pm and all he put was omerta all||right now for y'all to know what,44837
nRnsKiGTR8U,410,3 47 PM,false,3:47pm,children||at 3 47 PM she called one of her sisters||but the sister was not able to watch,37116
8t7E-vEk0MY,35.9,3 47 pm,false,3:47pm,emergency||at around 3 47 pm on monday the 26th of||july,37678
T6JSyLJiRlo,305,3 47 pm,false,3:47pm,explosives||before departing at 3 47 pm with four||adult males heading north,22008
-uTHp4zwYxQ,465.5,3 47 PM,false,3:47pm,predict that the stock market will crash||on September 15 2023 at exactly 3 47 PM Eastern Standard Time this information||is highly accurate and there is no doubt,31169
gyDSylVe8Fo,255.6,3 47 PM,false,3:47pm,Walker detectives investigating the case||were called into the same office at 3 47 PM after Mr Chalker had left where they||were directed to arrest Constable Rolfe,21115
Z4j-W5oFx5E,260.6,3 47 PM,false,3:47pm,hospital which was pronounced it on||arrival at 3 47 PM doctor said Nilda||sustained upwards of 25 punctual wounds,20086
mwQ11fgWKtw,1970.1,3 47 PM,false,3:47pm,father alone Caleb received another text||from Megan at 3 47 PM that afternoon and||asked if she could go to a house to,17994
JyoCGhcTZJM,169.7,3 47 PM,false,3:47pm,alone Caleb received another text from||Megan at 3 47 PM that afternoon and||asked if she could go to her house to,13332
sT6iF4SWB2M,86.2,3:47 p m,true,3:47pm,"- You kids have fun||Eight years ago at 3:47 p m you wrote, and I quote,||""I never, ever, ever, ever, ever want kids",795094
JftpAuO5rG0,239,3:47 p m,true,3:47pm,"Against me||Eight years ago at 3:47 p m , you wrote and I quote,||""I never, ever, ever, ever, ever want kids",261555
MoR9qVqfV2g,360.5,3:47 P M,true,3:47pm,"EXPLOSIVES||FOR DEPARTING AT 3:47 P M ,||WITH FOUR ADULT MALES HEADING",164448
rikdcXvK6k0,634.8,3:47 p m,true,3:47pm,Reporter||At 3:47 p m at camera then picked them up on a stroll||They then made their way to,44182
o0Qk_0Agi6c,1896.2,3:47 p m,true,3:47pm,ABOUT FOUR HOURS AGO||>> Reporter: AT 3:47 p m A||CAMERA THEN PICKED THEM UP ON A,24410
IgOxPYinc08,1068,3:47 p m,true,3:47pm,SHUTTERED AS A PRECAUTION||AT 3:47 p m A CAMERA THEN||PICKED THEM UP ON A STROLL,12595
2Byiybze8vg,40.2,3:47 P M,true,3:47pm,POLICE SAY IT HAPPENED||3:47 P M AT BURLINGTON||COUNTRY CLUB IN WEST HAMPTON,4537
1unoK0HgTno,393.2,3:47 p m,true,3:47pm,"Where were you today at?||3:47 p m||Because that's uh, that's um, I I know right off the top of",3754
NSSZVKRBE7Q,897.2,3:47 P M,true,3:47pm,"We been out here since daybreak,||and it is now 3:47 P M||That 44 magnum former centered,",6067
5r3gjpsNubo,192.6,3 47 p m,true,3:47pm,i couldn't believe it either||what time is it where i live it's 3 47 p m bsg sorry we're just seeing how long we can||hold our r's for,1006
j6LhEPpWn4E,56.2,3:47 P M,true,3:47pm,">> THAT SECURITY VIDEO||WAS TAKEN AT 3:47 P M , BY 4:15, THEY||WAS TAKEN AT",1031
j6LhEPpWn4E,57.2,3:47 P M,true,3:47pm,", BY 4:15, THEY||WAS TAKEN AT 3:47 P M , BY 4:15, THEY||WERE FOUND UNCONSCIOUS",1031
1V4hGBZ87zU,940.1,3:47 p m,false,3:47pm,that uh we should sit and talk like all||day yes all day 3:47 p m hijack Bobbi's||computer again,13513055
YMJujlRuwbs,208.2,3:47 p m,false,3:47pm,ditch they got off of the train they||went to the cafe and then at 3:47 p m Milly borrowed one of the boys who was||also in the cafe is fun cuz,3042002
p4dU6A48YBs,215.9,3 47 p m,false,3:47pm,this is called luxury living it is||currently about let me see 3 47 p m so||tonight we have a reservation at dinner,2177282
ZC3Pq8Fe58Y,11.2,3:47 p m,false,3:47pm,early labor or not it is the sixth||3:47 p m I just started timing my||contractions just to you know see like,1297579
2b4CPFLiCzs,136.3,3:47 p m,false,3:47pm,of them messing around and having some||fun 3:47 p m which would be about 20||minutes into their trip part 1 of the,1255947
-Bt-kFvjN-Y,295.1,3:47 p m,false,3:47pm,because we are actually losing now it is||a lot later it's currently in 3:47 p m editing done yeah and I think I figured||out the whole video situation for this,1197919
jaH5FJnKYqY,549.8,3:47 p m,false,3:47pm,"of it I am at about 4,500 calories burnt||it is almost it's 3:47 p m and has||almost 4 p m",1217052
dXayfhg4WRs,1150.7,3:47 p m,false,3:47pm,at all um so I'm ignoring the group chat||and then at 3:47 p m might have||specific time stamps because I was,1157994
AWOIjesdREM,850.2,3:47 p m,false,3:47pm,we're not in the real world oh my||goodness you guys it is 3:47 p m I'm||looking out to make sure that it's not,873446
sT6iF4SWB2M,86.6,3 47 p m,false,3:47pm,we'll be back in a few cupcakes||eight years ago at 3 47 p m you wrote||and i quote i never ever ever ever ever,795094
ZA_jAJ9brzU,484.3,3:47 p m,false,3:47pm,gonna wear do a word test right now it||is kind of late it's 3:47 p m so let's||see I'll be back in a couple hour she'll,431358
hmFYAmp9yiA,53.4,3:47 p m,false,3:47pm,Earth's atmosphere landed in Washington||today at 3:47 p m Eastern Standard Time||a mysterious spacecraft lands with an,357864
r-b6ox66lSE,92.3,3:47 p m,false,3:47pm,can't see it from far away but anyways||it is 3:47 p m and Nabi is drinking her||milk she just woke up from a nap and,291929
yYezlEKolSE,469,3:47 p m,false,3:47pm,going on and I'm going||to read to you what it said so at 3:47 p m on the 10th Robert said can someone||send me some love I just got out,263502
8lRjm1PbDMo,106.8,3:47 p m,false,3:47pm,I'll check back in a few hours||3:47 p m it doesn't feel extremely dry or||anything I just feel like I have nothing,213470
lnbCzhoRy6U,243.3,3:47 p m,false,3:47pm,believe that Shaw was driving his car||then left at 3:47 p m initially the||police had thought he left the premises,182999
wCgGZQK9DWM,158.4,3 47 p m,false,3:47pm,called to the match in Diamond Road||Norwich at 3 47 p m this afternoon to||reports of a sudden death after a man in,163723
eAI8dJKKc0w,1258.8,3 47 p m,false,3:47pm,3 47||so 3 47 p m on the 31st day of july||and 2021 and when you were witness you,162430
oN2uJGVyFEc,269.8,3 47 p m,false,3:47pm,explosives||before departing at 3 47 p m with four||adult males heading north,151785
2z1IgN6LQK0,377.3,3 47 p m,false,3:47pm,currently||3 47 p m and right now we are going to||go to another gas station to get lunch,359850
7sV1OmLx1D0,1000.9,3 47 p m,false,3:47pm,not hear the call||the 999 call came in at 3 46 p m at 3 47 p m cctv footage shows the two defendants||riding away from box bottom,147829
cy4kHaCqU5Y,3043.1,3:47 p m,false,3:47pm,though it's still daylight||message sent Tuesday 3:47 p m new text||message from Neil well he shit is that,131039
8MioletnaAs,1044.1,3 47 p m,false,3:47pm,a m||it's now 3 47 p m i'm having a low blood sugar issue||so,107416
EOcSleVHdug,211.5,3 47 P M,false,3:47pm,it remove it now||time of death 3 47 P M another debunko like Spider-Man turn off||the dark and we're ruined well I,378859
NZdWST3T7js,4.1,3:47 p m,false,3:47pm,okay this is August 20 of 1973||time is a 3:47 p m the location is the||Hewitt residence on route 17 where,159891
q6MwIZrd4OE,46.2,3:47 p m,false,3:47pm,link in the description below and yeah||let's just begin huh it is 3:47 p m let's get down to business so full||disclosure guys I don't own any,103341
seFvYQ25fuc,262,3:47 p m,false,3:47pm,we get there yeah||3:47 p m as I arrived what we left a||little bit late,93675
U7CKhK3ls2U,317.5,3:47 p m,false,3:47pm,Earth's atmosphere landed in Washington||today at 3:47 p m Eastern Standard Time||we still do not know where it came from,117701
6cLbReTdBk0,369.8,3 47 p m,false,3:47pm,dark brown straight hair female||wearing unknown last seen on today at 3 47 p m at cafe located on bard street||finley stevens 25 years old 177,121200
FQMqkWOy5Bg,14.8,3 47 p m,false,3:47pm,only happened||literally i think two hours ago at a 3 47 p m now these guys started on monday||and,69440
1pSGVbiySEI,574.7,3 47 p m,false,3:47pm,at 7 pm and the time now is||3 47 p m and i'm here||with the money girls we have i call them,68125
XDYNFPxdMj4,1067.8,3:47 p m,false,3:47pm,that you have penciled in Mike walks in||unannounced at 3:47 p m well let's see||hang on uh 3:45 continue singing rap 347,90777
QKIdjEtLYtA,280.8,3 47 p m,false,3:47pm,explosives||before departing at 3 47 p m with four||adult males heading north,61859
xAwa9qjl5-U,281.6,3 47 p m,false,3:47pm,to dinner||so it is 3 47 p m this is perfect yeah||let's get to cooking um the chicken is,62891
fttB7vRuOcw,1010.2,3:47 p m,false,3:47pm,in there yum yum yum yum yum||yum a little while later it's now 3:47 p m and I just had a little sleep I||feel like I have had no sleep,60057
YNstT04HOqM,914,3:47 p m,false,3:47pm,for northern Porter||County at 3:47 p m a severe||thunderstorm was located over burns,96693