id,timestamp,token,manual,time,lines,views
8VuR0hGKlBM,156.7,5:17pm,true,5:17pm,"see that currently, the Sentinel-6 mission is expected||to lift off on Saturday at 5:17pm UTC or 12:17pm EDT||This was also confirmed by SpaceX when they tweeted that",34633
yVOINwjyY0o,69.3,5 17pm,true,5:17pm,"Sheremetyevo airport,||5 17pm||The crew prepares for the upcoming flight to Murmansk",26696
uDOehXeyTcE,257.4,5 17pm,true,5:17pm,"She’s furious, pointing out that Tommy wasn’t there…when Ruby died||At 5 17pm||By order of the Peaky Blinders check out this other cool videos",9943
G-eMhq7ZKUs,73.8,5 17pm,true,5:17pm,"Meanwhile, The Guardian, which literally claims to show us ‘The Whole Picture’||actually only showed us half when at 5 17pm it was reporting…||But by 8 24pm had changed it's tune to",4703
yPXomTLoAMI,619.2,5:17pm,true,5:17pm,"Yes, I do||5:17pm||Favourite",1115
QWV-1o_poZM,20.2,5 17pm,false,5:17pm,98 01 percent nanoclustered precincts||election returns as of 5 17pm 31 million 12 thousand 765 votes sumusu||not silent robredo 14 million 783,31893
cpiCMmg_WDA,1550.7,5 17pm,false,5:17pm,september 1st||5 17pm eastern time||to judge eileen cannon,14631
SIcE005zmnc,1354.2,5:17 PM,true,5:17pm,standards||And then just to answer the other question was 5:17 PM is the||launch time and I believe it is *** two hour window as well,3010
CPkyHqwoqsg,362.7,5:17 PM,true,5:17pm,"--IT||RIGHT, AS 5:17 PM --IT SAYS||RIGHT, AS",1925
CPkyHqwoqsg,362.7,5:17 PM,true,5:17pm,"--IT SAYS||RIGHT, AS 5:17 PM --IT SAYS||SO",1925
CPkyHqwoqsg,362.8,5:17 PM,true,5:17pm,"SO||RIGHT, AS 5:17 PM --IT SAYS||SO IT",1925
CPkyHqwoqsg,362.9,5:17 PM,true,5:17pm,"SO IT||RIGHT, AS 5:17 PM --IT SAYS||SO IT EXPIRES",1925
CPkyHqwoqsg,363,5:17 PM,true,5:17pm,"--IT SAYS||SO IT EXPIRES||RIGHT, AS 5:17 PM --IT",1925
OmrGmGDLOa8,37.6,5 17 pm,false,5:17pm,suspect's apartment||from 5 17 pm we would like to report that we have||found and seized a few of what appeared,128520
oKmWyCRwGMc,37.7,5 17 pm,false,5:17pm,suspect's apartment||from 5 17 pm we would like to report that we have||found and seized a few of what appeared,73060
sk_tZqZL_uM,37.6,5 17 pm,false,5:17pm,suspect's apartment||from 5 17 pm we would like to report that we have||found and seized a few of what appeared,39814
8VuR0hGKlBM,156.1,5 17 pm,false,5:17pm,that currently the sentinel 6 mission is||expected to lift off on saturday at 5 17 pm utc or 12 17 pm edt||this was also confirmed by spacex when,34633
1otIHl2USRM,98.9,5 17 pm,false,5:17pm,Amazon delivered package at 1 38 PM came||home at 5 17 pm and and found out this||man stole my package from my front door,28401
lgY5UAhsORA,14.6,5 17 pm,false,5:17pm,hafijah mohammad no||a distress call was received at 5 17 pm a team from the cyber gyre fire and||rescue department was deployed to the,26863
1unFzsgGRsw,404.5,5 17 pm,false,5:17pm,shot more innocent victims||5 17 pm chuck foster swat sniper fired a||single round 35 yards away,23723
38CsWaTlRqA,2892.2,5 17 pm,false,5:17pm,dedicatory services began it promptly at||5 17 pm what an odd times beginner||the service but it began at 5 17,21437
jxydrjJun_g,551.1,5 17 pm,false,5:17pm,on delivered package at 1 38 PM came||home at 5 17 pm and and found out this||man stole my package from my front door,20951
7s52wC0Ab1o,781.6,5 17 pm,false,5:17pm,Mahatma Gandhi had passed away on the||30th of January at 5 17 pm it was precisely at this||time that Swami locked himself inside,20895
3PsWGJFFIxc,991.8,5 17 pm,false,5:17pm,remember that the super bowl started at||5 17 pm on the east coast and at 2 30 pm||over on cbs in the only,22883
JKTOWeurEYg,195.7,5 17 pm,false,5:17pm,litvin||at 5 17 pm on June 21st 2019 do you have||that in front of you yes,23503
yl3vmcDhxMw,1296.1,5 17 PM,false,5:17pm,other Survivor||at 5 17 PM huberty walked from the||service counter toward the doorway close,48283
20Dn1mgqRP0,930.4,5 17 PM,false,5:17pm,Boggs took batting practice at precisely||5 17 PM when Sprints would take place at||exactly 7 17 pm he took 150 ground balls,109667
2aJeCk1qiBY,170.9,5 17 pm,false,5:17pm,shot more innocent victims||5 17 pm chuck foster a swat sniper fired||a single round 35 yards away,16954
C4s9srlrh_o,441,5 17 pm,false,5:17pm,that's what i used and then i have the||one that has a time 5 17 pm i feel like these widgets are kind of||unnecessary they just add a little bit,10518
SiRgfbngIVo,753.6,5 17 pm,false,5:17pm,down a motorist who called for an||emergency personnel at 5 17 pm she was later pronounced dead at the||scene initially the graham county,9275
Ff0M_aXeGcA,712.9,5 17 pm,false,5:17pm,now according to the phone records||the call ended out of 5 17 pm please found||this note on the girls bridge that tina,11194
k_lWlQsEQrs,404.7,5 17 pm,false,5:17pm,area just north of joplin oh boy||at 5 17 pm they issued a warning||for joplin itself,16747
18d2eocYP9Y,971.5,5:17 p m,true,5:17pm,though so there was a slight delay in getting a police response||By 5:17 p m Both medical and police vehicles were on their way to the scene||Upon arrival it,86237
mAsbkShdv8U,120.2,5:17 p m,true,5:17pm,"along with Russian cosmonaut Alexander Misurkin||launched to the International Space Station from Kazakhstan, at 5:17 p m EDT on Sept||12",22037
_6-OhcXD-DQ,17.8,5:17 p m,true,5:17pm,"the media on Monday||Launch time is scheduled for 5:17 p m||Eastern on Tuesday, and we’ll have live coverage",11786
-A8owRdmmoA,215.6,5:17 p m,true,5:17pm,So now my day is over||It is 5:17 p m They let me go home a little bit early||I,8734
BFB3ULq20jQ,16.8,5 17 p m,true,5:17pm,out with me together in my apartment I just got home from work it's 5 17 p m so I knew||I was gonna have a Friday night in right and I figured,70211
tFHyA_o_MNk,393.3,5:17 p m,true,5:17pm,"when she arrived home from school||At 5:17 p m , a 14-year-old brother was shot and killed||when he arrived home from school",8369
UlLH9MPqm40,4.2,5:17 p m,true,5:17pm,you can see here||We are on our g-mail and the time is now 5:17 p m and we have got a test incoming from usercrowd even though many of you say,7899
o1mjqVh8QDA,136.2,5:17 p m,true,5:17pm,claims in the South China Sea and||furthermore posting in his Twitter account saying at 5:17 p m today the||Chinese embassy received two diplomatic protests 1,5326
23QFrm0xXTQ,900,5:17 p m,true,5:17pm,was authorized to kill Huberty should he have a clear shot||End of incident||At 5:17 p m the SWAT sniper perched on the post office roof obtained an unobstructed view of Huberty,4786
CTcDk69O9b4,334.2,5 17 p m,true,5:17pm,10 in the morning until right now which it is in||fact 5 17 p m editing that||finally died,1472
Sqq4c6OuPSY,88.3,5:17 P M,true,5:17pm,"THUNDERSTORM||5:17 P M , 29 TORNADO||SIRENS HAILED THE FIRST WARNING",1285
XsMRxNSDccc,393.4,5:17 p m,false,5:17pm,time||it's 5:17 p m also similar is the||Telstar answering system found from,1960744
dWgUWOy44Ys,30.3,5:17 p m,false,5:17pm,vlog so it is currently what time is at||5:17 p m and yes he and I are the only||ones in the car we are having,1745680
PX0VB-1_b7Q,569.1,5:17 p m,false,5:17pm,lunch||okay guys it's currently 5:17 p m so||it's been like two hours since I ate so,1445257
sUU5U1v4Mu4,57.2,5:17 p m,false,5:17pm,vlogging whatsoever and right now it's||5:17 p m what I did do was earlier in||the day Candice and Owen stopped by,1055476
8STSG5Pcldo,203.3,5 17 p m,false,5:17pm,so proud of this tweet he tweeted this||at uh right here uh 5 5 17 p m Eastern||Time,731244
dyuk2cbEZfs,236.9,5 17 p m,false,5:17pm,anywhere else like this talking clock||which i've had since the 1980s 5 17 p m or roby jr which i've also had||since i was a kid,852456
5f_uu-XpWeI,334.6,5:17 p m,false,5:17pm,comment below what you were doing at||5:17 p m today like right now in this||very second,528015
o7lJisdwgJ4,4.8,5 17 p m,false,5:17pm,january 25th 2022 2 49 pm at sketch||you're screwed 5 17 p m the same day||roblox is coming for you next four,541662
CCZwuTbBVuQ,36.2,5 17 p m,false,5:17pm,minister tweeting about four minutes||back at 5 17 p m that he strongly||condemns the attack on the assam rifles,498940
jIznbYxVb-4,840,5:17 p m,false,5:17pm,behalf the statement read the truth is||on October 28th 2019 at 5:17 p m the||vice-president rights management and,420211
EXSExf9KHf4,539,5 17 p m,false,5:17pm,'m excited let's go ahead and do our||rare test so it's currently 5 17 p m i'm||going to wear this,413359
3KpRBw8Gnjk,456.8,5 17 p m,false,5:17pm,went by the online name Big Boy appetite||Hardy texted her business partner at 5 17 p m on Friday October 17 2014||indicating that van was with her at the,376671
_0g7jXb1Mv0,56.7,5:17 p m,false,5:17pm,the day after Valentine's Day or||whatever it right now is 5:17 p m all||right guys and we had a plan of getting,359184
HHs18o9yDUU,743.8,5 17 p m,false,5:17pm,pump all right||i'll remind you at 5 17 p m i'll let you||know once your water is warm,380804
ggcQkOQSS_Y,226,5:17 p m,false,5:17pm,shot it in it's gonna look great||it's 5:17 p m I worked about seven||hours on this video today 7 hours it's,333123
J05uamcVgfU,405.7,5:17 p m,false,5:17pm,see the 29th so it's June 20||western 20 June 29th and it's 5:17 p m so what I did is for the first two days||I said I was gonna,333819
xH2LfuP1qUg,207.4,5:17 p m,false,5:17pm,said that the email came at like October||19th 5:17 p m blah blah blah like and||she copy and paste of the statement now,322225
VL_1Lh_Ch9A,825,5 17 p m,false,5:17pm,but i did secure that hush win||at 5 17 p m all that was between me||and the glory of dead god was one more,396812
qteqeRiOyks,1297.6,5 17 p m,false,5:17pm,is long way to go long way to go||time track guys it is currently 5 17 p m the lures are about to expire so||let's go ahead and catch whatever that,267523
XLi6iYnnsGc,1028.2,5:17 p m,false,5:17pm,when we will kill all of you just like||this ml died at exactly 5:17 p m which||we know because when she fell in the,262073
Le5EREY3E_8,826.3,5:17 p m,false,5:17pm,looking at it in the camera all right so||it is now 5:17 p m so the Foundation's||been on for nine hours I look totally,257194
mC0XfRoOsMg,829.4,5 17 p m,false,5:17pm,he stopped at a gas station along the||way arriving at 5 17 p m and was there for at least eight||minutes,266815
nwWHZl6DWQM,82.6,5 17 p m,false,5:17pm,so uh we picked up those movements at||approximately 5 17 p m on the afternoon||of May which would have been Saturday,253379
nlDWN-92RLA,2088.1,5 17 p m,false,5:17pm,5 17||it is 5 17 p m on a wednesday||there is a lot of work on tonight you,229008
mhh80sjqy_s,132.1,5:17 p m,false,5:17pm,is going on that's the going on cough||cast stop me now who's 5:17 p m I||haven't started my video yet we've been,210153
I63EwVA4WGM,528.9,5:17 p m,false,5:17pm,out James with a single shot to the||chest at approximately 5:17 p m in||total James's victims ranged from eight,199814
wrYGg95SBY0,556,5 17 p m,false,5:17pm,litvin||at 5 17 p m on June 21st 2019 do you||have that in front of you yes,1562991
zlx0R7x0yyE,556.2,5 17 p m,false,5:17pm,litvin||at 5 17 p m on June 21st 2019 do you||have that in front of you yes,205650
Bom7UlgW40Q,271.4,5:17 p m,false,5:17pm,warning for an area just north of Joplin||at 5:17 p m they issued a warning for||Joplin itself 17 minutes later a,222898
lonTBp9h7Fo,556,5 17 p m,false,5:17pm,litvin||at 5 17 p m on June 21st 2019||do you,168670
NFmFPCoOg9w,13,5:17 p m,false,5:17pm,this is I'm going to date this it is||April 29th and Chad is is softly 29 5:17 p m standard Eastern time so same time||the chat salty shit Chad you're naked,159609
qJkpts1nymU,11.2,5:17 p m,false,5:17pm,after his daughter reported him missing||at 5:17 p m local time saying his phone||was off and that he had left a message,158002
cK74vhqzeeQ,1036.5,5:17 p m,false,5:17pm,will kill all of you just like this M L||died at exactly 5:17 p m which we know||because when she fell in the street her,150467
AtVLSqWq9Xo,1607.8,5:17 p m,false,5:17pm,and get that form filled out mmm||hopefully get a cop to date it's 5:17 p m right now||and today it's Tuesday August 23rd I'm,148371
NGvxGpj50Xg,335.8,5 17 p m,false,5:17pm,he says he doesn't call lacy's mom until||after this call is around 5 17 p m scott tells lacey's mom the car||and the dog are here but lacey isn,212800
DkU49iYkw2A,578.2,5 17 p m,false,5:17pm,Laura Littman||at 5 17 p m on June 21st 2019||do you,604662