id,timestamp,token,manual,time,lines,views
upqwWVvX0Eg,506.5,5:34pm,true,5:34pm,"Operation Meetinghouse, was set to take place||March 9, 1945 at 5:34pm , 334 B-29 Superfortresses took off from air bases in Guam, Saipan and||Tinian",324424
jyrPqhBNPMQ,388,5:34PM,true,5:34pm,AT SABINE PASS SATURDAY ARE AT 2:53AM AND 5:34PM FORECAST||HIGH TIDES AT SABINE PASS SATURDAY ARE AT 2:53AM AND,2661
jyrPqhBNPMQ,388.2,5:34PM,true,5:34pm,FORECAST||HIGH TIDES AT SABINE PASS SATURDAY ARE AT 2:53AM AND 5:34PM SUNRISE||FORECAST,2661
jyrPqhBNPMQ,388.3,5:34PM,true,5:34pm,AT 2:53AM AND 5:34PM SUNRISE FRIDAY||FORECAST||HIGH TIDES AT SABINE PASS,2661
jyrPqhBNPMQ,388.3,5:34PM,true,5:34pm,SATURDAY ARE AT 2:53AM AND 5:34PM SUNRISE FRIDAY IS||FORECAST||HIGH TIDES AT SABINE,2661
jyrPqhBNPMQ,388.4,5:34PM,true,5:34pm,PASS SATURDAY ARE AT 2:53AM AND 5:34PM SUNRISE FRIDAY IS AT||PASS SATURDAY ARE,2661
jyrPqhBNPMQ,388.5,5:34PM,true,5:34pm,AT 2:53AM AND 5:34PM SUNRISE FRIDAY IS AT||PASS SATURDAY ARE AT 2,2661
jyrPqhBNPMQ,390.5,5:34PM,true,5:34pm,:53AM AND 5:34PM SUNRISE FRIDAY IS AT 6:57AM||PASS SATURDAY ARE,2661
jyrPqhBNPMQ,390.7,5:34PM,true,5:34pm,SATURDAY ARE AT 2:53AM AND 5:34PM SUNRISE FRIDAY IS AT 6:57AM AND SUNSET,2661
jyrPqhBNPMQ,390.7,5:34PM,true,5:34pm,PASS SATURDAY ARE AT 2:53AM AND 5:34PM SUNRISE FRIDAY IS AT 6:57AM AND SUNSET IS||PASS SATURDAY ARE AT 2:53AM,2661
jyrPqhBNPMQ,390.8,5:34PM,true,5:34pm,AND 5:34PM SUNRISE FRIDAY IS AT 6:57AM AND SUNSET IS AT||PASS SATURDAY ARE AT 2,2661
jyrPqhBNPMQ,391,5:34PM,true,5:34pm,SUNRISE FRIDAY IS AT 6:57AM AND SUNSET IS AT 6:03PM||5:34PM SUNRISE FRIDAY IS AT 6:57AM AND SUNSET IS,2661
jyrPqhBNPMQ,391.2,5:34PM,true,5:34pm,AT 6:03PM||5:34PM SUNRISE FRIDAY IS AT 6:57AM AND SUNSET IS,2661
jyrPqhBNPMQ,391.5,5:34PM,true,5:34pm,AT 6:03PM||OUR FORECAST||5:34PM SUNRISE FRIDAY IS AT 6:57AM AND SUNSET,2661
jyrPqhBNPMQ,391.6,5:34PM,true,5:34pm,OUR FORECAST TONIGHT||5:34PM SUNRISE FRIDAY IS AT 6:57AM AND SUNSET IS AT 6:03PM||OUR FORECAST TONIGHT,2661
qEPs8AVmjdg,503.6,5:34 pm,true,5:34pm,"called for and arrived to take Hughes to the hospital||He was pronounced bed at 5:34 pm that afternoon||The Lions awaited news of Hughes' condition after the game, and were informed",4743793
g1-q_apBfAA,22.5,5:34 PM,true,5:34pm,", she gets on the last car at the back of the train||Every day at 5:34 PM , a man named Reve takes the same train to work for his night shift||Then",735223
oI9bKUKrZbs,137.6,5:34 PM,true,5:34pm,in just a matter of hours||We arrived at 5:34 PM and we cleared||there last night about 10:55 and at that,4067
L3rq1QHizRc,544.2,5:34 PM,true,5:34pm,"The Moon will also go void of||course about 5:34 PM , Pacific Time, into Monday, 3:15 AM||Pacific Time",3930
rOJuQ_qg3jY,215.6,5 34 pm,false,5:34pm,answer the phone||he then calls him back at 5 34 pm and||the call lasted 14 seconds he's there at,1435588
LcFRpcXpBho,226.7,5 34 pm,false,5:34pm,answer the phone||he then calls him back at 5 34 pm and||the call lasted 14 seconds he's there at,849519
PwS_zHg3P3Q,237.4,5 34 pm,false,5:34pm,would enter the apartment of the tutor||at around 5 34 pm and left there after 6||PM around one hour later though we don't,1162611
g1-q_apBfAA,22.2,5 34 pm,false,5:34pm,car at the back of the train||every day at 5 34 pm a man named reeve||takes the same train to work for his,735223
3jl80ZRztbg,395.9,5 34 pm,false,5:34pm,and she did not answer the phone||she then calls him back at 5 34 pm and||the call lasted 14 seconds,377185
OmfqUSCAgmo,160.2,5 34 pm,false,5:34pm,holding the body||time stamp tuesday 5 34 pm they brought||balboa outside,300847
cLjFizR1JJ0,46.2,5 34 pm,false,5:34pm,this day i end up getting stuck behind||slow drivers and i arrived at 5 34 pm and the woman flips out as soon as i get||there she's screaming at,155173
3ueFBcu-uW8,292.4,5 34 pm,false,5:34pm,answer the phone||she then calls him back at 5 34 pm and||the call lasted 14 seconds,138640
w26bNxkSToY,455.2,5 34 PM,false,5:34pm,by 5 33 PM Patrick called Lindsay but||she did not answer by 5 34 PM Lindsay||called Patrick back a call that lasted,45952
ewNG51HrIpQ,508.4,5 34 pm,false,5:34pm,'re coming home to work from work||let's just say an average time is 5 34 pm yeah pull into the back||you get out of the car and you reach for,23286
KBKcDs11-2E,650.6,5 34 PM,false,5:34pm,frantically to get Hugh's assistance||he was pronounced dead at 5 34 PM that||afternoon,20885
T2wL-bKUSI8,97.8,5 34 pm,false,5:34pm,hi guys so it's already||5 34 pm and kanina||actually,22582
n4CIdh-jc4Q,583,5 34 PM,false,5:34pm,Hugh's assistance he was pronounced dead||at 5 34 PM that afternoon the game was||played to its conclusion in front of the,19401
SHAaibU1WjU,46.7,5 34 PM,false,5:34pm,PM universal time which will be||2 34 PM if you are on Pacific Time 5 34 PM Eastern Standard Time and for those||of you that are in the southern,18154
v1YqEcctY5w,34.9,5 34 pm,false,5:34pm,minister has||made the confirmation 5 34 pm being||declared as the time of his death let's,16937
v1YqEcctY5w,72.2,5 34 pm,false,5:34pm,hospital||at 5 34 pm and as i'm health minister dr||himanta bisa sharma,16937
NNaL9y1nfyU,579.2,5 34 pm,false,5:34pm,minutes||local time in moscow is 5 34 pm and in singapore it's 10 34 pm||drinks are on the way look who,18502
x7aofRCW4dA,156.2,5 34 PM,false,5:34pm,released now according to the jail||records he was released at 5 34 PM Thursday so Martel it doesn't appear||that he needs a GoFundMe Keith is,13249
OmfqUSCAgmo,163.6,5:34 P M,true,5:34pm,"NEXT TO A BOX HOLDING THE BODY||TIME STAMMED TUESDAY 5:34 P M||AND BROUGHT BALBOA OUTSIDE,",300847
XIKAJK1sNSg,473.4,5:34 p m,true,5:34pm,"holiday, so please take care and enjoy||Alrighty, it's now 5:34 p m up here in||Northeastern Ohio",111500
oK93WDQhuNs,9.2,5:34 p m,true,5:34pm,at the Smithsonian's National Zoo in Washington||Mei gave birth to her first cub at 5:34 p m||after her water broke about an hour beforehand,15277
xSslvA12U8U,591.7,5:34 p m,true,5:34pm,lot of exercise and here it all is||so it is day 91 December 26 5:34 p m and I decided to that's not my blood||pressure I decided to come to,9693
fpZl3o1D5fg,80.7,5 34 p m,true,5:34pm,almost time to launch let's see how it goes hello so it is now||5 34 p m we're nearly there i am just making sure||that everything is ready i'm,7264
nig65siGScM,112,5:34 p m,true,5:34pm,clouds and that's about it||anyway today is Friday December 20th 2019 at 5:34 p m||up here in,3542
oisC3wPeCkY,754.7,5:34 p m,true,5:34pm,for our first query||Our query results show that the application has been running since 5:34 p m Now let’s run a rate query on the application itself||Because it produced results,4749
rFRLAQZWo2Q,754.7,5:34 p m,true,5:34pm,for our first query||Our query results show that the application has been running since 5:34 p m Now let’s run a rate query on the application itself||Because it produced results,2067
EpNGXOZZknw,348.2,5 34 p m,false,5:34pm,right I think they had a different name||though 5 34 p m what a nice day in Palm||Springs California ball says I guess,1054018
G1cxDghbnrU,438.6,5:34 p m,false,5:34pm,first one I receive on the 19th of||January 2017 at 5:34 p m do you think||you are take down your YouTube video now,472834
l9uIig7h5bI,33,5:34 p m,false,5:34pm,better||as usual your boy is like 5:34 p m the||gun in your apartment perform of doing,434560
upqwWVvX0Eg,508.7,5 34 p m,false,5:34pm,house was set to take place march 9 1945||at 5 34 p m 334 b-29 super fortresses took off from||air bases in guam saipan and tinian,324424
HxueU5oAblY,709.9,5:34 p m,false,5:34pm,activities and saw this my phone reached||my house at 5:34 p m it didn't ever||leave the house at 1213 a m,266403
o0VpFcnaTvw,747.6,5 34 p m,false,5:34pm,pronounced dead at a henry ford hospital||at 5 34 p m his official cause of death||was acute coronary thrombosis,255811
WIdSaPpXb3o,740,5 34 p m,false,5:34pm,by the way||at 5 34 p m the next day you're so||goddamn cute,227482
yhpmU77Fq9E,373.6,5 34 p m,false,5:34pm,did i responded to the march 5th email||at 5 34 p m if i send you a new battery||you will need to send the old one,180502
Mv-6pg9Np10,630.6,5:34 p m,false,5:34pm,don't like in the meal denied or said||5:34 p m wow that's pretty good that||was good we stayed the night in the,171963
EBjROVIelR8,401.5,5 34 p m,false,5:34pm,that yet today||it is 5 34 p m and we are at||41 and now i think we should head,177821
hC06uXYRX70,395.7,5 34 p m,false,5:34pm,in this case||5 34 p m so while it's not necessarily||spelled out on a doordash we can just,126996
XIKAJK1sNSg,480.4,5:34 p m,false,5:34pm,holiday so please take care and enjoy no||no really it's now 5:34 p m up here in||northeastern ohio jailings can wave,111500
FCjvXTlHFxY,548.3,5 34 p m,false,5:34pm,killed gannon in his bedroom between 2||19 pm and 5 34 p m on january 27 2020||while the two were home alone,101233
XGIdHQZnj1w,302.2,5:34 p m,false,5:34pm,fascinating about this is he tweeted||that at 5:34 p m on November 23rd so||that would have been Saturday night at,97383
XGIdHQZnj1w,311,5:34 p m,false,5:34pm,that would have been Saturday night at||5:34 p m that's when he tweeted that||out okay okay,97383
iXWkX8bhYEc,594.6,5 34 p m,false,5:34pm,5 33 p m you said that||5 34 p m 5 35 you said that he excuse me||oh this is very nice and now,95008
WMIgnzQoorc,829.9,5 34 p m,false,5:34pm,that I can move on||for a time stamp it's 5 34 p m and I've||completed 113 Acres today so far,1194079
oGyzATwtbPk,658.8,5 34 p m,false,5:34pm,videos come out team of the week will||already be out but it's currently 5 34 p m here so unfortunately not been||able to see that yet but i'll have,86134
C_hyyokY0v4,735.3,5 34 p m,false,5:34pm,yep otherwise oops||okay guys time check it's currently 5 34 p m 26 more minutes still rate hour starts||but this is battle number 45 for me,85285
kGPqFg7FG7o,76.2,5 34 p m,false,5:34pm,are batteries are gonna drain as||I Vlog throughout the day okay so it's 5 34 p m and we are at 84 battery this is||the Hong Kong tram by the way,79724
5Vvu4dBOX98,339.9,5 34 p m,false,5:34pm,tube top||hey guys so it's currently 5 34 p m and then has a zoom so we're just||waiting,77175
1MjwZB6-wVQ,2082.2,5:34 p m,false,5:34pm,texts I'm trying to come up call me||between 421 and 5:34 p m Quentin's||phone is showing and that he is at home,67068
1MjwZB6-wVQ,2162.2,5:34 p m,false,5:34pm,down u s||51 at 5:34 p m Quinton calls||Jessica back this is the last call that,67068
TmdTp7j9VO0,108.5,5 34 p m,false,5:34pm,are||police say around 5 34 p m on sunday||they discovered the body,58689
OErtfRSxSuk,515.9,5:34 p m,false,5:34pm,so I will be checking back throughout||the day alright so it is now 5:34 p m so then you should have been on for||almost,46812
Qoumaccwlqg,1365.2,5 34 p m,false,5:34pm,we have been together since 11 a m it's||5 34 p m honestly it's perfect timing because the||parking ticket,50415