id,timestamp,token,manual,time,lines,views
s-Mrci8DKsI,532.1,6:40pm,true,6:40pm,"line||Another counterattack at 6:40pm was barely resisted by a combination of artillery and||infantry defensive fire, and brutal German",710352
5ViuJAtpYXE,176.6,6 40pm,true,6:40pm,"arriving buses and these are the departure buses||I don't have a bus till 6 40pm||Now the time is 3 30pm, I have to wait many hours",623723
uDspYKCbfXg,1281,6:40pm,true,6:40pm,before 7pm if we don't take any brakes||Time is 6:40pm now||We'll reach before 8pm,447645
uDspYKCbfXg,1290.8,6:40pm,true,6:40pm,We'll reach before 8pm||Time is 6:40pm now||We are going on the Asian highway number 13,447645
uDspYKCbfXg,1281,6:40pm,true,6:40pm,before 7pm if we don't take any brakes||Time is 6:40pm now||We'll reach before 8pm,447645
uDspYKCbfXg,1290.8,6:40pm,true,6:40pm,We'll reach before 8pm||Time is 6:40pm now||We are going on the Asian highway number 13,447645
IP9bN-0dlFA,673.3,6:40pm,true,6:40pm,massive Ilyushin plane began to gradually drop||The time was 6:40pm when Kazakhstan Airlines||1907 radioed to the ground they had reached their,175513
koeYzlad5kI,341,6:40PM,true,6:40pm,"Let's look for something to eat||So it's already 6:40PM ,||so we need to board by 7PM",19232
tOkinHX5HPY,142.8,6:40pm,true,6:40pm,"a baseline starting point to understand battery life on this||I started the test at 6:40pm ,||and the battery on the transmitter didn't die until 2:55am",27068
TyCfCnrc2vM,597.5,6:40pm,true,6:40pm,so hello guys||it's currently 6:40pm my sister and i want to watch the olympics||we are actually waiting for the,10452
G3xyZbPaXkg,675.7,6:40pm,true,6:40pm,Empty||6:40pm : JB Custom cleared||Very few people queuing around this time,12148
d9piuA2buEo,225.5,6:40pm,true,6:40pm,birth day is @7:30pm||We will definitely reach there at 7:30pm||Now its 6:40pm undefined,5488
AsTXvwCRtdM,140.6,6:40pm,true,6:40pm,"voice heard - ""Alarm On||6:40pm ""||You can also use this button to enable snooze and to turn the alarm off",9583
AsTXvwCRtdM,154.6,6:40pm,true,6:40pm,"voice heard - ""Snooze On, 6:40pm||Alarm Off""||In this last segment, we will demonstrate how to turn the hourly announcement",9583
vLa0KvC3js8,114.2,6:40pm,true,6:40pm,"That's a wrap on day one||6:40pm||Daily totals here, almost 10 hours ride",3269
kbNNGB7vtqA,255.9,6:40pm,true,6:40pm,"There||And, it's now 6:40pm We're going to have our dinner now||You're hungry now?",1631
UG2vSvi3dy0,337.5,6 40pm,true,6:40pm,", enjoyed four hours of freedom before being recaptured about seven miles away, in Arborfield, at 6 40pm Exhibits are taken into court during Straffen's trial||Image: PA Archive/PA Photos||That",1257
ii25LEPYhRU,348.2,6:40pm,true,6:40pm,"down to get a sleep||But he died suddenly and quietly of heart failure at 6:40pm ""||Less than two hours after he came on board the hospital ship",2828
IhTsa2nWUsE,10.9,6 40pm,false,6:40pm,like that when the freak storm blew off||their roofs and ceilings at around 6 40pm when he found out about the incident to||assess the damages,150096
dhiwCvSfi5w,643.5,6 40pm,false,6:40pm,and drop of gold states she is filming||at 6 40pm meaning the object has been there for||hours without leaving,94503
HYP5zhXYLeM,16.1,6 40pm,false,6:40pm,episodes of walk the prank starting 11||april at 6 40pm new and exclusive on||disney channel,15240
xAigVghsyc4,2.1,6 40pm,false,6:40pm,we record the fishton tunnel in||salisbury at 6 40pm 6 45 pm tonight||following reports of a train derailment,2311
y4s5qie3lkU,383.2,6:40 PM,true,6:40pm,"And then||you can see at 6:40 PM , they alerted ERT and||I could be wrong, but I think this was them",1275336
VX2yb3YWxNY,122.1,6:40 pm,true,6:40pm,We had to reach at that Restaurant opening around 7pm and i picked her at 6:40 pm Western Express highway was fully jam now to cover a 22km distance now think how,1260723
olfSIljyQDY,1468.6,6:40 PM,true,6:40pm,"against both suspects||- At 6:40 PM today, Saturday the 20th of February, 1993||two 10-year-old boys from the Walton",632496
D2jhrLbLKGI,216.9,6:40 PM,true,6:40pm,claim to communicate with the virgin||at exactly 6:40 PM each day||Medjugorje has become a virtual mecca for Catholic pilgrims,425795
LQWrhyk4lus,404.9,6:40 pm,true,6:40pm,"So its 6:40 pm I have knit over 600 yards, and I am ready to change needle sizes||and",255962
Z0dF9B82hVA,165.1,6:40 PM,true,6:40pm,"release a public notice to address the incident||It reads, “On May 9th at around 6:40 PM , a||student fell from the top floor corridor",182383
fVWde4HEyFU,916.9,6:40 pm,true,6:40pm,I have been in my office since seven this morning||and it is now 6:40 pm So I think I'm going to call it quits here pretty soon||so I,176253
jZU9x6jyMQM,805,6 40 pm,true,6:40pm,running toward him and so many conversions||that evening during her apparition at 6 40 pm she||said to the visionaries these deeply moving words,152937
OJ2NHW3-vS8,472.2,6 40 pm,true,6:40pm,Eric just feels incredible||It's 6 40 pm now||We just got out of the water and we're gonna head up to,58941
QcU0NeP27vg,401,6:40 PM,true,6:40pm,light rain showers||6:40 PM heavy rain showers||printer chirping,67488
ijdc672ifHc,402.5,6:40 PM,true,6:40pm,"Fargate and EventBridge were among the slowest to fully stabilize,||needing until at least 6:40 PM Pacific or 9:40 PM Eastern||What a day? Huh?",33562
BgafPrC2p4w,16.7,6 40 PM,true,6:40pm,"It happened on Wednesday 9th of March, close||to 6 40 PM||A Brahmos Surface to Surface",37102
43tdsZzuAGo,1140.7,6:40 pm,true,6:40pm,air whooshing||It is 6:40 pm We are home a bit later than usual||because after soft play we met Dan,67254
QbW7IkaE06w,1446.3,6:40 PM,true,6:40pm,"this is what Main Street USA looks like||at the moment, about like I said 6:40 PM kind of thing||The park closes at 8:00 so not long to go before",26598
UOY7sV-gbhc,3212.3,6:40 PM,true,6:40pm,"train 8, curves around to the west to be turned on the wye||Just after 6:40 PM , our last train of the day, Capitol Limited train 30, departs Chicago||The other long",1569634
vCANGDH_czA,629,6:40 PM,true,6:40pm,with a max intensity of 25||Sunrise at 8:00 AM and sunset at 6:40 PM I'm using the Ink Bird Temperature Controller||set to 78 degrees with a variance,28038
XlRWW5Hqd5I,468.3,6:40 PM,true,6:40pm,and that's probably between the time of||6:40 PM and 7:00 o'clock PM on the 27th||Earlier in the investigation we needed,11613
Xtyuf263zo4,4.5,6 40 pm,true,6:40pm,so I am talking to you from the past||Time is 6 40 pm we are running late||We are going by train,11322
sAudlQrBMBg,45.5,6:40 PM,true,6:40pm,"BOTH||AT APPROXIMATELY 6:40 PM ON||MARCH 10, THE POLICE OFFICERS",11210
6ig7ge_XREA,121.8,6 40 pm,true,6:40pm,combination||we got here it's what time is it 6 p m it's 6 40 pm it's like 6 40 p m i think it's like 2||40 a,19136
2eBKqEHcGm8,812.4,6:40 PM,true,6:40pm,But between 2:43 PM||Up to 6:40 PM||The team Houston team was in,7173
3Tsfd4B6UFI,378.7,6:40 PM,true,6:40pm,Will take the mound for the Padres||first pitch tonight at 6:40 PM I think we only had four hits for the||game and we gotta get those,6744
QTjo1vGAalQ,0.8,6:40 PM,true,6:40pm,undefined 6:40 PM FLIGHT WAS DELAYED SIX||HOURS AND THEN CANCELED AFTER||EVERYBODY BOARDED,6114
HQyI5PXaYo4,331.6,6:40 PM,true,6:40pm,"energies start to really open up and and timed for a lot of||around 6:40 PM , Pacific Time, the Moon goes into Aquarius for||Sun",5950
H3983UyyyBM,442,6:40 PM,true,6:40pm,The Pottery's Diamondbacks playing||in Arizona again today at 6:40 PM The next time fans will see||Tatis play at home is on May 1st,5310
k-BiL9xrwEQ,54.2,6:40 PM,true,6:40pm,"HER MOM TOLD POLICE THAT AROUND||6:40 PM YESTERDAY SHE WENT TO||CHECK ON ATHENA, BUT SHE WAS",5061
VBe550yNctw,433.3,6:40 PM,true,6:40pm,series starting tonight at Petco Park||First pitch at 6:40 PM Just do what we did in the playoffs||again,7700
hid-DDth_B8,131.1,6:40 PM,true,6:40pm,"Rodney’s next course, Consulting Skills, is scheduled to meet on||Mondays from 4- 6:40 PM in Oliver Hall||By checking the attributes, we can see that this course is a",4873
hid-DDth_B8,153.6,6:40 pm,true,6:40pm,"scheduled class time||Rodney’s Topics Course is scheduled to meet on Wednesdays from 4- 6:40 pm online||By clicking on the attributes button, you can see that that this course is",4873
UVhE1EgJW2U,22.8,6:40 PM,true,6:40pm,"But we're going to hit this||curveball at 6:40 PM , right||just fine",4594
od58Hwyj9pY,856,6 40 pm,false,6:40pm,night she disappeared a full hour after||her last known sighting at 6 40 pm on||the night Rachel disappeared Alison was,4179944
UYMMQByTCz4,1362.4,6 40 pm,false,6:40pm,norma agreed and they reached spread||creek around 6 30 or 6 40 pm norma said||she already shared her encounter with,3149923
0e64lerZmJw,716,6 40 pm,false,6:40pm,could be done and ellen was||tragically pronounced dead at 6 40 pm there in her kitchen so pretty much||right away the police treated this,2760306
IFzL7qSt8Gc,1959.5,6 40 pm,false,6:40pm,really kick in||later at 6 40 pm following sydney's||dance recital,2510584
NMCtPbpB2EU,182,6 40 PM,false,6:40pm,never came for her||at around 6 40 PM Abdullah was driving||on the highway in Los Banos California,1846491
PK8Ue2F7GXU,405.8,6 40 pm,false,6:40pm,on friday july 19 2013||around 6 40 pm a boat loaded with seven||passengers was dispatched from the,1500161
3uZp-_e5KKE,553.8,6 40 pm,false,6:40pm,on the trail||but images taken later at 6 40 pm much after the time they'd reached the||summit shows the sun and chris,941527
s-Mrci8DKsI,531.8,6 40 pm,false,6:40pm,line||another counter-attack at 6 40 pm was||barely resisted by a combination of,710352
W9BORO6y1fk,960.7,6 40 PM,false,6:40pm,years Beckett arrived on New Year's Eve||at 6 40 PM while Freya was born six||hours later at 12 26 a m on January the,664655
olfSIljyQDY,1468.6,6 40 pm,false,6:40pm,suspects||6 40 pm today saturday the 20th of||february 1993,632496
JLdvzx6u9ks,116.2,6 40 pm,false,6:40pm,and save||so much money it's 6 40 pm and it's so||dark 5 40 pm,560214
pR6iQpj0-pU,60,6 40 pm,false,6:40pm,were damaged during a freak storm||on sunday at 6 40 pm the roof files were||blown off and electricity poles were,481586
Gz7WWUrCzes,794.2,6 40 PM,false,6:40pm,blood brother wearing a car went at||about 6 40 PM police found a two inside||a white Chrysler on South 51st Street,514785
71tSMxOceSI,217.3,6 40 PM,false,6:40pm,to order food for dinner right after at||about 6 40 PM Tyler realized that||Michael wasn't inside he went outside to,491904
71tSMxOceSI,1420.1,6 40 pm,false,6:40pm,father saw him that night it's now||believed that he disappeared between 6 40 pm and 7pm Tyler was later able to||provide a receipt from the pizza that he,491904
71tSMxOceSI,1428,6 40 PM,false,6:40pm,had ordered and the time stamp was 6 40 PM it's unclear why they changed it but||it's safe to say and assume,491904
jUXmQhoY_rQ,1110.8,6 40 pm,false,6:40pm,so unrecognizable||the same day just after 6 40 pm Sheriff||Lucas confirmed that a suspect had been,437945
EPFgoUjA4zQ,190.3,6 40 pm,false,6:40pm,malibu that's not responsible babes||oh my god 6 40 pm zero drinks down live||a cleanser,424105
Bd6-pi8tjCk,955.7,6 40 PM,false,6:40pm,now is from 9 51 a m check it out||and this footage is from 6 40 PM you can||now see that on that big mushroom the,783074
-UTDiEZCK0U,642.6,6 40 pm,false,6:40pm,the search and rescue team coordinator||was notified at about 6 40 pm and two other specialized teams from the||department were mobilized,356862
ktm45DMecHk,725.6,6 40 PM,false,6:40pm,her right leg and her abdomen just 10||minutes later at approximately 6 40 PM Ellen was pronounced dead now as police||started investigating the scene trying,375465
J1-iWAAm-SU,1467.1,6 40 pm,false,6:40pm,sufficient evidence||against both suspects 6 40 pm today||saturday the 20th of february 1993,657178
1V5VxfRNLDM,1093.4,6 40 PM,false,6:40pm,for assistance went out to State Police||Sergeant detective Bill ball at about 6 40 PM a little over five hours after||Judy had left her parents home to go,260029
2jQSym_C4Tc,207.4,6 40 pm,false,6:40pm,this same supercell would produce||another ef2 around 6 40 pm this tornado||was 1 6 miles wide and tragically killed,395275
uYc_KpVqXko,27.9,6 40 PM,false,6:40pm,death of 275 lives||at 6 40 PM coromandel Express left||balasor for bhadrak in bhadrak orisha,229384
0qqlhUuJCTc,59.3,6 40 pm,false,6:40pm,One Survivor explains what happened||I boarded the train around 6 40 pm and||within 10 minutes I heard a big sound,224394
efTQdpVlZ5Y,19.7,6 40 pm,false,6:40pm,evening||the incident that happened at 6 40 pm saw roof tiles blown off while||electricity poles were also felt,200056
Z0dF9B82hVA,165.1,6 40 pm,false,6:40pm,incident||it reads on may 9 that around 6 40 pm a||student fell from the top floor corridor,182383
wI0Sg5eyd0Y,23.2,6 40 pm,false,6:40pm,prabha in the room at capital hotel||between 6 05 pm and 6 40 pm last may 3rd||they were charged under section 302 of,167296
dDkA9UVUysc,885.8,6 40 pm,false,6:40pm,left his place after about an hour and||a half and got home just after 6 40 pm to my surprise James was not home yet I||was okay with this as it,178144
kLJmNCMCz2Q,2712.5,6 40 PM,false,6:40pm,Sven also claimed that at approximately||6 40 PM Catherine texted him again||asking him to pick her up at 7 pm from,165663
6FztbTw7pu0,1214.6,6 40 pm,false,6:40pm,so unrecognizable||the same day just after 6 40 pm Sheriff||Lucas confirmed that a suspect had been,242923
zhd6lcreLlE,2008.3,6 40 PM,false,6:40pm,before the Christmas holiday||at around 6 40 PM Jack was recorded on||CCTV again this time at a parking garage,185189
IP9bN-0dlFA,673.3,6 40 pm,false,6:40pm,gradually drop||the time was now 6 40 pm when kazakhstan||airlines 1907 radioed to the ground that,175513
tZfkwwXfSIw,0,6 40 pm,false,6:40pm,around 6 40 pm on Friday July 19 2013||new Texas Giant at Six Flags Over Texas||in Arlington,229255
tZfkwwXfSIw,268.6,6 40 pm,false,6:40pm,all the way up to the day of the||accident around 6 40 pm on Friday July||19 2013 new Texas Giant was operating,229255
jZU9x6jyMQM,806.4,6 40 pm,false,6:40pm,that evening||during her apparition at 6 40 pm she||said to the visionaries these deeply,152937
vWo3Th7_h4E,144.9,6 40 PM,false,6:40pm,to hang out with two of his friends||after finishing his work hours it was 6 40 PM in the evening when Doug returned||to their mobile home in Nelson trailer,128710
1IsY5teBVwk,364.3,6 40 PM,false,6:40pm,for this story to take a drastic turn by||6 40 PM that evening Ellen was||pronounced dead in her apartment with 20,363149
ox4NAWEIIKU,348.9,6 40 pm,false,6:40pm,darian leaving may the 3rd||at 6 40 pm and he leaving with just his||son,107474
vujtSSCvaj0,32.6,6:40 P M,true,6:40pm,A NEIGHBOR SAID IT WAS||6:40 P M||ON MONDAY EVENING WHEN,14947221
_3wmdYfBGqs,1991.6,6:40 p m,true,6:40pm,"Light rain showers||6:40 p m , heavy rain showers||It seems the weather service correctly identified",3146702
jj-4jf3e5_A,461.8,6 40 p m,true,6:40pm,deadlines at work and isn't able to get away||from his office until around 6 40 p m Much later||than he had planned,2357548
zvPAdt7cy7k,1991.6,6:40 p m,true,6:40pm,"Light rain showers||6:40 p m , heavy rain showers||It seems the weather service correctly identified",687079
fc5tIKFDy1s,1580.6,6:40 p m,true,6:40pm,"Yes, Lindsey?||Senator Graham: Well, at 6:40 p m ,||I'm going to go to Menendez's office,",447768
_zjPBNd5aeU,479.9,6:40 P M,true,6:40pm,"I feel very energetic, so what time is it now?||6:40 P M So we're still going towards the city||So apparently all the Sylhetis come here",334483
aClnKVe054I,370.6,6 40 p m,true,6:40pm,device within a six meter radius||so it says then alex exited the park at 6 40 p m and since lori and tyler and jj were with them||we'll assume all of,177706
cTk1zF7onA0,366.8,6 40 p m,true,6:40pm,us concerto and symphony most of our dinners||were scheduled between 6 20 and 6 40 p m in the||evening now we've been on over 40 cruises most of,191614
ZvRgF5rXXrM,155.9,6:40 p m,true,6:40pm,plot we call Tree Plot||GRANT: You might note that Louie worked that scrape about 6:40 p m on December 3rd||GRANT: As we reviewed the videos and images from other Reconyx cameras,63577
5crsdsE6dAI,19.9,6:40 P M,true,6:40pm,PENNSYLVANIA AVENUE||POLICE SAY JUST BEFORE 6:40 P M||TWO MEN WERE STANDING AROUND THE,46958
R6inrSd9qFk,380.7,6:40 p m,true,6:40pm,Austen||Captain Jack's already lit at 6:40 p m ?||Guy,49812
5QFamZaSPRY,84.3,6:40 P M,true,6:40pm,">> Reporter: POLICE SAY JUST||BEFORE 6:40 P M , TWO MEN WERE||STANDING AROUND THE",33561
D6TaGWqjEME,1626.5,6 40 p m,true,6:40pm,god gives his greatest challenges to his||strongest soldiers baby level 20 let's go 6 40 p m it's level 20 ooh am i trading the club for the||long sword what,71975
1-85LBc_LhM,114.5,6 40 p m,true,6:40pm,living room playing a game on his nintendo||at around 6 40 p m michael's dad tyler vaughn||went to check on arya in her bedroom and order,35076
hMfeJk7GsR8,137.7,6 40 p m,true,6:40pm,I just took it out and Maghrib here in Germany||will be at 6 40 p m leave me in the comments below||what time is maghreb in your country it's,30799
fYV41KNf-NQ,1433.8,6 40 p m,true,6:40pm,the auction so you get notified tonight when i go||live it'll be at 6 40 p m eastern 6 45 p m eastern||so guys i had a lot of fun a,17708
dx2DqnxvKGM,61.1,6:40 P M,true,6:40pm,AVENUE WHERE POLICE SAY AROUND||6:40 P M A MAN WAS SHOT AND||KILLED BY PHILADELPHIA POLICE,16581
6ig7ge_XREA,121.8,6 40 p m,true,6:40pm,what time is it 6 p m it's 6||40 pm it's like 6 40 p m i think it's like 2||40 a m in korea time so i feel,19136
Mz8oo77FXCM,1391.5,6 40 p m,true,6:40pm,So I then looked at this Tiktok here||that he uploaded at around about 6 40 p m on the 28th of February 2022||From,51583
73nvA5jGylA,251.8,6:40 P M,true,6:40pm,", INCLUDING THE CITY OF TYLER AT ABOUT 6:40 P M AND THEN||THE CITY OF TYLER AT ABOUT",14947
73nvA5jGylA,253.8,6:40 P M,true,6:40pm,AND THEN||THE CITY OF TYLER AT ABOUT 6:40 P M AND THEN BASED ON RADAR IMAGERY AS||ABOUT,14947
73nvA5jGylA,252.1,6:40 P M,true,6:40pm,THE CITY OF TYLER AT||ABOUT 6:40 P M AND THEN||BASED ON RADAR IMAGERY AS,14947
yYtMJ7S4sfg,176.7,6:40 P M,true,6:40pm,LOOKING FOR HER AND ULTIMATELY||CALLED 911 AT 6:40 P M||TO REPORT HER MISSING,9879
dUa0xeQob4Y,579.5,6 40 p m,true,6:40pm,long day um it is now i'm back in my room it is||now 6 40 p m and i think i'm done i think i'm done||with um la for,14845
m9QZoEKjg-k,45.2,6:40 P M,true,6:40pm,POLICE SAY THIS HAPPENED RIGHT||AROUND 6:40 P M||A BLACK,6803
VDmMvQnxEcw,184.4,6:40 p m,true,6:40pm,out with what court documents say was bleach then later that||same Friday evening at 6:40 p m Vince and his son are seen on surveillance||cameras leaving without Malia despite Vince telling,6769
CWdeJqPh9Ek,100.6,6:40 p m,true,6:40pm,"they hadn't seen her either||At 6:40 p m , she called Jacob,||who was driving toward San Antonio to meet his father for a",6221
plsmY_QneHY,585.4,6 40 p m,true,6:40pm,that's really cool very||great quality of life super epic all right it's 6 40 p m I totally forgot that I told you guys||I would take you fishing all right,6692
Utz984FHm-k,101,6:40 P M,true,6:40pm,A's TO TAKE ON THE RANGERS AT||6:40 P M WITH PARTLY CLOUDY SKIES||THE NUMBER OF ABOUT 60 DEGREES,4415
1WMDu-1JOLY,9.4,6:40 p m,true,6:40pm,"Investigators need your help identifying homicide suspects||On January 28, 2023, just after 6:40 p m , three adults were shot and two children||were seriously injured after gunfire erupted in the 1700 block of Pennsylvania Avenue",5777
SszrhM6eF9w,44.8,6:40 P M,true,6:40pm,SEVEN O'CLOCK TONIGHT AROUND||6:40 P M||WE'RE KIND OF FAR AWAY,2601
aUyqL5o89jc,45,6:40 P M,true,6:40pm,FEDERAL AGENTS TOOK HIM BACK||INTO CUSTODY SUNDAY AT 6:40 P M||IN REISTERSTOWN,2754
DutQbEPqaNk,983.9,6 40 p m,false,6:40pm,julie||6 40 p m india does not have too many exclusive||dips in fact we just have a veg,4408966
9tJ5jctvvwc,720.8,6:40 p m,false,6:40pm,so my trip is almost coming to an end it||is currently 6:40 p m and I am about an||hour away from the airport this whole,3323277
pTnt89UhxEU,686.9,6:40 p m,false,6:40pm,found at the house that evening about||6:40 p m Josh returned home with the||two boys claiming they'd went camping in,2134125
72XLTfmcaAw,744.9,6 40 p m,false,6:40pm,kevlar vests of their own||at 6 40 p m just 22 minutes after the||first shots were fired,1943531
lJFSy9ijLyc,1075.8,6 40 p m,false,6:40pm,russell and rob ended their radio call||at around 6 40 p m and that's when this mystery||begins,1578513
lJFSy9ijLyc,1102.5,6 40 p m,false,6:40pm,will be over a week||before it's handed to police well 6 40 p m was the||cut-off time for the conversation with,1578513
lJFSy9ijLyc,2068.5,6 40 p m,false,6:40pm,nearly everything had been burned||we know when the fire occurred from 6 40 p m on the 20th||till the 21st two o'clock in the,1578513
3LsqaJrKiPI,1241.7,6:40 p m,false,6:40pm,thought honey we couldn't be making it||any easier for you and it's 6:40 p m she finally came online||that's what us that was the last thing,1378836
eAIcLGunrU4,1647.5,6 40 p m,false,6:40pm,poster and I just remembered that I||actually saw Rachel on March 1st at 6 40 p m and she was walking around with||another girl and they actually got off,1384762
eAIcLGunrU4,1676.4,6 40 p m,false,6:40pm,talking and laughing like nothing was||super awkward 6 40 p m and that was you||know around the time where Elizabeth's,1384762
ehSwh80Wq00,88.2,6 40 p m,false,6:40pm,immediately the last time that anyone||had heard from her was around 6 40 p m when she tweeted i actually look cute||right now that was probably after,1241515
MsJuHfjunoA,1156.7,6 40 p m,false,6:40pm,the 13th at like half 10 in||the morning and then oscar was here at 6 40 p m on the 13th of march 2020||sorry,1072024
uOTX9iwTiyU,23.7,6 40 p m,false,6:40pm,games the first game is 107 p m||the second game is 6 40 p m so there||won't actually be a lot of time between,1642641
i9BalX28g_I,634.6,6 40 p m,false,6:40pm,comfort zone they were scheduled to||start at 6 40 p m in daylight hours something they hadn't||done in years and like every other band,1090022
vQ_U3pHlzw8,400.2,6:40 p m,false,6:40pm,after I ran it to over it it looked||great okay guys it's 6:40 p m things||are happening I have a lot of updates to,1017624
ER0ClCPv2EU,1095.1,6:40 p m,false,6:40pm,the Samba live on your screens around||6:40 p m on Saturday between 6:40 and 7||o'clock p m,1018861
wTzlDStuzHc,754.8,6:40 p m,false,6:40pm,County Sheriff's Office the Sheriff's||Office arrived at the pond at 6:40 p m and had to work until midnight to pull||the vehicle out of the water,934584
PvVY8M3Mcqc,2724.1,6 40 p m,false,6:40pm,from literally||nine in the morning and it's now 6 40 p m for me||yep it's been a freaking grind but i've,807621
Qmn0aAyzZiU,87.6,6 40 p m,false,6:40pm,to hit now||what time is it i guess well it's a 6 40 p m store four o'clock||and yes four so yeah normally about two,798645
ipit17fhJwk,206.8,6:40 p m,false,6:40pm,4 days later||on the 12th of December at 6:40 p m we||had a beautiful little boy who was very,762225
6-TQkgwM1xo,149.7,6:40 p m,false,6:40pm,sit||it is now 6:40 p m the day is nearly||over we fly back to New York at 11:20,747065
AY9zDW06eas,202.4,6:40 p m,false,6:40pm,changes her story about the last time||she saw Lisa 6:40 p m she now claims||not 10:30 p m,708802
rgMnJAsaD_g,1048.4,6 40 p m,false,6:40pm,9 00 a m||it is 6 40 p m right now||so that is what about nine hours,639573
WCKp20oUkjQ,142.1,6:40 p m,false,6:40pm,the video showing the racism and||approximately 6:40 p m on March 28th||Raleigh police officers responded to a,648482
nLCvijAhVLY,596.9,6:40 p m,false,6:40pm,next Saturday don't forget to actually||watch live 6:40 p m the show stars only||like a half an hour time slot for,623367
eqcjx3EybxE,470,6:40 p m,false,6:40pm,two three guess what the Jazz take the||floor at 6:40 p m boy||make some final preparations and get,549225
FLVM0_23j-E,9,6:40 p m,false,6:40pm,out at the Notre Dame Cathedral at||approximately 6:40 p m Paris time by||early the next morning it would be,526769
UcoQNbvracM,333.3,6 40 p m,false,6:40pm,on life in so long okay||it's 6 40 p m i just ended my live on||instagram that was like really fun,535933
4foWUpoWwxI,2993.2,6:40 p m,false,6:40pm,and a husband on my head be it I||swear I never killed anyone at 6:40 p m on November 30th 1921 the jury withdraws||to deliberate they're burdened two and a,523122
CGCtl7p11Rw,819.8,6 40 p m,false,6:40pm,unit||it was 6 40 p m back at her unit caroline put rachel at||ease she showed her some relaxation,510748
Q69ZOxfQKB4,39.1,6:40 p m,false,6:40pm,we're actually headed there at around||6:40 p m that's when our flight is we||actually thought her flight was like,479265
6VxX0PLc9Qs,348.7,6:40 p m,false,6:40pm,we can get another tool now the time is||6:40 p m all right that's sing oh we||did get another one,473524