id,timestamp,token,manual,time,lines,views
RsFimjckh3M,30.9,12:04 am,true,12:04am,BLANK||Tomorrow at 12:04 am||Discord can predict the future,363643
LXVu0-gYqPI,14.1,12:04 AM,true,12:04am,"Yesterday, Taehyung teased us with his new hairstyle by posting a photo on his Instagram||Story at 12:04 AM||In the picture, he was seen sitting on an airplane seat",58989
rbiYcrriZnc,809.8,12 04 am,false,12:04am,advantaged to go to the gop||it is on 12 04 am here on the east coast||and we can make a projection in the,29569
mecC-M3kJMg,78.5,12 04 am,false,12:04am,november 13th of 2021 at exactly 12||12 8 12 04 am that is some straight dedication right||there,23319
0C_7mks7jFI,1041.5,12:04 am,false,12:04am,you come across it will speak to for||example I was writing this talk at 12:04 am just this past Friday and I opened up||the Quran to test this and the,13466
iZl-ddssrhM,717.8,12 04 am,false,12:04am,yes thank you so much for the mega tuna||another dito 12 04 am guys oh my gosh||guys joyce martinez thanks so much for,12493
EA3XGpK5k3E,38,12:04 A M,true,12:04am,BABY BROOKE THIS MORNING AT||12:04 A M AT ETOBICOKE GENERAL||HOSPITAL,31737
hYxjy_u1fSs,71.3,12:04 a m,false,12:04am,recording this it is past midnight it||isn't 12:04 a m it is way past my||bedtime my voice you can probably hear,729407
RsFimjckh3M,29.2,12:04 a m,false,12:04am,Bravo you have defeated me you missed a||call from blank tomorrow at 12:04 a m discord can predict the future ah||gigabytes of junk remaining hello um,363643
svsf7ErzJwE,481.7,12:04 a m,false,12:04am,Continental Hotel and captured on||footage outside at 12:04 a m 55 days||after her disappearance her body was,149912
rYVjfUE12H8,1610.5,12:04 a m,false,12:04am,my life||it was 12:04 a m Halloween morning when||my radio came to life on the other end,87131
pgAn_CZRRFk,825.1,12:04 a m,false,12:04am,I'm home I just took the dogs on||their nightly walk and it is 12:04 a m which means it is officially December||1st so it is the month of Christmas and,85564
zc_JhEnEpbg,129.9,12:04 a m,false,12:04am,my uploading process at 12:02 and||uploaded officially at 12:04 a m and I||was kind of bummed about it and I told,81651
QnsghpKHrTs,802.2,12:04 a m,false,12:04am,mystery man James Sam's there for||another three minutes and at 12:04 a m Jane looks at her watch the camera||switches positions once again to another,74099
K802x_YNNMU,5.5,12:04 a m,false,12:04am,it's actually pretty late it is midnight||12:02 am 12:04 a m actually and we're||going to be doing this banner so I can,60704
IMQKF4_MSnI,660.4,12:04 a m,false,12:04am,problems with it does it does it I think||every night at 12:04 12:04 a m it||automatically gets the time and the cool,72407
ObnbeN22AcM,22.6,12:04 a m,false,12:04am,miss booty jiggle is here on a QA Friday||night Saturday morning it's 12:04 a m on the East Coast the answers are going||to be short because we got to,47575
bwQ3gj4UKEA,1300.9,12:04 a m,false,12:04am,alright hey everyone so it is currently||a 12:04 a m so I've been wearing this||foundation since what I say 457 so,46256
mzH0dRIrd1Y,675.1,12:04 a m,false,12:04am,what is that||that's a coyote 12:04 a m you missed it||by four minutes tie the one which I,33930
d9pWn8M-OqQ,265.7,12:04 a m,false,12:04am,Street they proceeded to follow her as||she went up Congress Street by 12:04 a m they are near a subway station one||of the men is seen on Massachusetts Bay,27772
YAzKefUd05M,99.3,12:04 a m,false,12:04am,and time automatic date and time I'm||going to manually set it to 12:04 a m which is the current Chinese time||so now we'll go back here and we,21564
tjUNNkJSlSM,61.3,12:04 a m,false,12:04am,happens on the 14th of December||12:04 a m in London which means it's||actually December 13th in the Americas,19153
x_7unPMjQTE,111.9,12:04 a m,false,12:04am,so||12:04 a m on December 3rd it is coming||out pretty much like 24 hours from now,19012
fo_kdsxYUr0,338.7,12:04 a m,false,12:04am,was able to receive it last night||at 12:04 a m you can also force it to||get a signal by pushing and holding and,20956
1shhJ05qjo0,314.4,12:04 a m,false,12:04am,to see when it synced and it's the||21st and it's synced at 12:04 a m right||after midnight you can also manually,18383
hf3-wLfE3cw,52.8,12:04 a m,false,12:04am,all doing something called sleeping||unlike me which it's a 12:04 a m right||now and I just I'm just like I am wide,17051
QMnSYkCUBHA,472.9,12:04 a m,false,12:04am,again this is the statement that he||posted today at 12:04 a m like who post||the statement at midnight really anyways,16550
cgaBmXX-pgg,2055.9,12:04 a m,false,12:04am,to the Cooper Point journal on 5:15 17||at 12:04 a m you might not have access||to that email or had the opportunity to,15941
ExMzW3EWgb4,63.6,12 04 a m,false,12:04am,after the shooting which was reported at||12 04 a m police said a suspect||identified coke espirita fled the scene,15428
q69TlVuE5ak,268.2,12:04 a m,false,12:04am,message get that means that this watch||was able to receive a signal at 12:04 a m this morning and if I push the||reverse button you can see that we have,15491