id,timestamp,token,manual,time,lines,views
NJ05yykJ_hE,24.3,5 59pm,false,5:59pm,indeed you know||it is a tuesday it's 5 59pm right||now as i bring my screen up so i'm going,56163
etCp8Xng9uM,415,5 59pm,false,5:59pm,enthusiasts to raise a pint for the||brews founder arthur guinness at 5 59pm on that day within the next few years||arthur's day turned into a much,37189
taNIUqGmJ1I,1006.9,5 59pm,false,5:59pm,i would literally hang up in the middle||of a call at 5 59pm anyway the contract was ending and i||knew they didn't have support to keep,16067
HEXkcSqrJgg,477.3,5 59pm,false,5:59pm,have i think it's most speechy||take care of it from 7am to 5 59pm um||or no i think you actually just leave it,44454
Oa2WLv2SZ1E,435.8,5:59 PM,true,5:59pm,"is more likely to happen between||6:00 AM and 5:59 PM ,||with most of them happening",236076
etCp8Xng9uM,414.2,5 59 PM,true,5:59pm,"asking Guinness enthusiasts to||raise a pint for the brew's founder Arthur Guinness, at 5 59 PM on that day||Within the next few years, Arthur's Day turned into a much",37189
ZqRCjmog36A,321.5,5:59 pm,true,5:59pm,"from the jump trade marketplace||before 14th October 5:59 pm||And you stand a chance to win a brand-new iPhone 14,",12171
SFB9tjs4yE4,132.2,5 59 pm,false,5:59pm,swanson ohio and so it was on the 2nd of||april 2008 at 5 59 pm one minute to go||lads i already had the jacket on that,1173247
qWR-pHFDEmA,147.4,5 59 PM,false,5:59pm,from your Xbox||the deadline is 5 59 PM Pacific time on||May 27th see if you can enshrine,1931594
j4wQAiPUwg8,290.8,5 59 pm,false,5:59pm,the grubhub was delivered my food was||delivered at 5 59 pm they were 12||minutes earlier than the earliest time,317271
CzlPooOnO8o,458,5 59 PM,false,5:59pm,his face||at roughly 5 59 PM just over an hour||after the shooting of Lakeisha mcglathan,368948
G4Cu0NoZH1A,457,5 59 PM,false,5:59pm,thumbnail the real F1 2022 awards that||was a 5 59 PM then at 6 PM I'm rendering||the loser tube version Oh this is,359724
jV7Q61Kw0AQ,159.6,5 59 pm,false,5:59pm,kira he also states that they were told||to broadcast the second tape at 5 59 pm and that they had not watched the tapes||themselves the broadcast begins and is,328690
3tLhz6zacVY,513.8,5 59 pm,false,5:59pm,interview at 6 00 pm if you would have||asked me at 5 59 pm on that day i would have told you||about conor energy oh they're going,182953
JSA2Y13S85M,2907.8,5 59 pm,false,5:59pm,shiny||yo look at the time it's 5 59 pm no joke||he has to catch it like now,147278
lJaJyLHLCvM,583.6,5 59 PM,false,5:59pm,go the other way up from Charlie Sykes||though I think tonight at 5 59 PM is||probably Donald Trump's first tweet back,268278
H54V3_leYsQ,180.4,5 59 pm,false,5:59pm,relax with her so-called friends||at 5 59 pm shankwella was pronounced dead from||cardiopulmonary arrest,125386
O_5xoP1zvek,56.6,5 59 PM,false,5:59pm,the paradise Discord Quest runs until||October 2nd at 5 59 PM so that's not||very long today is the 28th so you have,122785
wVL6QcJsa0Q,208.6,5 59 pm,false,5:59pm,company to the new house||a few minutes later at 5 4 p m and 5 59 pm he called two friends to tell them he||had purchased the house,125190
O46-cztg9cs,119.9,5 59 pm,false,5:59pm,major problem could kill the run right||at the start you only have to 5 59 pm on||the first day to reach Romani as she,1331210
-mQ60wNgKrQ,317.8,5 59 pm,false,5:59pm,the sounds of fireworks starts being||heard at approximately 5 59 pm it shows that many windows and doors are||shut,712150
8VL_ujCoJuQ,944.2,5 59 pm,false,5:59pm,employee joshua williams at 5 58 p m and||5 59 pm discussing a car photos were||sent from the car lot at the same time,101000
x4Avds-3tDg,289.2,5 59 PM,false,5:59pm,go the other way up from Charlie Sykes||though I think tonight at 5 59 PM is||probably Donald Trump's first tweet back,89314
tYZZVgcfhzM,564.4,5 59 pm,false,5:59pm,possible to get the tm for||an annie star city between 11 a m and 5 59 pm at the pokemon center from a hex maniac||now until you get flamethrower you'll,83571
-Ij57Adb3FI,1657.9,5 59 PM,false,5:59pm,giving the couple a wide window of time||anywhere from 4 30 pm to 5 59 PM that||the boys could have gone missing of,54715
YraztLAs_j0,31.5,5 59 pm,false,5:59pm,a m||sunset at 5 59 pm length of day will be||11 hours 10 minutes 50 seconds,55854
PN8C3QABaQM,68.3,5 59 pm,false,5:59pm,25 between noon and 2 59 p m||and the third between 3 p m and 5 59 pm a total of 71 murders occurred between 6||pm,52896
yeOygNLpSgs,170.7,5 59 pm,false,5:59pm,tape today at exactly||5 59 pm and we do intend to comply with||his demands,60788
yeOygNLpSgs,191.8,5 59 pm,false,5:59pm,18th at exactly||5 59 pm as i requested then the time now||is 5 59,60788
2I4adTaKfcM,243.5,5 59 pm,false,5:59pm,good old powder and Romani will only||teach you this song up until 5 59 pm on||the first day if we miss this we've,307719
glDLzb8H1e4,512.4,5 59 pm,false,5:59pm,will station direct on june 22nd||at 5 59 pm that's||eastern daylight savings time and this,43618
zg1SVYgA61w,85.6,5 59 pm,false,5:59pm,must be a u s resident at least 18 to||win enter by 5 59 pm on sunday september||4th so you just have a few days to get,41398
n2dW3W-O8-k,202.9,5 59 pm,false,5:59pm,my casa at my time he sent this message||at 5 59 pm and you guys might say well||how did that happen sensitive then you,50325
J6tUjNMEO5s,163,5 59 pm,false,5:59pm,so it is 17 55||military time it's 5 59 pm we've been here for a few hours they||did a cervix check and it,58615
IHFJL2-bPsU,132.6,5 59 pm,false,5:59pm,until june 26th at 11 59 pm cest to||enter it's gonna be 5 59 pm eastern 2 59||pm pacific one thing to note if you do,34877
a5vr9ypkYZw,277.2,5 59 pm,false,5:59pm,i got in i'm happy it is||wednesday december 16th 5 59 pm colorado college decisions come out in||like 30 seconds,63767
-kUhL55hftU,1785.8,5 59 pm,false,5:59pm,exact square to jupiter||at 5 59 pm that's nearly 6 p m||and then the moon squares jupiter,29654
t2gi3zIVuHY,1070.7,5:59 p m,true,5:59pm,being only from 5 p m||to 5:59 p m||in game time,4632819
x4Avds-3tDg,298.8,5:59 P M,true,5:59pm,"FROM CHARLIE SYKES, TONIGHT AT||5:59 P M||IS PROBABLY DONALD",89314
diTsLCRPpgE,213.8,5:59 p m,true,5:59pm,seen personally during previous rush||hours before Covid-19 Exhibit A I filmed this at 5:59 p m on January 28th on a||particularly crowded Tuesday and Exhibit B I filmed this at,45672
QI2pVgrm9AA,581.9,5:59 p m,false,5:59pm,I just went back through everything and||it always happens like at 5:59 p m I||even like didn't speed anything up so at,2828517
hLsMiD3do68,657.2,5:59 p m,false,5:59pm,involved on this and they send me this||email at 5:59 p m which what's really||frustrating like tomorrow,560759
G1cxDghbnrU,513.8,5:59 p m,false,5:59pm,lava and then on the 19th of January||2017 at 5:59 p m Baron still||sign I get a message from another one,472834
4KJyvt5YJds,73.9,5 59 p m,false,5:59pm,to||5 59 p m and before we go forward with||this something important to remember is,329898
Oa2WLv2SZ1E,434,5 59 p m,false,5:59pm,shows an active shooting is more likely||to happen between 6 a m and 5 59 p m with most of them happening in the||middle of the day the agency also,236076
cvNNecOZqeQ,1449,5 59 p m,false,5:59pm,as i can that's simply it||and it is currently 5 59 p m it's time for me to read||do the hard work especially when you,259334
uo1Do8BEYt0,103.4,5 59 p m,false,5:59pm,server and europe central we're at 5 58||5 59 p m as i'm recording this and as||you can see waiting for server uh this,212722
KDu-erqD7l4,44.5,5 59 p m,false,5:59pm,game in game times of 5 p m||to 5 59 p m so here's what we're gonna do at||the very least ah ok not,192294
n3jQfdwk8PU,1350.8,5 59 p m,false,5:59pm,see this||5 59 p m right now remember yeah i'm||still kept on,165425
9p7MtzB7q7A,81.9,5 59 p m,false,5:59pm,to||5 59 p m 5 59 in the afternoon||that is the third window first time you,143859
54WMzKtbgao,852.2,5:59 p m,false,5:59pm,going away though and with that||5:59 p m no new rains nearby okay all||sarcasm aside these weird new raid,133867
JSA2Y13S85M,2941,5 59 p m,false,5:59pm,seriously guys i'm kind of lost forwards||5 59 p m and lucas got a shiny axio look||what i got,147278
z59y8EIzzRA,162.6,5 59 p m,false,5:59pm,they they have donovan mitchell as of||right now wednesday august 3rd at 5 59 p m yes i'll take donna mitchell my last||pick will be coming from the minnesota,112907
512Ek1H5hrw,849.5,5:59 p m,false,5:59pm,free Lotus ephemera this drop ends at||5:59 p m Eastern Standard Time so I||want to stress something for you they,118250
xwgpgivXup0,36.2,5:59 p m,false,5:59pm,'clock on the dot hits and we||will react to it alright guys it is 5:59 p m let's freaking get this I'm super||excited so we're just gonna wait,85564
1zY_kB8dNlE,33.3,5 59 p m,false,5:59pm,test I'll be I'll see you in just a||second it is 5 59 p m and uh she just||handed us a video if she thinks she can,283303
mdw8ZxjIa-4,31.3,5 59 p m,false,5:59pm,versus me and winter days in winter be||like 5 59 p m night 6 p m the two types||of people in the winter winter,109597
vgrhvhJ1QvY,90.2,5 59 p m,false,5:59pm,server and europe central we're at 5 58||5 59 p m as i'm recording this and as||you can see waiting for server uh this,73814
RSDWZOxPjvM,702.1,5:59 p m,false,5:59pm,Halloween costumes from whatever was||left in the costume shop at 5:59 p m on||October 31st but that's what makes this,65250
YNstT04HOqM,1597.9,5:59 p m,false,5:59pm,at||5:59 p m Eastern Daylight Time or 450||million p m,96693
n3wHCCCpy3g,201.4,5 59 p m,false,5:59pm,circle what this timing here confirms is||that if I'm 5 to 5 59 p m you get dusk||like in rock then of course from 5 to 5,54392
lPwQksvbJVg,1718.9,5 59 p m,false,5:59pm,september 30th||at 5 59 p m according to this||this metal object here wrapped around,53759
diTsLCRPpgE,217.6,5:59 p m,false,5:59pm,hours before kovat 19 Exhibit A I filmed||this at 5:59 p m on January 28th on a||particularly crowded Tuesday and Exhibit,45672
vMuqi1s1Cag,926.6,5 59 p m,false,5:59pm,vice president biden received more than||100 percent of the votes at 5 59 p m eastern standard time on november 4th||2020,41403
qkF3VP2Zq0Q,1300.1,5 59 p m,false,5:59pm,think i'm gonna close out the video now||it's now 5 59 p m so 6 p m in the||evening and i just wanted to,46394
MyinIVMTsCM,456.6,5 59 p m,false,5:59pm,little boy who always came to pick him||up at 5 59 p m one minute before after cur||ends and she would ignore him completely,39541
k0YPPB5YgIE,1421.9,5:59 p m,false,5:59pm,Eastern Standard Time at||5:59 p m Eastern Standard Time a severe||small line capable of producing brief,41873