id,timestamp,token,manual,time,lines,views,category
iVy88LqILkw,912.7,9:06 AM,true,9:06am,"While sound checking for his weekly radio||address on August 11 at 9:06 AM , President Reagan||was recorded, saying--",1022953,24
0CgJlmCmM0I,57.6,9:06 AM,true,9:06am,"said the helicopter departed John Wayne Airport||in Orange County at 9:06 AM on Sunday||During his playing career,",231255,24
fEUER0UhZ5g,197,9:06 AM,true,9:06am,"- Yes||- I think it will be 9:06 AM , which was only six minutes,||'Cause going 80 miles per hour and there will be,",266412,23
Y-Q8bdVcM3w,67.3,9:06 AM,true,9:06am,"BRYANT TOOK FLIGHT AT BRYANT||TOOK FLIGHT AT 9:06 AM WITH 13-||YEAR-OLD DAUGHTER, GIANNA, AND",84528,25
IcNJNfO8mjU,1035,9:06 am,true,9:06am,"alleged that Flight 175 crashed into the south tower of the World Trade Center||At 9:06 am Chief of Staff, Andrew Card informs the President:||At the same time, in other parts",23694,22
qIxx6R9iSjg,745.8,9:06 am,false,9:06am,here||9:06 am and there's a coffee shop right there||now this is incredibly risky I never,1792945,22
ZSGjJJSrQYE,16.3,9 06 am,false,9:06am,california||at 9 06 am the pilot had been making a||climbing left turn,1680543,27
9cNLvWlCe7k,368.5,9 06 am,false,9:06am,house because the smoke was too intense||at 9 06 am Lorraine fireman were||dispatched to Dyer's house Lieutenant,69580,24
V_VMam8_JdA,336,9 06 am,false,9:06am,i'm i'm almost that it's friday morning||at 9 06 am and i'm almost at peak enjoyment of||saturday's lunch how does that make,50246,20
PfWeRdASWD0,710.7,9:06 A m,true,9:06am,Death -||At 9:06 A m||Pacific Standard Time On January,67295,17
PfWeRdASWD0,710.7,9:06 A m,true,9:06am,Death -||At 9:06 A m||Pacific Standard Time On January,67295,17
1ofaAod-WoQ,92.7,9:06 a m,false,9:06am,departs Orange County four thousand oaks||at 9:06 a m heading to his daughter's||basketball game at 9:20 the aircraft,10945622,25
fFKdfQB6zaI,73.8,9:06 a m,false,9:06am,mass and that's our||first mass of the day 9:06 a m Kobe||Bryant's helicopter left Orange County,6067698,25
fkZLMTVREIk,82.7,9:06 a m,false,9:06am,sikorsky chopper Bryant took flight at||9:06 a m with his 13 year old daughter||Gianna and her friends they were headed,1899069,25
KnyzcS6_zFo,0.5,9:06 a m,false,9:06am,how's it going it is 9:06 a m and today||we are going to see worlds which is||gonna be less rides and,1528931,22
cJzghahB_o8,220.4,9 06 a m,false,9:06am,that's that's why||but what time is it it's 9 06 a m is 906||and i think my mom and i are going to go,1456778,26
iizFSgJk9G4,41.3,9:06 a m,false,9:06am,took off from John Wayne Airport in||Orange County at 9:06 a m Sunday and||followed the northbound lanes of,1364077,25
4nbOePhb1Gs,330.1,9:06 a m,false,9:06am,times hi honey||you're there 9:06 a m today is blanks||birthday you're there honey,1122443,24
iVy88LqILkw,912.2,9 06 a m,false,9:06am,while sound checking for his weekly||radio address on august 11th at 9 06 a m president reagan was recorded saying my||fellow americans,1022953,24
inO8G_-oKLA,185.4,9:06 a m,false,9:06am,hills of Calabasas California the||helicopter took off at 9:06 a m from||the Orange County Airport inside NBA,898440,25
VJoMsrLiuCo,888.5,9:06 a m,false,9:06am,thought was a dumb American affectation||at 9:06 a m the chief science officer||pressed the ignition key there was a,740580,27
MQxWdlnmziA,153.7,9:06 a m,false,9:06am,when Kobe left on the||after it officially departed at 9:06 a m and the crash happened shortly||before 10:00 a m,680279,20
eoXd1oaZSFI,708.8,9 06 a m,false,9:06am,this is done 49 more games||all right it's currently day 3 9 06 a m to me is actually not awake yet I think||I slept at like 1 36,1013316,27
moSX6Yo46lY,1.9,9:06 a m,false,9:06am,hi i'm melissa and welcome to my channel||it is currently 9:06 a m and i'm about||to go to the combine to eat first,484643,22
X2OnRtOfEBU,3.8,9:06 a m,false,9:06am,good morning gamers it's Saturday April||11th it's currently 9:06 a m and this||is gonna be a very special episode of,369886,20
MPrGL9Xt-ds,698,9:06 a m,false,9:06am,heard their mother speak||at 9:06 a m the malt ball disappears in a flash of||pure energy as her entire cargo,295631,24
0CgJlmCmM0I,57.1,9:06 a m,false,9:06am,helicopter departed John Wayne Airport||in Orange County at 9:06 a m on Sunday||during his playing career Kobe regularly,231255,24
SZ-Ejf--cLo,102.2,9:06 a m,false,9:06am,Big Thunder ranch||at 9:06 a m there they're already at||capacity so I have to join a boarding,200446,24
Lty0gR6ytGM,86,9:06 a m,false,9:06am,order okay guys so we just got here it||is 9:06 a m and I am headed in let's||see what we can find today I'm,169434,22
4Af-UPqI00M,836.4,9:06 a m,false,9:06am,death or destiny awaited him at exactly||9:06 a m Korolev punched the ignition||key there was no warning just the sudden,183003,27
hsQFc4bg6z4,26.7,9:06 a m,false,9:06am,subscribe down low||it is 9:06 a m on Tuesday morning and||yes usually I start my college weekend,159414,26
ry7bl4FRg_M,291.3,9:06 a m,false,9:06am,for coming to my TED talk midday update||its 9:06 a m I was just in school now||I'm not yeah so basically if you're,145436,26
J4ieQc_cDmI,871.4,9:06 a m,false,9:06am,he's getting that Shido complete come on||9:06 a m to like 9:00 a m||that's the,113879,20
48Tt3YTRtA4,188.3,9:06 a m,false,9:06am,know that Bryan's chopper departed||Orange County at 9:06 a m heading to||his daughter's basketball game at 9:20,112352,25
iwQZ2yhvNys,190.1,9 06 a m,false,9:06am,orange county california||at 9 06 a m the pilot had been making a||climbing left turn,103585,20
qbAMdAfZoKw,405,9:06 a m,false,9:06am,to school right now||and then her ETA is 9:06 a m it shows||recent speeds speed limits seventy,101402,22
t2NCSI6ExV8,0,9:06 a m,false,9:06am,"so its 9:06 a m||Tuesday August 28 and||we are at 20,000 319 subscribers hi guys",100887,24
Y-Q8bdVcM3w,53.5,9:06 a m,false,9:06am,the wreckage of Kobe Bryant's private||chopper Bryant took flight at 9:06 a m with 13 year-old daughter Gianna and her||friends they were headed to their,84528,25
2MufZ1L3Pu0,170.3,9:06 a m,false,9:06am,it was I'm just gonna ignore that anyway||I think it's like its 9:06 a m I think||I put it down again they're like see,78581,22
iiECdjgGAKs,63.7,9:06 a m,false,9:06am,before this video but guess what it's||only 9:06 a m so i'd say the day is off||to an excellent start so just a,76214,22
hsyZ9Hcm-UI,834,9:06 a m,false,9:06am,so 1706 UTC would||represent in Pacific time 9:06 a m so a||quick conversion here 1706 UTC you just,70825,2
BdiYJtIfc2Q,203.3,9:06 a m,false,9:06am,Haldol and cogent psychotropic drugs||more minutes pass it at 9:06 a m he||takes what amounts to his last,70752,22
1MjwZB6-wVQ,1957.1,9:06 a m,false,9:06am,and sends a text cellphone data shows||that she is at her home at 9:06 a m Quinton's mother's white Chevrolet||Suburban leaves his house and heads up,67068,22
GGYTAQxwHy8,438.6,9:06 a m,false,9:06am,161 passengers are trapped||9:06 a m as the blaze in the empty||attendance cab worsens toxic smoke fills,87376,22
K47Ka_jxasc,417.7,9:06 a m,false,9:06am,enable 16||at 9:06 a m and it died on||me real fast at 9:50 a m,58620,28
AyVAP-iFIJA,284.3,9:06 a m,false,9:06am,currently it is Oh God||what the heck was that 9:06 a m it is a||belief Thursday it's at the 20th or,64041,20