id,timestamp,token,manual,time,lines,views,category
8rXmskgv8nw,214.9,9:53pm,true,9:53pm,"the south side of the airport where the flight||crew reported for duty at 9:53pm local time||Winds here were also quite strong,",208477,27
TPf99jwbMg0,273.4,9:53pm,true,9:53pm,First of all thank you so much for being here||Like 9:53pm on a Tuesday||This shit makes me fucking happy,136842,22
lH77k9ZquXw,403.5,9 53pm,false,9:53pm,herbcause kidnapper always kidnapping||when it's night and she leave at 9 53pm oh i have an idea what is it we should||call her mom nice idea,177157,20
BDeJDtkS39s,734.4,9:53 PM,true,9:53pm,"internal infrastructure||9:53 PM July 4th – As the electrical system finishes the reboot cycle, the dynamic hydraulic||actuators supporting",1850628,27
K5z8ESv9hcI,804.1,9:53 PM,true,9:53pm,It’s currently||9:53 PM and I'm going to make||air fried brocolli,212719,24
wRfjdtiowbs,1467.9,9:53 PM,true,9:53pm,"FELIX: ""Let’s go home ”||9:53 PM Felix is driving home||Something seems to be agitating him",771695,20
TNyOEfQv56Y,46.1,9:53 PM,true,9:53pm,"TROOPERS||AT ABOUT 9:53 PM , RICKY SHIFFER||HERE IN A RURAL COUNTY OF",109211,25
hALFU5jFdLc,545.7,9:53 pm,true,9:53pm,so now ready to leave||9:53 pm Shaji anna at the steering||most experienced driver of Murahara,100399,19
wx73OvChYrs,134.3,9:53 PM,true,9:53pm,"this question has been recorded on 21st February i e||6 days before , at 9:53 PM ,||i am giving the Prashna chart on the screen for your reference,",88659,22
w5mbNQl-ZxM,980.5,9:53 pm,true,9:53pm,"over||The police observed a white van traveling eastbound at 9:43 pm, westbound at 9:53 pm ,||eastbound turning northbound on South Allen Street at 9:59 pm, and then eastbound at",36611,24
AWvsXxDtEkU,1795.5,9 53 pm,false,9:53pm,what is the time right now||current time is 9 53 pm alexa please see||you again,2093521,22
BDeJDtkS39s,734.8,9 53 pm,false,9:53pm,sections of internal infrastructure||9 53 pm july 4th||as the electrical system finishes the,1850628,27
v7WU4rHRR6Y,1734.5,9 53 pm,false,9:53pm,after travis's deadly request to the||crowd at 9 53 pm the houston fire||department would dispatch 12 more units,768276,24
wRfjdtiowbs,1465.3,9 53 PM,false,9:53pm,dizzy it's getting very late your||parents must be worried let's go home 9 53 PM Felix is driving home something||seems to be agitating him perhaps the,771695,20
MGxQAp02hug,360,9 53 pm,false,9:53pm,was determined that she had died between||9 32 and 9 53 pm the night before and||her watch had actually stopped at,475771,26
MGxQAp02hug,363.8,9 53 pm,false,9:53pm,the night before and||her watch had actually stopped at 9 53 pm which a watchmaker said could be||caused by a good,475771,26
wRfjdtiowbs,1465.3,9 53 PM,false,9:53pm,dizzy it's getting very late your||parents must be worried let's go home 9 53 PM Felix is driving home something||seems to be agitating him perhaps the,771695,20
nlw5BvZ81Ek,1088.1,9 53 pm,false,9:53pm,act three now it's 21 53||translating to 9 53 pm 16 minutes after||the party minigame,215361,20
8rXmskgv8nw,218.6,9 53 pm,false,9:53pm,where the flight crew reported for duty||at 9 53 pm local time||winds here were also quite strong,208477,27
O303XfW9kyg,21.9,9 53 pm,false,9:53pm,singapore to los angeles||and to taipei at 9 53 pm that night the||pilots completed their pre-flight,158029,28
r5LlJ8qubY8,1672.4,9 53 PM,false,9:53pm,very late your parents must be worried||let's go home 9 53 PM Felix is driving||home something seems to be agitating him,253301,20
qlgVqto40mo,427.9,9 53 pm,false,9:53pm,zero percent||by 9 53 pm that's about 10 hours of it||being,82142,28
TVF8DRs6kIs,205.4,9 53 pm,false,9:53pm,her this late into the night she||contacted the police at 9 53 pm the police search radius started small||and thorough and it included Sophia's,72996,24
Mdjbo5TejPo,682.6,9 53 pm,false,9:53pm,calls the police to report her daughter||missing at 9 53 pm law enforcement arrives just three||minutes later and immediately inquires,68336,27
7TMXoKsxOnQ,945,9 53 pm,false,9:53pm,the park||I got there exactly at 9 53 pm I waited in my car until I saw a pair of||headlights pull into the,59882,24
7CNQ6Y7LKs8,51.4,9 53 pm,false,9:53pm,here||the 9-1-1 call started pouring in at 9 53 pm hey uh I'm going to report a side shop||how many vehicles are,45521,25
sjtKbpc89Ws,317.8,9 53 PM,false,9:53pm,uh tots moments player prior to this||update which I guess happened at 9 53 PM late in the middle of the night uh this||last kind of Wednesday night into,40101,20
jpT9i1XMyzk,238.6,9 53 pm,false,9:53pm,sleet and snow on the final approach||at 9 53 pm the pilots began their||descent to fly this approach into zurich,210255,24
yqCKzNQmykk,789.8,9 53 pm,false,9:53pm,unquote managed||and in the break i think it was 9 53 pm i called peter mukherjee||and i said peter,33093,25
8ijfDeNy92E,37.1,9 53 PM,false,9:53pm,two brothers William an off-duty officer||Burns Forsyth at 9 53 PM Burns Forsyth||called 9-1-1 to report an overdose,25593,24
qcvmv24jB4M,491.5,9 53 PM,false,9:53pm,connections at a Tower located near the||scene of the shooting at 9 53 PM the||phone is associated with Murphy made a,29556,22
WJ3K86TeCnw,38.3,9 53 pm,false,9:53pm,a ton of cookies and 100||december 14 2013 at 9 53 pm hey thanks for accept my request||i like you be my girlfriend i'm 14,21438,23
5R1rNYW82Pw,638.2,9 53 pm,false,9:53pm,no as is shown she was ignoring him up||until the text at 9 53 pm and um and so is line 13||his response to being ignored line 1300,32789,25
_r58hNJhZac,733.2,9 53 pm,false,9:53pm,so it left me with no other option||that's same night at 9 53 pm sfc fantasy||they've released another tweet,20646,22
HfvMQcO_W1s,84.7,9:53 p m,true,9:53pm,"""We all know you don't ""||So then at 9:53 p m , he tweets, ""Dumb as a rock Toure||""doesn't have a clue about money or anything else,",238947,23
aClnKVe054I,427.9,9 53 p m,true,9:53pm,the affidavit it doesn't state in the affidavit where||alex's phone was from 9 53 p m until 10 44 p m almost a full||hour later unless he's just driving,177706,24
7CNQ6Y7LKs8,58,9:53 P M,true,9:53pm,>> Reporter: THE 911 CALLS||STARTED POURING IN AT 9:53 P M||>> 911?,45521,25
Cls97xqLPEo,279.2,9:53 p m,false,9:53pm,gone or reduced by lot that is what I'm||hoping he's Tuesday 9:53 p m doing some||calculus May 8 I'm currently wearing,1607434,26
Kvnerq75xz0,200,9:53 p m,false,9:53pm,message at 9:50 p m||so at 9:53 p m Opie replies huh so your offer is||already at zero,877419,23
KXGfJ_CIonA,175.9,9:53 p m,false,9:53pm,-three knots the captain leaves his||seat to get his co-pilot a soda at 9:53 p m Kansas City a RC TCC comes on and||asked the crew if they're flying,584568,28
zB_DcbDxxgY,212.3,9 53 p m,false,9:53pm,accurate to my time zone that would mean||that we started a bot around 9 53 p m the same night||therefore earning that five row bucks in,468248,20
IW_79xmSLjE,484,9 53 p m,false,9:53pm,know is they were moving at a very high||rate of speed these were at 9 53 p m once again from the same camera on||august 21st of 2022,317187,27
5g7JbkOI7jA,685.3,9 53 p m,false,9:53pm,depend of when the bus in||effect we're losing money hmm hmm 9 3 9 53 p m Chloe decided to throw a temper||tantrum she learned off and now I can't,319871,20
X73bs03m4yI,1043.8,9 53 p m,false,9:53pm,all thank you so much for being here||like 9 53 p m gary you gotta fire the||cameraman he puts the light behind you,351641,23
OywpYiBu0yA,729.3,9:53 p m,false,9:53pm,okay all the phones and pagers receive||the same text message last night at 9:53 p m I must have been sent by the||promoter we have him we get to DJ,284680,1
HfvMQcO_W1s,84.3,9:53 p m,false,9:53pm,we all know you know||so then at 9:53 p m II tweets dome is a||rock tour a doesn't have a clue about,238947,23
aClnKVe054I,427.9,9 53 p m,false,9:53pm,doesn't state in the affidavit where||alex's phone was from 9 53 p m until 10 44 p m almost a full||hour later,177706,24
_Jp7ZVs15wY,301.9,9 53 P M,false,9:53pm,all right ladies and gentlemen it is||January 17th 9 53 P M and I came to my uh not so local HEB||it's about a 10,219396,24
SWZ6vu3koFQ,567.3,9 53 p m,false,9:53pm,the top of the it's||9 53 p m who these kids think they are||where,171767,20
YxRzDCVj3Ro,36.3,9:53 p m,false,9:53pm,they stopped as she headed upstairs I||looked at the clock 9:53 p m my class||didn't start until 10 o'clock so I,172262,24
E8Wql8DhLXU,219.4,9 53 p m,false,9:53pm,uh so they won't copyright me||but anyways it's like 9 53 p m we're out here doing a quick lizard hunt||let's see that i'll,151864,27
Ji1B_c6J1iw,777.4,9 53 p m,false,9:53pm,we are the players tonight what time is||it man 9 53 p m when we're recording this||they're on man they're on i am warmed,115079,20
0xCNVgl9-vM,200.7,9 53 p m,false,9:53pm,me through twitter you can see the clock||9 53 p m he brings it up again at 9 58||right at 10 p m he gets,117071,20
87pstrE6ub8,747,9 53 p m,false,9:53pm,hey guys||anyway it's already 9 53 p m and||kahuilang namin from tobacco mister baja,94161,22
_nO7UGAj-lQ,1418.6,9 53 p m,false,9:53pm,bye||hi everyone it is currently 9 53 p m and in seven minutes||our collaboration launches and i'm,88495,22
87b7CdG-WCw,184.2,9 53 p m,false,9:53pm,don't feel sore according to my fitbit||um i slept from 9 53 p m to 9 58 a m||so just over 12 hours but over the,87528,20
QcASNmOrq8w,342.4,9 53 p m,false,9:53pm,fair enough that is a very fair reply||literally minutes later at 9 53 p m oh||my God still happening Caroline said,85049,25
FdSpNklTC5U,37.7,9 53 p m,false,9:53pm,that have happened thus far to this||point it is now 9 53 p m on the east||coast in new york city so let's go ahead,73966,17
OGf5wApm7-4,648.5,9 53 p m,false,9:53pm,more than just 600 calories in a day||9 53 p m i drank a decent amount of the||water,75780,24
FL7BBfTCHyM,85.9,9:53 p m,false,9:53pm,see more update info by Games reborn||last Friday at 9:53 p m this has also||been updated at the bottom by Reika what,56152,20
_72grDL9quU,888.2,9 53 p m,false,9:53pm,a minute||all right guys so it is currently 9 53 p m and right now i'm gonna have a little||smoothie so that way i can,50410,24
dlmRei6y380,238.9,9 53 p m,false,9:53pm,got a hero mj bro my||first snipe of the day and it's what 9 53 p m i just missed the evan mobley from what||i know from yesterday still snipes so,53276,20
y7ZIkt_lqbs,75.7,9 53 p m,false,9:53pm,like my sister is till||9 53 p m but it's okay because i get to||see them and it's gonna be,44680,22