id,timestamp,token,manual,time,lines,views
Z_H568ETBCk,1417.3,7:09am,true,7:09am,"Let’s see what we can piece together…||Dunedin, June 20th 1994, 7:09am||A call comes in on New Zealand’s emergency number, 111",1502711
LRztWiRieFg,550.5,7:09am,true,7:09am,"inside of the first group to be hanged, alongside her former friend Maria Mandel||At 7:09am the hangings began inside of the execution chamber, and Brandl was placed on||a simple",184283
-7hSvpi2cg8,842.7,7:09am,true,7:09am,"of the prison||At 7:09am the executions would begin inside the chamber, and Maria as she||was a woman was",82123
8XiBDZUPL8A,554.5,7:09 am,true,7:09am,"Maria Mandl herself was the first||of the group to be executed, and at 7:09 am the hangings began inside of the execution||chamber",659381
u1RFqP2aXSY,0.4,7:09 am,true,7:09am,"On June 20, 1994, at 7:09 am , 22-year-old David Bain called emergency services and told||the operator his entire family was dead||Officers rushed to Bain's home on Every Street",213892
12ByFLj8zRA,462.5,7:09 AM,true,7:09am,IS 7:09 AM MOST UP-TO-DATE INFORMATION||>>> IT IS,6879
12ByFLj8zRA,462.7,7:09 AM,true,7:09am,IT IS 7:09 AM ON||MOST UP-TO-DATE INFORMATION||>>> IT IS,6879
12ByFLj8zRA,462.9,7:09 AM,true,7:09am,IT IS 7:09 AM ON THIS||>>> IT IS,6879
12ByFLj8zRA,464,7:09 AM,true,7:09am,IT IS 7:09 AM ON THIS||>>> IT IS,6879
12ByFLj8zRA,464.2,7:09 AM,true,7:09am,IT IS 7:09 AM ON THIS SUNDAY||>>> IT IS,6879
12ByFLj8zRA,464.4,7:09 AM,true,7:09am,IT IS 7:09 AM ON THIS,6879
12ByFLj8zRA,464.6,7:09 AM,true,7:09am,IT IS 7:09 AM ON THIS,6879
QMgzJkTL-C4,130.2,7:09 AM,true,7:09am,"family||At 7:09 AM on the morning of June 20th, 1994, New Zealand police received a||111 call",10199
OgfJer0NJ4Q,466.8,7 09 am,false,7:09am,female||at 7 09 am the hangings would commence||inside of the execution chamber maria,434124
2IihDuov-6Q,22.8,7:09 am,false,7:09am,Hydrox and boom the lucky Pharaohs||7:09 am good-morning Stella good morning||they had their breakfast in the,4421
Y2pznKggBgE,40.6,7 09 am,false,7:09am,it is monday june 21st at||7 09 am so if i seem kind of spacey||you know it's still early in the,4817
kuw-EFFJ_-s,22.7,7:09 am,false,7:09am,really||7:09 am the auditions at 10:00||finally a toy,2563
Ely6tKXVHNU,1260.2,7:09 am,false,7:09am,just having a dream like that is high||emotion so at 7:09 am so I don't know||say what you want I like to believe that,2150
SwUjpKGuuws,233.9,7 09 am,false,7:09am,office and be back||home at 7 09 am extremely fast and||smooth,2011
u3KePtsGKdY,179.1,7:09 am,false,7:09am,go one minute one forces again||7:09 am i ranked in the state now 25th||no I can do better than that we,1715
hnz0gXQdejU,574.8,7:09 A M,true,7:09am,IT'S 7:09||BUILT IN||IT'S 7:09 A M IT'S,6075
hnz0gXQdejU,575.8,7:09 A M,true,7:09am,IT'S 7:09 A M IF||IF||IF WE,6075
m5pJUUqmgQk,18.3,7:09 A M,true,7:09am,BURNING||SUNRISE AT 7:09 A M ONCE THE SUN COMES UP WE||WILL SEE THE MAGNITUDE,1302
m5pJUUqmgQk,139.1,7:09 A M,true,7:09am,THE SUN WILL COME UP AT||7:09 A M THE WIND WILL CONTINUE||TO BE STRONG,1302
4hsDNpl5F_4,200.6,7 09 a m,false,7:09am,night shift baby||yo what's up 7 09 a m we were supposed||to go to sleep last night we didn't go,1884659
QqW_z-E1Zx8,74.2,7:09 a m,false,7:09am,minty actually Hawthorne does not only||sell Cologne in fact I wake up at 7:09 a m every single morning I roll out of||bed stumble into the bathroom I hop into,450825
4hLltYQCNqk,92.7,7:09 a m,false,7:09am,four hours earlier and passed Bellevue||at 7:09 a m running 35 minutes late||both trains required the use of a single,388764
8DvmAUFb8mM,83.5,7:09 a m,false,7:09am,this is lieutenant Clayton walking past||the cosmetic line at 7:09 a m 3 minutes||later you see Loyd walk by - by now,468175
890eNfBc3K8,64.4,7:09 a m,false,7:09am,Lee who is a 45 year old man||they were seen at 7:09 a m on Monday||March 5th so just a little over a week,198883
xzqnwAh0o9c,17.5,7:09 a m,false,7:09am,but we're here bright and early it is||bucket at 7:09 a m look at that cloud||Macy that's my girlfriend she's asleep,147540
qslL-A1ArCY,3.4,7:09 a m,false,7:09am,good morning woods at 7:09 a m right||now||Whaley just left to go to her eyebrow,136035
PCRX3cHO-bA,39.9,7:09 a m,false,7:09am,so he was out on his balcony not behind||a glass he was outside at 7:09 a m he||said there was a light appearing from,111142
PUVtS077rQk,120.8,7 09 a m,false,7:09am,his alarm go off||and it's now 7 09 a m and that won't be a problem except he||has to be at wonka sports,103944
XoF8A93EqU8,725.8,7 09 a m,false,7:09am,before i start fixing my makeup and my||hair it's 7 09 a m our flight is at 11 something and my mom||said we're leaving the house,99827
rOKhnjTPSEA,59,7 09 a m,false,7:09am,come out with a report and they pretty||much said today september 1st 2021 at 7 09 a m lancaster police was dispatched||to the 1800 block of oak bluff drive for,45521
SRhAC2nhfJs,1848.8,7:09 a m,false,7:09am,we do||and at 7:09 a m this morning that those||protocols went into place very smoothly,34683
YVI83dUB4Ro,25.1,7 09 a m,false,7:09am,stop according to orono police chief||corey farniok on friday may 20th at 7 09 a m orono police officers received a||call about a person driving on a rim,34430
0XFqNlzRgxI,266.7,7:09 a m,false,7:09am,of course this was absolutely terrifying||so at 7:09 a m David immediately called||one one one which is New Zealand's,23427
7JDH5TcCBHM,395.8,7:09 a m,false,7:09am,Donald J Trump and this tweet went out||January 2nd 2018 at 7:09 a m the people of Iran are finally||acting against the brutal and corrupt,13072
iez39r1JYSg,1070.7,7 09 a m,false,7:09am,errors i don't know how to fix it and||then that was at 7 09 a m and then i||sent it again,17521
Rh79xgbGGYA,89.5,7:09 a m,false,7:09am,my teeth and went back to sleep I woke||again at 7:09 a m I fed my dog I walked||back into the bathroom my reflection,10801
Y-dubXhJg10,139.8,7 09 a m,false,7:09am,plus plus plus||cooling now was about 7 09 a m now i||think it's close to about what 25,10483
E-CP81VrVl0,49.1,7 09 a m,false,7:09am,what's inside there||it is 7 09 a m and we're putting||together a fire pit how does that how,23267
E5lmYG1jxXI,626.7,7:09 a m,false,7:09am,and was||into Boston at 7:09 a m now the great||thing about flight aware and some of you,6562
r85BiXcDYK8,237.9,7:09 a m,false,7:09am,pistol twice one bullet hit Chamberlain||in the lung killing him at 7:09 a m just about two hours after medical alert||dispatcher calls to see if the former,6006
Vl2cFtSbYjg,40.9,7 09 a m,false,7:09am,all right we are in the month of june it||is currently 7 09 a m early park||admission begins at,7680
4S4Yfd_FZUs,795.9,7:09 a m,false,7:09am,cool wait what happened with the time||it's this cleaning time but at 7:09 a m that's kind of buggy but yeah||actually the cleaning stuff looks nice,4281
Sby7evatey4,11.3,7:09 a m,false,7:09am,morning stocking shelves when the||earthquake hit at 7:09 a m Fox 13's||Elle Thomas has her story,3736
DlIxHwf8m9Y,518.5,7:09 a m,false,7:09am,for Boston our breaking Boston news at||7:09 a m on the 16th at 11:50 4 a m||we,3973