id,timestamp,token,manual,time,lines,views,category
OOPzWJVHr3Y,1521.9,10:00AM,true,10:00am,right refresh it||10:00AM||on the 25 of august,6288494,24
Ck7yqX_ZIMk,81.9,10:00am,true,10:00am,"me the first thing that I thought was strange||I was to come at exactly 10:00am every day, and be gone by 10:10am||And I was to never, under any",1976664,24
_0NFUYz6g0c,325.8,10:00am,true,10:00am,"for a nap time and Flynn takes a nap around 9:30am||or 10:00am and we take the nap together||Again, do not come for me",1756601,23
DJrMCpT9BmA,297.7,10:00AM,true,10:00am,"stone, had her begin construction on a barn in my yard, went to bed at 10:00AM||like a productive member of society, chopped down a few living wooden poles to raise",1189986,20
ekwVnus6g10,624.2,10:00am,true,10:00am,"drop of any day in the war||Operation Varsity began on March 24 at at 10:00am||A fleet of British and American aircraft roared over the Rhine carrying 16,000 British",1134994,27
hKyArsq6NJ8,846,10:00am,true,10:00am,"Death Comes to Porton||It was 10:00am on May 6, 1953 when Ronald Maddison stepped into the Porton Down gas||chamber",841535,27
ekwVnus6g10,624.2,10:00am,true,10:00am,"drop of any day in the war||Operation Varsity began on March 24 at at 10:00am||A fleet of British and American aircraft roared over the Rhine carrying 16,000 British",1134994,27
nUAj2nz8MPg,2407.7,10:00AM,true,10:00am,INTO THIS JUPITER FLORIDA||FACILITY AT 10:00AM AND HAVE||YET TO EMERGE MAJOR LEAGUE,664182,25
04MZa2YNowM,404.1,10:00am,true,10:00am,wreckage of the SS Noronic||By 10:00am the rescue effort had become a recovery operation||Firefighters carried one body after another out,668253,27
X5rPs_VIKJ0,403.6,10:00am,true,10:00am,blocking another exit||By 10:00am the fire was under control||For two hours firefighters searched the ruins of the building,620623,27
mq4rm9kQSOE,1883.1,10:00AM,true,10:00am,TUESDAYS AND THURSDAYS FROM 9||10:00AM BUT SOME LOCATIONS||MAY VARY,499682,25
1WTCQ8_NsbQ,40.3,10:00AM,true,10:00am,THE 700 BLOCK OF NORTH||SPRINGFIELD AROUND 10:00AM||ACCORDING TO POLICE,481809,25
XISwz73yX3k,551.8,10:00am,true,10:00am,"efforts were put into action,||and the fires in the ship were under control by 10:00am||Still, the carrier was dead in the water",627274,27
HwW0wfx5HxQ,126.3,10:00AM,true,10:00am,BOTH THAT HAPPENED AROUND||10:00AM ABOUT 40 MINUTES||BEFORE THAT THERE WAS A,412193,25
-S4CwK5Z5Xg,798.7,10:00AM,true,10:00am,IN EFFECT UNTIL TOMORROW||MORNING AT 10:00AM WHEN||OFFICIALS WILL ASSESS THE,408976,25
HNd1_irOL5k,116.6,10:00am,true,10:00am,"And we did two stand-ups every day:||ours at 10:00am , theirs at 10:15||Ever-observant, it took me a couple of weeks to notice",436446,26
pgp73l1MGaI,371.7,10:00am,true,10:00am,"If the interview is at 10:30am,||I wanna be reminded of these notes at 10:00am I'm gonna hit save||So now I've got my reminder here",585169,27
DH95mcI73-M,435.7,10:00am,true,10:00am,"Time for Extractions||At 10:00am , the first convoy of survivors||arrived at the airport and boarded a C130",378409,27
vLVmBAmUj30,472.8,10:00am,true,10:00am,"the ship was advertising her presence||The fog began to lift by 10:00am ,||and the sun shone over a smooth sea",358994,27
Cd4jQi_gZrw,162.9,10:00AM,true,10:00am,Ohh||You Idiot it's already 10:00AM Get up||You said there is an Interview today,323303,24
iz2MxeUS3RQ,269.4,10:00am,true,10:00am,"command post was||set up in a lodge close to the disaster site, and by 10:00am a team of geophysicists arrived||from Sydney",337763,27
_6NTCsms-wM,561,10:00am,true,10:00am,why is mcdonalds closed?||Rhs:What happened?Is this closed? Guard: It will at 10:00am its 8:19am now||mostly the branches on GT road do not open before,313775,22
_6NTCsms-wM,569.6,10:00am,true,10:00am,"undefined 10:00am||Its getting hot with time,ive parked my bike here and stopped for some breakfast",313775,22
_6NTCsms-wM,826.2,10:00am,true,10:00am,its 10:27am||and we were thinking that we'll reach isb soo far before 10:00am but everything happens for a reason||and there's no further plan when we reach,313775,22
Z8rlPpPSiSc,152.2,10:00AM,true,10:00am,VALLEY NCH RAREC CENTER FROM||10:00AM TO 01:00PM ON||SATURDAY,302753,25
NLvzXXTapxA,905.4,10:00AM,true,10:00am,I'm really gonna independently ask if that be taken out||- It is not yet 10:00AM||group laughing,375044,20
zGoV_7Td9LA,127.4,10:00AM,true,10:00am,">> Thursday morning, that's||tomorrow at 10:00AM neighbors||here say they hope something is",286131,25
_I3aTSUWqHE,295.6,10:00am,true,10:00am,sent asking for a tugboat to be sent out to assist||It was now around 10:00am Lifejackets were issued to passengers as the ferry began drifting from its position||When sleet,323700,27
E92fgEEv0Pc,189.2,10:00AM,true,10:00am,and commute on June 24th at||10:00AM and that's available||All right Mister tew could,279691,25
bqYVjArO9yg,53.9,10:00AM,true,10:00am,WALLA WALLA WASHINGTON HE SAYS||THEY LEFT AT 10:00AM IN ORDER||TO MAKE THE LONG DRIVE,278336,25
hFZFjoX2cGg,653.5,10:00 AM,true,10:00am,"And I should mention,||the squirrels were most active from 6:00 to 10:00 AM ,||so every morning I've been getting up before the sunrise",112958312,28
zR8nLQH68_g,2522.9,10:00 am,true,10:00am,there you will get to see daiky Vlogs||Morning at 10:00 am daily vlogs are there||& guys definitely subscribe to the channel,34610925,24
NoQtz4UCRKM,2125.2,10:00 AM,true,10:00am,"to my vlogs channel, you can watch daily vlogs there||I upload vlogs daily at 10:00 AM rest like this video comment and if you are new subscribe||don't go anywhere",23813725,24
ycrqXJYf1SU,866.2,10:00 AM,true,10:00am,"think it was the next day 23rd, I remember, I woke up quite late like 10:00 AM||and suddenly, my dad just told me, oh, we can't go out now||We",12663650,25
P8WQu9mnodA,602.4,10:00 AM,true,10:00am,"- Okay||- 10:00 AM , Bronte beach,||just south of Bondi,",10453693,24
3Sh06VUiXaA,2285.8,10:00 am,true,10:00am,"Kennedy's beloved Atlantic ocean||At 10:00 am , the casket drilled with holes||and weighted with sandbags was pushed into the ocean",9044922,27
D6V85qfsu3g,139.4,10:00 am,true,10:00am,of people waiting for hours||to get into the store right when it opens at 10:00 am -||Tyler,7659550,22
uQtw2_7oXV0,1115.2,10:00 AM,true,10:00am,"7, the morning of the fire,||at around, almost 10:00 AM So they have to go verify||and make sure that this is indeed Nanette",7254754,24
cUw31Kvjtl4,1298.7,10:00 AM,true,10:00am,"and they are assumed that Vince ate them||So then at 10:00 AM , Greyhound representatives||took other passengers to Walmart, I think it is,",6341012,27
mgIr5vC_-h8,335.2,10:00 AM,true,10:00am,going to finish the lighting||I'm aiming at getting our first shot off at 10:00 AM - I have my Fitbit on with my heartrate monitor||I'm going to keep track,6246513,22
mCNecSWZbs0,1007.3,10:00 AM,true,10:00am,"she's hesitant to go outside, it's very strange||At 10:00 AM , a friend was riding the bus||when this friend looks out the window",5898876,24
YriEqOT2rL8,50.6,10:00 AM,true,10:00am,on Rachit Rojha vlog channel||They come everyday at 10:00 AM So guys even you can see Rachit Rojha vlog channel||Every morning,6898732,24
cvtOFHbENf0,464.4,10:00 AM,true,10:00am,And you have free wifi there||Also from 6:00 AM to 10:00 AM every morning||there's a free continental breakfast,6249432,23
cvtOFHbENf0,475.5,10:00 AM,true,10:00am,AM to 10:00 AM||- So it's continental then||- Mhmm,6249432,23
26VzqQd-bZg,1110.8,10:00 am,true,10:00am,This is also a job||Does he have to get drunk at 10:00 am ?||- I don't think he has to,4359392,23
pW4Xl-OCn-o,347.3,10:00 AM,true,10:00am,four more minutes||The class will start at 10:00 AM sharp||Hi,4309572,22
LVRZdANny3M,1054.5,10:00 AM,true,10:00am,"Now, let’s mark the calendars||Everything launches on June 24th at 10:00 AM Pacific Standard Time||Of course, my offices and warehouses are located in California",3394232,26
sE6PK_V1Xnk,191.5,10:00 AM,true,10:00am,"are sitting here||If you raise your hand, everyone will do the same||It's 10:00 AM in the morning, I hope for today's weather to be good for us otherwise",3790692,19
sE6PK_V1Xnk,197.7,10:00 AM,true,10:00am,'t know how it is let's try||I went out from the house at 10:00 AM and now it's been half an hour but no clue of taxi||I hope,3790692,19
sE6PK_V1Xnk,243.2,10:00 AM,true,10:00am,It's 10:50 AM||When I came out at 10:00 AM it was not hot but as the time is passing it is becoming hot||People,3790692,19
4ObnmUnbSBk,1762.8,10:00 am,true,10:00am,"So go to her||And also, I have taken an appointment with a doctor at 10:00 am ,||So take her with you",3317716,24
j_Of36XVHng,79.5,10:00 AM,true,10:00am,hours of direct sun throughout the day during the peak||hours of the day too - 10:00 AM to about sunset or so||So these are really the classics,3178459,26
P1X2aD5JOh0,1624.8,10:00 am,true,10:00am,he does for his mother||tomorrow everyone should be in the meeting room at sharp 10:00 am hmm,3034562,24
5x0aUnW8ZhI,1388.8,10:00 AM,true,10:00am,any wildfires||For example the US forest service infamous 10:00 AM policy||said that any fires that occurred,2773118,23
5x0aUnW8ZhI,1393.4,10:00 AM,true,10:00am,said that any fires that occurred||must be put out by 10:00 AM the next day||This limit on fires did little,2773118,23
ua_z3mAaNfQ,294.2,10:00 AM,true,10:00am,"And the most expensive flights of the day||are the ones between 8:00 and 10:00 AM ,||and 5:00 and 7:00 PM pertaining primarily",2599016,28
UkNdqnAVDKE,36.1,10:00 AM,true,10:00am,"We're here in Chinatown||It's 10:00 AM and before we go into Bonnie's,||I gotta buy some fruit for the restaurant",2705253,24
Enecc9WRh5Q,64,10:00 am,true,10:00am,"the day before Andrew's birthday,||the boys' paternal grandmother picked up BJ around 10:00 am and took him out to run some errands||That left Beverly home alone with Andrew",2200865,25
Enecc9WRh5Q,161.9,10:00 am,true,10:00am,"What the police gathered is that there was a knock at the door sometime between 10:00 am and 12:30 pm||Beverly looked through the peephole, but it didn't look like",2200865,25
mX8L8LLoGrY,24.1,10:00 am,true,10:00am,"Good morning||It's almost 9:30- 10:00 am||Since the lockdown started, I've been sleeping late like everyday",2103991,22
dF5tyFBhgKQ,1077.3,10:00 am,true,10:00am,laughing||And it ends by 10:00 am - Dad come see this||-,1999812,24
01ssHr-OE8M,202.1,10:00 am,true,10:00am,"middle of November||Almost all businesses, including the stock market, open an hour late at 10:00 am to allow||the roads to be un-congested in the time leading up to the",1992648,27
gtogRk9FEm4,482.7,10:00 AM,true,10:00am,"fourteen hours earlier||It's September 30th, Pineville, Missouri, 10:00 AM The Sheriff's Office gets a call about a double homicide||- It came in that",3488633,22
TDZlMRVwxEY,1422.3,10:00 AM,true,10:00am,"Narrator||At 10:00 AM , on February 18th, 1944,||a day before the executions are scheduled to begin,",2101424,27
Auih_REFfPM,0.1,10:00 AM,true,10:00am,- It's not even 10:00 AM and I'm already gonna get||your spit on my body||-,1872990,24
Auih_REFfPM,36.8,10:00 AM,true,10:00am,for the longest time||- It's not even 10:00 AM and I'm already gonna get||your spit on my body,1872990,24
I7vNrxGPLr4,1086,10:00 AM,true,10:00am,"Can you guess who they went looking for?||At 10:00 AM on September 25th, 2012,||Etienne St-Pierre was working in his New Brunswick office",1847806,27
2sP_jLR4W3A,328.3,10:00 AM,true,10:00am,"that he appear for a deposition,||10:00 AM sharp||Meadows has also invoked",1829790,22
I77LO9uBBS4,289.2,10:00 AM,true,10:00am,and put it into microwave is just so fresh||Around 10:00 AM it's time for me to train myself||I train about 20 hours a week,1708570,24
j0FlXQblNGQ,647.2,10:00 AM,true,10:00am,"So this is with sleep tracking, cellular on||right when I left the house at 10:00 AM this morning||Yeah, we've been using it heavy usage, maps, directions",1632162,26
R-XDCZhOnIo,1543.1,10:00 AM,true,10:00am,"For example the US Forest Service||infamous 10:00 AM policy,||so that any fires that occurred",1621489,23
R-XDCZhOnIo,1547.7,10:00 AM,true,10:00am,so that any fires that occurred||must be put out by 10:00 AM the next day||This limit on fires did little,1621489,23
6BU_ELSsDLc,423.1,10:00 AM,true,10:00am,"Grady, works and lives in Hawaii, and he's||requested that we meet at 10:00 AM on Friday||Now he's thinking about his local time zone, so",1742966,28
6BU_ELSsDLc,466.5,10:00 AM,true,10:00am,"I can see the Hawaii time zones alongside Seattle,||and it looks like 10:00 AM is 1:00 PM in Seattle,||so I could click here and then I could",1742966,28
6BU_ELSsDLc,477,10:00 AM,true,10:00am,"invitation and remember, Grady,||who's in Hawaii, he said he wants to meet at 10:00 AM||Right over here, I can check this box for",1742966,28
6BU_ELSsDLc,761.4,10:00 AM,true,10:00am,"set it to the Hawaiian||time zone, so there's 10:00 AM , and then on my||calendar, it’ll show up as 1:00 PM Pacific tike",1742966,28
6BU_ELSsDLc,761.4,10:00 AM,true,10:00am,"that||Maybe, let's say I start at 10:00 AM||and I should probably be out",1742966,28
NO-8wSqfS4s,0,10:00 AM,true,10:00am,- It's 10:00 AM Try to butcher a lot of||the product in house before||a lot of the,1725695,26
gLXT76m_880,297.2,10:00 AM,true,10:00am,"- Mm hmm, we can talk whenever you'd like||Just preferably not before 10:00 AM||I'm not really a morning person",1668649,24
epn0X9EHpdA,106.9,10:00 am,false,10:00am,meal I'm kind||of worried because it's already 10:00 am I gonna have to eat seven meals it'll be||a long day I guess,10950068,22
DhpHqbfmC3U,83.6,10 00 am,false,10:00am,i'm just like ranting to the camera see||you guys later it's 10 00 am we just finished watching church||i did my makeup and we have to,1028227,24
ewkarKrkozY,217,10:00 am,false,10:00am,what happens when you die come and find||out come and find out Sunday's 10:00 am made of June let's find out together||pull it cartoon flush flush your label,512686,23
scHcD24AK3o,254.1,10:00 am,false,10:00am,I'm gonna get into my workout routine I||do have classes at 10:00 am so I have to||like hurry the hell up and finish,458873,24
Pf7JlkfvtuY,46.6,10 00 am,false,10:00am,know if you're interested in||that kind of thing i think it's like 10 00 am i tried to get up and start||filming this video at like 7 45,336081,22
eNuYDzRFUXg,877.9,10 00 am,false,10:00am,Kiko pangilinan||is set to vote at 10 00 am now so we're on standby also when he's||going to vote at in,251199,24
8m6fxmfWGGk,385.8,10 00 am,false,10:00am,conversation with mark probably around||10 00 am 10 15 am where i remember tony||mentioning knives guns in the form of,232315,25
ySbbFQA7_O0,286,10:00 am,false,10:00am,detention detention detention everybody||attention 10:00 am I even actually doing||anything am i giving people detention,182616,20
DUeZYWt2_Kc,57.7,10 00 am,false,10:00am,'s snow everywhere and the sun is||just rising in the horizon it's about 10 00 am and b is back at the hotel||just booking in,177821,22
M9boKdC8JrM,1952.2,10 00 am,false,10:00am,there for about three or four hours||start the job at 10 00 am sunday do the job until 5 pm then||without stopping leave there at 5 pm,159762,2
Ba94doAfRA8,750.6,10:00 am,false,10:00am,the perfect time cuz like when you go to||bed around 9:00 or 10:00 am I go to bed early I don't know me||that's too early but,154537,22
ZY_BFCD_OOI,600.7,10 00 am,false,10:00am,wake up at 10 p m||that's right we are going to sleep at 10 00 am and wake up at 10 pm yeah||that that that's the situation,153681,19
JvtanADX494,1063,10 00 am,false,10:00am,live in and you're out in the sun 20||minutes naked from 10 00 am to 2 pm||every day you might not need vitamin d,192762,24
VBziCCjjb8o,35.3,10 00 am,false,10:00am,probably around||10 00 am 10 15 am||where i remember,93220,25
oKs46DCBS9o,159.4,10 00 am,false,10:00am,conversation with mark probably around||10 00 am 10 15 am||where i remember,87890,25
4mwMLE9Ox9A,465.2,10 00 am,false,10:00am,fishing early||10 00 am well the thing is i have to get||rods ready for two people,87127,22
C8FhG3lhotQ,371.2,10 00 am,false,10:00am,with mark probably around||10 00 am 10 15 am||where i remember,79940,25
DuHBOOE_fmQ,678.2,10:00 am,false,10:00am,depending on where you are so that often||meant once you have to do at 10:00 am I||to do I like to a m,62241,20
ExpDKyo6fUI,34.1,10 00 am,false,10:00am,a m i believe the convention doors open||at 10 00 am so||15 minutes until doors open and in a,58627,24
l9dsRO4hosI,840.6,10 00 am,false,10:00am,o'clock||10 in the morning 10 00 am all right||what do you guys do to me,128201,22
Le0JndHgktU,680.7,10:00 am,false,10:00am,in the woods in the morning and we||got home I got a meeting at 10:00 am I||going home for so long as we get out of,38557,24
qpTOhicSrQ0,120.8,10:00 A M,true,10:00am,">> James: KENDALL AND HAILEY'S||FULL EPISODE WILL BE AVAILABLE FOR FREE TOMORROW AT 10:00 A M||EASTERN, 7:00 A M",15567388,24
TXGXoA81Omk,280.2,10:00 a m,true,10:00am,I want her to wake me up||I'm like waking me up at 10:00 a m Tomorrow||SIRI: Your,13911028,24
TXGXoA81Omk,288.5,10:00 a m,true,10:00am,Tomorrow||SIRI: Your 10:00 a m||alarm is on,13911028,24
wDdpv1zWqJ8,428.7,10:00 a m,true,10:00am,Do not||Knocking wake us up before 10:00 a m Unless there is a real emergency||To answer questions you can have cereal for breakfast,11385955,24
Kt5dIsgp9wM,594.3,10:00 a m,true,10:00am,"gonna do a bigger and better okay, so it is the next morning||It is 10:00 a m Right now I've literally waited almost a full day for these big big water",11189850,23
4HZv5HzFfGk,450.6,10:00 a m,true,10:00am,"yes this collection will be launching on||October 21st yes, it will be launching at 10:00 a m Pacific Standard Time our normal time which is 1:00 p m||Eastern Standard Time",8383745,26
c2XuqcuT4MI,217.6,10:00 a m,true,10:00am,deadline and staying up late one night||The court hearing was the next day at 10:00 a m and I remember contemplating whether to just stay awake for a few more hours until,7941396,23
S_Zx3LlzFEA,651.2,10:00 a m,true,10:00am,to God do we need it we need it I agree they come in||at 10:00 a m so just make sure you're out possible and that's gonna solve your||problem,7627736,24
5Z7Tr8kDw-8,84.2,10:00 a m,true,10:00am,"pulling looks out of the ether like Bugs Bunny||All before 10:00 a m , Ferris' assorted looks range from PJs to pool attire, from luau gear||to hip jazz",6040130,24
GMB99JiSZyc,1547.1,10:00 a m,true,10:00am,is when the entire||collection is launching I am so excited of course as always 10:00 a m Pacific||Standard Time that is 1:00 p m,5496459,26
AbKVeP_BZVg,127.5,10:00 a m,true,10:00am,"where I'm watching me playing a video game||She's still going, it's 10:00 a m She hasn't eaten breakfast||It's closing in on three hours",5300363,20
22KRauvZtYw,773.3,10:00 a m,true,10:00am,"saying not so fast||Good morning||So, we now know that that homeowner has until 10:00 a m To take that fence down and if you can stop and take a look at",5113738,24
VhGTtWsW9F8,137.6,10:00 A M,true,10:00am,OF WINE||IT'S 10:00 A M||BUT IT'S FINE,5202826,23
FvU3VEdLrbI,90.3,10:00 a m,true,10:00am,"When?||Friday, 10:00 a m You sure I can't see you before that?||I don't know what I",4303980,1
trGndG0OA5s,20.5,10:00 a m,true,10:00am,see I'm just like you guys I||thought my amiibos at Best Buy at 10:00 a m soon as they open so today||the brand new amiibos for Legend of Zelda breath,4682927,20
5jKMt_OGGe8,1106.5,10:00 a m,true,10:00am,"Despite making several frantic calls,||the bank manager only arrived at 10:00 a m||on the Sunday morning",4186012,27
tNMZ16h2NXM,179,10:00 a m,true,10:00am,"All right, y'all ready to get drunk||on a 10:00 a m||on a Monday?",3765536,23
tNMZ16h2NXM,235.6,10:00 a m,true,10:00am,I'm just in shock||It's still 10:00 a m||laughing,3765536,23
en5_JrcSTcU,323.1,10:00 A M,true,10:00am,THERE'S A NORWEGIAN CRUISE LINE LEAVING FOR MARTINIQUE||AROUND 10:00 A M||HERE'S MY PLAN,3856540,24
iN-xZ8naFU8,231.4,10:00 a m,true,10:00am,baby would be leaving the nursery||She was in Shanara's hospital room periodically from 10:00 a m to 3:00 p m||on July 10th,3595321,24
R6reyiSpKuw,237.9,10:00 a m,true,10:00am,or a financial services hearing||A committee hearing that starts at 10:00 a m can last till 1:00 p m||with a break,3521882,24
4L1N-FDrGLk,583.9,10:00 A M,true,10:00am,"ANOTHER EXCURSION WAS PLANNED||FOR THE NEXT MORNING AT 10:00 A M||ON THAT SAME DAY, THE HARVEY PARTY ALSO HEADED TO THE",4403293,19
i6L9qGqd_pY,33.8,10:00 a m,true,10:00am,sweet green today||Not right now though because it's 10:00 a m And I do not want to go to sweet green at,3332246,24
i6L9qGqd_pY,33.8,10:00 a m,true,10:00am,And I do not want to go to sweet green at 10:00 a m Start out today's vlog||We're going to,3332246,24
5jNinGY3iHg,1101.2,10:00 a m,true,10:00am,"It works||It works for a Friday morning at 10:00 a m||- Well, it's not a Friday morning look",3319659,22
rvluUK3GojI,43.8,10:00 A M,true,10:00am,">> Jimmy: OH, GREAT||>> 8:00 TO 10:00 A M||CHEERS AND APPLAUSE",3196741,24
oGoKZyeN3-o,777.8,10:00 a m,true,10:00am,"and DJs scheduled perform for fans in the bar room starting at 1:00- or 10:00 a m ""||""TanaCon had sold approximately 4,000 tickets at the time of the event ""||The- skip",2999612,22
GocVgH8AyAU,1093.9,10:00 a m,false,10:00am,Grayson's gift is getting here tomorrow||at 10:00 a m and we're filming in the||late afternoon so that will be okay I,37202823,23
Nk4g5J55aPM,523.6,10:00 a m,false,10:00am,all right guys here we are in Tucson||Arizona we just got here it's 10:00 a m we're gonna meet these lucky people in||the park do you have a theme,25788541,24
XrObnrEHxQE,405.3,10:00 a m,false,10:00am,these rules for everyone if you're not||out by 10:00 a m filming then like you||get fined,25477166,22
jfhEbHJoZZ8,46.7,10:00 a m,false,10:00am,what do you usually wake up anyway||around 9:00 or 10:00 a m do you dream||sometimes what's three words best,19656209,24
oxZZ8i3VuTU,50.8,10:00 a m,false,10:00am,oh no hi too emotional for that nonsense||it's like 10:00 a m ladies and||gentlemen all like let's go to set,18719251,22
SiQ4t2EuhKU,225.5,10:00 a m,false,10:00am,exchange to take place the next day||between 8:00 and 10:00 a m the highly||scrutinized note starts with quote mr,19677902,22
afMQp5zoX1I,42.6,10:00 a m,false,10:00am,there's no customers like right now he||thinks it's 10:00 a m all this sunlight||and I still can't seem to tap Jurgen,17855147,23
pSoaHF0s1Rs,833.3,10:00 a m,false,10:00am,with Kat right now our photo shoot was||at 10:00 a m she didn't even show up||until - she's very difficult to work,15325291,27
qOYx4EkgkuY,1040.1,10:00 a m,false,10:00am,5:00 a m||and 10:00 a m that's what I'm||assuming so we got a few hours I guess,15228663,22
ZnTiZAuTeA8,104.4,10:00 a m,false,10:00am,have way more ace family members tickets||go on sale on June 1st at 10:00 a m link will be down in the description||guys make sure to check out the length,14023274,22
ZnTiZAuTeA8,129,10:00 a m,false,10:00am,it is it is ACN was just way too||strong guys June 1st at 10:00 a m this||Saturday at,14023274,22
YXb0-gie9yk,392.8,10:00 a m,false,10:00am,mmm normally this last me until like||10:00 a m but this has gotta last me||the whole day today this angle out you,14197390,26
5y-P9rrjxxs,837.8,10:00 a m,false,10:00am,it's actually it's gonna be take forever||no the job starts at 10:00 a m so now when I wakes up I have to wait||for like three hours in,12909667,20
TXGXoA81Omk,285.9,10:00 a m,false,10:00am,I want||her to wake me up I'm like waking me up||at 10:00 a m tomorrow your,13911028,24
TXGXoA81Omk,285.9,10:00 a m,false,10:00am,tomorrow your 10:00 a m alarmism that's the only reason now||let's turn that off cuz you,13911028,24
CRcr60pYLWE,91.3,10:00 a m,false,10:00am,seriously than I thought she was||okay guys it's 10:00 a m right now and||every morning at 10 a m,11646032,24
iAztoLal-Dw,404.2,10:00 a m,false,10:00am,here Keith well Preston then||what am I gonna do about my 10:00 a m if you wait you up at,11358923,24
OLSjK2jE4pA,1066.5,10:00 a m,false,10:00am,one Dee's for breakfast but they don't||open till 10:00 a m so it's pretty more||like a brunch well we got well we got,11425306,23
ceYbAEfRsgA,778.4,10:00 a m,false,10:00am,on this channel you can yeah||10:00 a m be here first 90 people that||sign up on the day yeah go up the,11292524,17
epn0X9EHpdA,103.2,10:00 a m,false,10:00am,it's Saturday morning and I woke up at||10:00 a m sorry you missed my 7 a m||meal I'm kind,10950068,22
oO1PtvyHd_0,56.8,10:00 a m,false,10:00am,there's a silver Honda Fit that pulls up||every morning at 10:00 a m do you see any where I don't see it||anywhere those are oh wait,9857839,24
txWaMpSzHhM,2424,10:00 a m,false,10:00am,avoid pre-market trading okay so||on a good day I have my goal by 10:00 a m and I'm easing out lightening up||trading and by four o'clock I'm,10444905,27
txWaMpSzHhM,2453.8,10:00 a m,false,10:00am,"bit about the market okay if you make||1,000 by 10:00 a m what do you think||you're gonna do are you gonna walk away",10444905,27
txWaMpSzHhM,2464.4,10:00 a m,false,10:00am,so a lot of people if they make their||thousand dollars by 10:00 a m they're||done for the day they're gonna go,10444905,27
txWaMpSzHhM,2473.6,10:00 a m,false,10:00am,they want but if you lost a thousand||dollars by 10:00 a m most traders are||gonna keep fighting it out okay they're,10444905,27
UuuVzJDMyPk,107.4,10:00 a m,false,10:00am,it is now||10:00 a m Bobby has no idea what's happening so||it's gonna be an adventure and,8983087,23
NIO8HNCXXoA,264.6,10:00 a m,false,10:00am,yes hi grayson dolan will be here||tomorrow for a 10:00 a m Zumba class||all right even 10 a m,8567740,23
4HZv5HzFfGk,452.6,10:00 a m,false,10:00am,will be launching on October 21st yes it||will be launching at 10:00 a m Pacific||Standard Time our normal time which is,8383745,26
9WNuILI-WeM,129.9,10:00 a m,false,10:00am,overnight so it's just the hotel best||anyway I opened up at 10:00 a m and||this lady comes down on my second,8345600,24
