id,timestamp,token,manual,time,lines,views,category
Hwy0EPyPVuY,1976.5,10:00 a m,false,10:00am,get changed yeah I thought gonna be here||by 10:00 a m yesterday yeah||she said no God just like that get,8137873,24
c2XuqcuT4MI,222,10:00 a m,false,10:00am,up late one night the court hearing was||the next day at 10:00 a m and I||remember contemplating whether to just,7941396,23
xBVU0ItE3QM,508.3,10:00 a m,false,10:00am,curse me and my family's name I know||it's for 10:00 a m right now I haven't||gone to sleep yet god bless america,7707578,24
-QmJKxAYvAM,28.7,10:00 a m,false,10:00am,we're meeting at 10:00 p m||not 10:00 a m well it's uh it's at 6:51||a m,7587621,24
0S1QPBnp8BM,1060.2,10:00 a m,false,10:00am,all right we're leaving the Apple Store||it is now 10:00 a m I have been here||for us all worked out and Lamar got his,7531235,28
rtC1hVA7pXE,386.5,10:00 a m,false,10:00am,National Police or a and P swept behind||clearing the fields you must leave 10:00 a m P to look after the bridge British||was supposed to be acting in a,9257200,27
9EcO-nOu8QE,763.3,10:00 a m,false,10:00am,sandwich||sweetie it's 10:00 a m let's see see||did you even seal the dogs in the park,7955798,20
fxrmRTVh3JI,241.7,10:00 a m,false,10:00am,good morning oh good morning||it's 10:00 a m whether it's partly||cloudy 54 degrees idioms and humidity,8336498,20
g51vDAMlqzc,98,10:00 a m,false,10:00am,thing I do in the morning then we have a||10:00 a m you're the dentist||and there's a woman's at 12:00 and then,6842517,20
_tlIjqhUNWI,40.2,10:00 a m,false,10:00am,dropping their new collection on April||27th at 10:00 a m Eastern Time so make||sure you guys put that in your calendar,6822121,24
VA6v_wXVaAM,303.3,10:00 a m,false,10:00am,and now I'm heading to be out you know||rehab is at 10:00 a m my Teague rehab my knee I had a little||procedure done on my knee after,6854132,24
T6rTvB8nly4,95.2,10:00 a m,false,10:00am,alright so look at the time||right now look guys it's 3:00 Oh 10:00 a m right now and that means it is the||time to FaceTime George guys alright,6795746,23
jPUHLJuanyI,57.5,10:00 a m,false,10:00am,feel I feel I feel and Abu Sonya Ricco||studio season 3 watch it on abs-cbn||Saturdays at 10:00 a m undefined,6633839,10