id,timestamp,token,manual,time,lines,views,category
Pa-vDOcHDvo,265.8,2:04 pm,true,2:04pm,would be revealed to Amy in the saddest of ways||School got out at 2:04 pm that day and||Amy left her bike in the school’s rack,466097,24
Au9Nw9ntHmE,1014,2 04 pm,true,2:04pm,asking why he's not picking up before trying to||call him again at 2 04 pm this time though she||manages to get through she asks david if he can,221048,24
mh6ibTHsxyE,206.4,2:04 PM,true,2:04pm,TWO DEPUTIES ENTERED IT 204 --||2:04 PM WHEN THEY ENTERED THEY FOUND A||SIX-YEAR-OLD CHILD BEING,111542,25
eWKO-15ytSQ,309.4,2:04 PM,true,2:04pm,"which we will come back for these boxes later||At 2:04 PM , Flight 592 takes off from Miami’s Runway 09L||The aircraft began a normal climb",28374,2
eWKO-15ytSQ,309.4,2:04 PM,true,2:04pm,"which we will come back for these boxes later||At 2:04 PM , Flight 592 takes off from Miami’s Runway 09L||The aircraft began a normal climb",28374,2
dwE2n4mgUaU,641,2:04 PM,true,2:04pm,"that in general trend is on the upside||So it's 2:04 PM||And this candle is now moving above 1920,",24192,27
Au9Nw9ntHmE,1016.8,2 04 pm,false,2:04pm,he's not picking up before trying to||call him again at 2 04 pm this time though she manages to get||through she asks david if he can drop,221048,24
SsAPIT0sNic,238.1,2:04 p m,true,2:04pm,Right||now at the time I'm shooting this that's 2:04 p m on Sunday before the end NHL season||Cap,90280,17
U3utgKUzqDg,57.3,2:04 p m,false,2:04pm,upsie time and he's currently but a bit||of 2:04 p m thighs that we are here we||have I'm just like I'm so excited,1886330,22
xR5X_8LeUlE,147.6,2:04 p m,false,2:04pm,what time is it it is||2:04 p m and I haven't eaten anything I||mean to be fair I woke up at,722441,24
Snkrjgydy8Y,2651.1,2:04 p m,false,2:04pm,is now in recess another recess you||gotta be joking me February 25 2:04 p m district court defendant lobby number||two,524649,20
_jGnltPpmD8,299.5,2:04 p m,false,2:04pm,today||it's like 2:04 p m use a lot of my runs||in the morning so you'll feel that heat,265661,17
mvEk8-zNFhE,510.5,2:04 p m,false,2:04pm,alright my friends||2:04 p m so we are currently 65 hours||fasted it's pretty crazy so I did go,110221,24
AFfuOSwovJE,864.8,2:04 p m,false,2:04pm,her messages all morning she finally||responds at 2:04 p m hey there so||you're a really good guy but I'm just,106010,24
asqcorPrM8I,437.2,2:04 p m,false,2:04pm,flooded roadways||em for southeastern Lake County at 2:04 p m a severe thunderstorm was located||over windshield or over lakes of the,120129,28
3hOnV8X3IfU,55,2:04 p m,false,2:04pm,the process I just become really picky||it is 2:04 p m and I have done nothing||today but sit in front of the computer,81581,22
gpYQryM3SWw,178.7,2:04 p m,false,2:04pm,hard||it is now 2:04 p m all I've done today||was eat lunch and watch wreck-it Ralph -,69317,24
QxbRGMzAT1s,811.4,2:04 p m,false,2:04pm,now||2:04 p m on Friday the second or||February 12th so I'm going I'm going to,37662,2
BGQHf_n2L8g,133.1,2:04 p m,false,2:04pm,what we got to do it is||only it's two o'clock it's 2:04 p m and||it feels like it's literally 9 p m,33854,22
QWC0Gy5xqJk,201.8,2:04 p m,false,2:04pm,are in FL Studio as you know probably||see right now yeah 2:04 p m you||probably don't care about that but yeah,27682,26
kn4tqyxzJ3I,11.5,2:04 p m,false,2:04pm,currently 204 p m||Eastern time 2:04 p m I'm starting to realise there's no||such things as off days for me,25874,24
qwXpdVEYQTg,21.4,2:04 p m,false,2:04pm,spruced up hello everyone this is tom||milk it's 2:04 p m this happy Wednesday||April 8th 2020 now then I'm sure you can,34338,20
iHSBandz7Os,273.8,2:04 p m,false,2:04pm,game plan and that's Casey's game plan||2:04 p m for the past twenty dears||salmon oli have sat on the fence and,17502,24
zyqgw-tQQfU,1004.6,2:04 p m,false,2:04pm,was a great show Your Honour I loved it||February 25th 2:04 p m looking at Santa||heads Worth in district court defendant,17333,20
3icF5ZlAxIs,431.8,2:04 p m,false,2:04pm,they're finally loaded there is my house||at 2:04 p m just a little bit ago it's||really freaking cool if you go if you,15540,2
O904h9La5dM,590.4,2:04 p m,false,2:04pm,last test so I'm gonna record a starting||time which is well it's 2:04 p m right||now but I did turn the controller on at,14602,20
JI97yfOgcAI,25.7,2:04 p m,false,2:04pm,night so she is so mad said that||her sister just now got home at 2:04 p m and she's like we're heavy band||sissy you've left me here with,14129,20
DXGV7gVqsy0,482.5,2:04 p m,false,2:04pm,know||2:04 p m 390 20 cv that family of||steels is as much as its popular and it,16438,28
dA5YLipI9DU,628.1,2:04 p m,false,2:04pm,things for new people guys if you don't||know 2:04 p m 390 and 20 cv are amongst||the most prestigious EDC steels out,20812,26
FR2ngc-Zsxc,838.1,2:04 p m,false,2:04pm,have one voicemail message I select that||I can see that came in at 2:04 p m and||who they came from if I select ok,19739,28
Cd4x0xoZGiY,11.8,2:04 p m,false,2:04pm,today is July 30th 2013 and that would||be Tuesday at 2:04 p m Eastern Standard||Time and the reason why I'm doing this,11481,1
yGTm4UWosR4,345.4,2:04 p m,false,2:04pm,don't do it still intense yep March 23rd||2:04 p m district court court defending||item 3 right oh what's going on with my,10348,20