id,timestamp,token,manual,time,lines,views,category
cyNFhthQ97Q,1410.9,2 11 am,true,2:11am,floating in the same state became visible roughly||half a mile away at about 2 11 am however several||white light beacons could be seen off the,2501873,24
RxWQPEx74H0,21.7,2:11 am,true,2:11am,"At 2:11 am on December 1, 2027, your house in El Paso, Texas, will be approached by numerous",1013091,1
EDHvPorKaLQ,8.2,2:11 AM,true,2:11am,"So officers responded to a shooting||called at approximately 2:11 AM||When officers arrived,",10515,25
cyNFhthQ97Q,1413.8,2 11 am,false,2:11am,same state became visible roughly half a||mile away at about 2 11 am however several white light beacons||could be seen off the briggs port beam,2501873,24
w0o6kXThLUY,54.1,2 11 am,false,2:11am,time on a tuesday note that would have||been 2 11 am in australia certainly||raised a few eyebrows,891930,17
RxWQPEx74H0,21.5,2 11 am,false,2:11am,believe||at 2 11 am on december 1st 2027 your||house in el paso texas will be,1013091,1
9mIdWL8d8Bk,41.1,2 11 am,false,2:11am,nightmares||like literally at 2 11 am this morning||ahoy everyone this is a little late but,648319,20
BpR51VgdyzE,125.4,2 11 am,false,2:11am,him check out his handiwork||that's 2 11 am now||two minutes later,377998,25
F8gZWyXO0JY,125.4,2 11 am,false,2:11am,him check out his handiwork||that's 2 11 am now||two minutes later,257313,25
oHjy4xIN_Z0,433.4,2 11 am,false,2:11am,he lived a police report was finally||taken at 2 11 am carl and bunny stayed||up all night silently praying for their,240230,27
H-_WCmb4DpU,1310.9,2 11 am,false,2:11am,says||second Corinthians 2 11 am I ask you a question I want you to||answer this when we get done,188064,27
r1L5VD683YU,202.8,2 11 am,false,2:11am,room 247||it was 2 11 am late night for a housekeeper but i||needed the overtime,68051,24
q7gk4Yz46tg,23,2 11 am,false,2:11am,along for the ride||it is 2 11 am on monday november 23rd i||just finished the behind the scenes,60360,24
fFJ2HX72c_c,640,2:11 am,false,2:11am,to pull it a branch and stay off a||crotch rocket so it's like 2:11 am okay||we're trying to sleep right now but,37727,23
7eYJkN2LDVs,107,2 11 am,false,2:11am,trying to help the injured lady||the incident occurred at around 2 11 am on the 14th of august when officers||responded to the club member at,38836,24
b40zf36NopI,358.3,2 11 am,false,2:11am,A M to march to 11AM||snapshot will be taken on March 2 11 am to March 3 11 am||token exchange listing will be from,27419,20
21_Z8XeG7cU,11.3,2 11 am,false,2:11am,this morning at approximately||2 11 am an officer responded to a discharge of a||firearm,16284,25
0dxU8mOCTec,180,2 11 am,false,2:11am,of the skh candle film and||NCS probably August 2 11 am the||conference hall adcd coordinations,16535,25
_gpmO0CpjKo,1359,2 11 am,false,2:11am,you all for watching this video||it is 2 11 am i've been here for however||long 2 300 seconds is how long is 2,29998,20
_gpmO0CpjKo,1371.5,2 11 am,false,2:11am,minutes||38 minutes so yes i it's it's 2 11 am i||thought i was gonna be able to beat it,29998,20
2iksyLlQhjg,189.1,2 11 am,false,2:11am,finally hopefully it is charged now so||yeah it is 2 11 am don't ask why i stayed up so late||i'm so nervous i had,15619,26
8WTzD6EsWS0,2269.8,2 11 am,false,2:11am,probably had nightmares after this||honestly at this moment right now it's 2 11 am watching this movie was a mistake||and again this was creepy this was scary,21851,1
ZCqMq_LI_mE,164.8,2:11 A M,true,2:11am,TWINS' BRAINS VEIN BY VEIN||THEN 2:11 A M IT'S BEEN ABOUT 17 HOURS NOW||SINCE THEY STARTED OPERATING,200578,25
t89mL7HfqDw,27.6,2:11 A M,true,2:11am,"9:45 A M , THE FIRST CUT AND AT||2:11 A M||THE CONJOINED TWINS",187776,25
iyvJRlB7D_E,66.9,2:11 A M,true,2:11am,IN||BUT OUT OF WORK SINCE 2:11 A M||>> AS WE'RE ACTIVELY PRODUCING,38747,25
-u-HtbJu0Zk,42.8,2:11 A M,true,2:11am,"THE TRAGIC, FIERY, FATAL CRASH||HAPPENED AT APPROXIMATELY 2:11 A M||NEAR MILE MARKER 33 5",20026,25
yyFqVgW5zVc,564.2,2 11 A M,false,2:11am,I feel like I'm going a little bit||crazy at this point at about 2 11 A M Mr||Omega decides to go for a walk with his,625823,24
z_ntalbs5dw,185.6,2 11 a m,false,2:11am,and also there's this and him||and she leaps up onto the table day 2 11 a m leaps vaults if you will on to this||table catches her shoe in the dress,319146,22
sm1x7P80o4k,1418.4,2 11 a m,false,2:11am,inches long she was born on February 8||at 2 11 a m the entire process from the||moment when my water broke to the moment,214390,26
7yK3PHY2-uc,641,2 11 a m,false,2:11am,believe it what do you even say uh-huh||uh check time it's 2 11 a m the new||homeowners are supposed to get here at,216374,20
qXRhosit8mI,119.5,2 11 a m,false,2:11am,the time||8 a m to 12 p m 10 a m to 2 11 a m to 3||12 to four and then we get into the uh,156934,22
LKqYQz_EWx0,26.9,2 11 a m,false,2:11am,basketball team||2 11 a m in the morning east coast time||so yeah 11 11,86072,17
b9oLKg2kbAg,122.1,2 11 a m,false,2:11am,yeah||at 2 11 a m think twice before you post my things||may i beg you please,79142,22
YrU_IBze_zY,71.2,2:11 a m,false,2:11am,last local backup not cloud backup was||done at 2:11 a m and it has never been||uploaded to Google Drive because really,81855,28
O-_iJcGzrj0,14.3,2 11 A M,false,2:11am,shooting called at approximately uh||2 11 A M when officers arrived they||started ministering first aid to some,48770,25
iyvJRlB7D_E,62,2 11 a m,false,2:11am,in search dogs in but out of work||since 2 11 a m as we're actively||producing our search and rescue efforts,38747,25
RTtAaJtVrSI,555.3,2 11 a m,false,2:11am,it looks like when I first plug it in it||says it's 2 11 a m let's I didn't know||that there was a clock on here that's,49110,22
imFhhaOtriI,320.2,2 11 a m,false,2:11am,little bit further so that was at 1 13||a m so 2 11 a m they say again you need||to reply don't make us wait it will end,43217,20
fv_6MsX63gg,89.9,2 11 A M,false,2:11am,I have not already so it is 2||A M right now it's like 2 11 A M in the||morning uh I've been awake for almost 24,39348,20
8uROnQRQtlc,297.1,2 11 a m,false,2:11am,you'll catch him america's newsroom||weekdays 9 2 11 a m eastern time fox||news the best of the best bill hammer,28260,25
lhhur6CSCAI,2472.3,2 11 A M,false,2:11am,all right Pisces so we are ending this||reading at 2 11 A M we have 11 on the||clock,24387,22
FcEro4jXf30,683,2 11 a m,false,2:11am,you will never amount to me||2 11 a m and i am just||and tomorrow i'll show you guys empty,37725,22
IjeY1sWB-Nw,10.5,2 11 a m,false,2:11am,reading||it is 2 11 a m and it is||september 13th 2022,21266,22
rqk2nKDhfSI,623,2 11 A M,false,2:11am,from you from 8 am||2 11 A M that's a no call no show||that is a no-call no show what,50872,24
-u-HtbJu0Zk,35,2 11 a m,false,2:11am,sunday morning the tragic fiery fatal||crash happened at approximately 2 11 a m near mile marker 33 5||a spokesperson told us this is still a,20026,25
JnhHPJG34xE,88.7,2 11 a m,false,2:11am,mix and apply paint this time a wooden||canvas is used we then take the 2 11 a m empty marker that is filled up with||green acrylic one for all tone as you,20811,22
pNds7Z3EIag,704,2 11 A M,false,2:11am,primary target time over the target was||12 48 a m to 2 11 A M see the channels||Hiroshima Mission detailed for more,18924,28
Oq1re_18rhU,21.7,2 11 a m,false,2:11am,believe||at 2 11 a m on december 1st 2027 your||house in el paso texas will be,55463,20
7gTVxohDGEE,337,2 11 a m,false,2:11am,say logotala gaffa aka||talaga shot a man in the torso at 2 11 a m in front of a business in honolulu||on april 18th the victim was rushed to,18673,29
QniiGWZa2sQ,2081.9,2 11 A M,false,2:11am,bridge where the last official sighting||of Captain Smith took place it is now 2 11 A M on board the RMS Titanic the||Titanic's final plunge is about to begin,394313,22
vIoAmOeANU0,783.9,2:11 a m,false,2:11am,actually checks to make sure their||survival suits fit at 2:11 a m the sec||Maye noted quote green water on the bow,16218,24