id,timestamp,token,manual,time,lines,views,category
XTsQl76cXxk,67.5,5 54 am,true,5:54am,the garage door because it says||garage door so one child's already up at 5 54 am roman just woke up now both kids are up 607||6 000 7,144047,22
DWFmzm29ydI,2018.9,5 54 am,false,5:54am,bro look at my iPhone key it was like at||seven now it's at 5 54 am I washed up||it's these bastard ass runes to be,273865,20
SP4nMwtX2OI,308,5 54 am,false,5:54am,a couple hours later 1 44 am 19||raptors deep this one is rb20 and 5 54 am 25th raptor to roll out this morning||is rb 22 raptor boost 22,216981,28
GYh-PJkezlg,495.8,5 54 am,false,5:54am,determine if there's a fuel leak or not||at 5 54 am universal time the crew||turned on the right wing fuel pumps and,164154,22
boI3TNQbOGY,49.8,5 54 am,false,5:54am,unknown name you see the phone number||right there it was at 5 54 am obviously i missed a call then they left||the voicemail basically in the,131290,24
AYWywH_Q4CY,1783,5 54 am,false,5:54am,as i thought it was going to be||so it is now 5 54 am and the bow getty mural is just about||done,125182,2
cBZ0q7uTCQY,104,5 54 am,false,5:54am,anything||at 5 54 am the crew now faced with a||situation,159793,28
3Nlu8miWyfM,28.4,5 54 am,false,5:54am,that chum was left out||it's 5 54 am probably at 5 30 a m so||nice try bean nice try,66134,26
ElbmLE-jhtc,376.1,5 54 am,false,5:54am,think we'll go||5 54 am we're going super early morning||uh the first thing we're gonna do is,61658,20
hG8LspqombM,26.5,5 54 am,false,5:54am,to see my breakdown||5 54 am PS||thank you to the 13 followers who joined,41728,20
3wJmiS5eP6w,384.7,5 54 am,false,5:54am,was trying to be funny bruh||Sage she was at 5 54 am he literally||Woke Up This these were the thoughts,59251,17
J77Vr7k28oc,628.2,5 54 am,false,5:54am,care and peace out oh||my goodness it is 5 54 am and i got||another potato talisman for twinkle one,41019,20
h1DXcwXCQ9k,50.6,5 54 am,false,5:54am,out ourselves||5 54 am on friday a bit later||than usual,29778,20
m0Lp4ps6hhY,1862.8,5 54 am,false,5:54am,a 10-minute conversation||then at 5 54 am Chris left for work||kessinger at 11 09 am text Chris saying,30271,22
Ojvsv6-hTPY,33.4,5 54 am,false,5:54am,and I literally just washed my face and||it's 5 54 am right now I'm leaving from||my campus in Malibu this whole video is,23849,22
uxaogJq-0tI,25,5 54 am,false,5:54am,vlog i'm picking up amanda i'm not awake||yet my car says 5 54 am right now||and that's because it's on pacific,20370,26
hW03fbBHDNI,1175.8,5:54 a m,true,5:54am,"so it wasn't a big deal now||On January 6th, 1942, at 5:54 a m , John||Poindexter gave a signal to Capt",978855,27
4sri-aYukis,416.2,5 54 a m,false,5:54am,stopping her is uncertain||at 5 54 a m grass bay's lookouts spot||three british warships on the horizon,564906,27
0slrQlop4zc,49.9,5 54 A M,false,5:54am,character||5 54 A M thank you to the 13 followers who joined||she scheduled live,218056,20
GCvFuC0kSBo,700.2,5 54 a m,false,5:54am,and he made this graph or whatever||and he did this uh sometime around 5 54 a m this morning which caused another||small,159977,24
F1m3fRsIoVc,363.8,5 54 A M,false,5:54am,yeah a lot of boats come through here yo||check it out fam 5 54 A M we made it bro I thought we were gonna||probably end up getting a hotel,142990,22
7lxfkuX-y5s,492.2,5 54 a m,false,5:54am,you'd probably like it wouldn't you come||on oh hey 5 54 a m only six minutes oh||you guys,113720,20
98mKxRo3Wog,833.5,5 54 a m,false,5:54am,august 31st||it is a tuesday it is 5 54 a m i'm about||to go for a nice easy run yesterday i,102933,17
C9DVB8qdYgo,97.5,5 54 a m,false,5:54am,did||good morning it's Monday 5 54 a m my||entire life for five days is in there,179002,22
aY67-HCZ5ms,63.3,5 54 a m,false,5:54am,long ago um I'll tell you exactly how||long it was 5 54 a m so about an hour||ago he then joined the server at 605 am,171060,20
TheMweJt3dc,23.6,5 54 a m,false,5:54am,the fire reached the general alarm were||the highest fire alarm at 5 54 a m on||Monday so General alarm means that it,70354,17
nx1S8JGi4po,45.1,5 54 a m,false,5:54am,reached the highest alert level of||General alarm at 5 54 a m the cost of||the fire is still under investigation,59825,25
dtWgRySozAw,43.5,5 54 a m,false,5:54am,damascus early sunday||40 a m to 5 54 a m two f-16 tactical||fighter jets of the air force of israel,57027,25
pFXEqF26mUQ,2.5,5 54 A M,false,5:54am,undefined 5 54 A M thank you to the 13 followers who joined||life||say hello to avantika who is staring at,54531,20
gG7Ao8243x0,241.6,5 54 a m,false,5:54am,but yeah let's get started today||okay so it's currently 5 54 a m i did my skincare i made myself a||breakfast and i'm going to make,64828,26
_OoQh8gb6wU,186.3,5 54 a m,false,5:54am,videos you're not tired no no||it is currently 5 54 a m we got it through our drive||grande java chip with almond milk,45805,26
A8KrafWeD00,44.1,5 54 a m,false,5:54am,damascus early sunday||from 5 40 a m to 5 54 a m two f-16 tactical fighter jets of the||air force of israel which stayed outside,38735,25
1YvRY7tJRmQ,2336.2,5 54 a m,false,5:54am,see||at 5 54 a m he stated departing for||recon now stewart call me when you're up,24692,27
4I4qdmC6kFc,275.4,5:54 a m,false,5:54am,hit enter and let's go look at our||folder SS bin-debug and notice 5:54 a m is exactly when this DLL was built so||that's what we're really building,25631,27
3Lh7EgV-DLA,324.8,5 54 a m,false,5:54am,five this morning but i remember the||time it was 5 54 a m this morning||i roll over and i get a ding i'm like,21685,26
lFHYEA0kLHc,54.8,5 54 a m,false,5:54am,blocks during the day and they're three||hour blocks the first one starts at 5 54 a m so it's a good idea to get there||early so you can knock out,36129,22