id,timestamp,token,manual,time,lines,views,category
IP9bN-0dlFA,155.8,6:33pm,true,6:33pm,"though he had spent considerable time in the 747||At 6:33pm on that day in November 1996,||This Saudia Airlines 747 flying as flight",175513,27
DRLSmjdGcDM,223.5,6:33pm,true,6:33pm,breaks through the doorway on his own||A 911 call is received shortly after at 6:33pm Sir you have to calm yourself down||in order to get you some help,62480,24
KCnYMZXPY10,1682.6,6:33 PM,true,6:33pm,"He says, follow me||Saturday, 6:33 PM Follow me||End of message",612433,24
KCnYMZXPY10,1682.6,6:33 PM,true,6:33pm,"He says, follow me||Saturday, 6:33 PM Follow me||End of message",612433,24
1SWPcsoUJbY,62.7,6:33 PM,true,6:33pm,Ave all the way to First Avenue||on East 30th street from the hours of 6:33 PM to 7:19 PM||At 7:19 PM they dock the bikes,181765,25
L31OT8u-Nhc,355.6,6:33 PM,true,6:33pm,"ceasefire agreement that was announced||on Saturday night, rocket-alert sirens sounded once again at 6:33 PM , yesterday - throughout||Israel’s southern communities",70922,25
Xhk8yI7bD-M,1315.5,6 33 pm,false,6:33pm,my name is dr clarence t wilson||it is currently 6 33 pm on the night of||may 16th,595942,1
p5ZJ1szEOTI,1918.8,6 33 pm,false,6:33pm,time of day||time of death is 6 33 pm wait he actually died I mean I know that||you know he was in an,422601,20
WAzf4XTiTxY,205.3,6 33 PM,false,6:33pm,all the way to First Avenue East 30th||Street from the hours of 6 33 PM to 7 19||pm,334997,25
HBPkd2DAETo,33.2,6 33 pm,false,6:33pm,-3915 was rented by this man this man||says he picked up the bike at 6 33 pm and he docked it at 7 19 PM now from 7||19 PM to 7,270269,27
HBPkd2DAETo,212,6 33 pm,false,6:33pm,have all the way to First Avenue East||30th Street from the hours of 6 33 pm 7||19 PM so listen to the words that she,270269,27
HBPkd2DAETo,220,6 33 PM,false,6:33pm,bike was||in her brother's possession from 6 33 PM to 7 19 PM so after 7 19 the bike was||not in her brother,270269,27
_05Zkqfn7QI,139.6,6 33 PM,false,6:33pm,I have all the way to First Avenue East||30th Street from the hours of 6 33 PM to||7 19 pm at 7 19 PM they docked the bikes,231161,25
IP9bN-0dlFA,159.4,6 33 pm,false,6:33pm,the 747||at 6 33 pm on that day in november 1996||this saudia airlines 747 flying as,175513,27
sv-xiv1vUyw,386.2,6 33 PM,false,6:33pm,have all the way to First Avenue East||30th Street from the hours of 6 33 PM to||7 19 p m at 7 19 PM they dock the bikes,142790,23
5NH9-RRGe_I,167.2,6 33 PM,false,6:33pm,all the way to First Avenue East 30th||Street from the hours of 6 33 PM to 7 19||pm at 7 19 PM they dock the bike bro you,166346,23
nGnMMh_yO8k,353.1,6 33 PM,false,6:33pm,all the way to First Avenue East 30th||Street from the hours of 6 33 PM to 7 19||pm at 7 19 PM they docked the bikes so,146081,23
FdrzhGzccFw,108.5,6 33 PM,false,6:33pm,all the way to First Avenue East 30th||Street from the hours of 6 33 PM to 7 19||pm at 7 19 PM they docked the bikes,74123,25
zQ4HRH7UkWU,580.6,6 33 PM,false,6:33pm,Ave all the way to First Avenue East||30th Street from the hours of 6 33 PM to||7 19 pm,70368,25
L31OT8u-Nhc,357.8,6 33 PM,false,6:33pm,was announced on Saturday night rocket||alert sirens sounded once again at 6 33 PM yesterday throughout Israel's||Southern communities shortly thereafter,70922,25
ndLoxFErIr4,851.6,6 33 pm,false,6:33pm,and sleep whenever it is as soon as you||can right at the 6 33 pm but another useful ipad in fact a very||useful item is the sleeping bag and,603039,20
C5QY-YAk2CQ,140.2,6 33 PM,false,6:33pm,Avenue East 30th Street from the hours||of 6 33 PM to 7 19 pm||at 7 19 PM they dock the bikes Sarah,102286,22
93pszX5cKYc,497.2,6 33 pm,false,6:33pm,his mom waved and replied I love you and||he was pronounced dead at 6 33 pm thank||you all for watching another episode of,49326,27
77wl1ja0X5Y,877.4,6 33 pm,false,6:33pm,quality||everything 6 33 pm lewis campos is||available quick bring him in to sort out,35734,17
Pgq8xu2UQEE,1026.7,6 33 pm,false,6:33pm,she searched for list of female||murderers by country then at 6 33 pm on||May 8th she searched for postmortem,55910,22
qYwCdmHgito,1050.6,6 33 PM,false,6:33pm,have all the way to First Avenue East||30th Street from the hours of 6 33 PM to||7 19 pm at 7 19 PM they docked the bikes,29989,24
sHBgiY6j1KY,123.8,6 33 pm,false,6:33pm,at||let's see what time um 6 33 pm gmt so||you can adjust that,27620,24
nK9npsmfGE4,159.9,6:33 P M,true,6:33pm,YOM KIPPUR TODAY BEGINS AT||SUNSETMENT 6:33 P M SOME SHOWERS AROUND AND IT WILL||BE RIGHT AROUND 53 DEGREES,10136,25
mhkn959Tr6g,524,6 33 p m,false,6:33pm,we're calling the police||update 6 33 p m no sign of jeremy||tried calling him but his phone has been,1844842,24
PlFhJ-ZAY0w,715.2,6:33 p m,false,6:33pm,the two stars that define her feet||at 6:33 p m the moon is 100||under her,416760,29
YN0qDhse7cA,315.5,6 33 p m,false,6:33pm,just ordered the evil 18 Alexia||happy meal at 3am guys never mind it's 6 33 p m guys watch till the end right now||to see what's inside of the evil,526300,24
WAzf4XTiTxY,405.6,6 33 P M,false,6:33pm,all the way to First Avenue East 30th||Street from the hours of 6 33 P M to 7||19 P M at 7 19 PM they dock the bikes,334997,25
1ZIQ3fI57SY,18,6:33 p m,false,6:33pm,know it's the new trend in the fast food||world today is August 21st 6:33 p m and||I am on my way to try the popeyes,279781,24
pfnTfIAmxgY,32.9,6 33 p m,false,6:33pm,you to our sweet new boy he came into||the world on September 30th at 6 33 p m weighing a whopping nine pounds four||ounces,254037,26
HBPkd2DAETo,862,6 33 P M,false,6:33pm,all the way to First Avenue East 30th||Street from the hours of 6 33 P M to 7||19 pm,270269,27
OOkckarFWOE,181.1,6 33 P M,false,6:33pm,young man rode his City bike from Saint||Nicholas Avenue Manhattan Avenue at 6 33 P M to First Avenue and 30th Street at 7||19 PM from 7 19 to 7,184371,27
ujWR5ncJpUI,102.7,6:33 p m,false,6:33pm,and I saw here in southeast Phoenix at||6:33 p m at 5:30 Pacific time is when||this actually launched from California,152034,22
ASmxuDNF0aw,0.3,6 33 p m,false,6:33pm,undefined 6 33 p m on february 13 2018 melon||responded to a now deleted tweet by||crunchyroll saying please just once,148076,24
ydrhmMi295s,1609.2,6:33 p m,false,6:33pm,happen on the morning of the fifth on||July 4th 2004 at 6:33 p m Scott Harper||sent her an email that reads I'm ready,192559,1
QkWUIaEoUls,486.5,6:33 p m,false,6:33pm,they'll be back soon||6:33 p m and 35 seconds the center to||Faculty's air traffic controller hang -,187979,19
MXIw5KdpqLQ,16.3,6:33 p m,false,6:33pm,is my first video which I uploaded on||October 8th 2017 at 6:33 p m and this||was play PlayStation Network,118004,22
LiZYr8_6R54,247,6 33 p m,false,6:33pm,becky||it is currently 6 33 p m on september 1st and i have a marco polo||by the way you guys should,111438,22
Am4ZdFN1-Pk,167.4,6 33 p m,false,6:33pm,location||i took this video myself at 6 33 p m notice this bright object right here||that came out it looked like it came out,97406,22
s2bnyVxdwmA,275.2,6 33 p m,false,6:33pm,okay let me pause it real quick i took||this video it was at 6 33 p m it||originated from california okay and,90510,27
s2bnyVxdwmA,312.5,6 33 p m,false,6:33pm,witnessed it firsthand this is my video||i took it myself at 6 33 p m the night||of december 23rd this is clear back in,90510,27
s2bnyVxdwmA,337,6 33 p m,false,6:33pm,neighbors and there's the rocket going||from west to east once again at 6 33 p m so more than likely that's not a mystery||that is some sort of a,90510,27
XUubFAPk5LQ,807.5,6 33 p m,false,6:33pm,after bon appetite hi||friends it's 6 33 p m it's been many||hours since we last saw you at lunch uh,89708,26
Cn9_Qxtfyfk,270.7,6 33 p m,false,6:33pm,Arizona Skies this was again on the 22nd||of December back in 2017 at 6 33 p m I'll fast forward it because we all know||what it does the rocket cruises,82282,27
i-wmG2M-yqM,1377.1,6 33 p m,false,6:33pm,editing this video it is||6 33 p m by the way one of my biggest||pet peeves is when influencers complain,83302,22
azfoYNDd-10,554.3,6:33 p m,false,6:33pm,Graciela they'll be back soon||6:33 p m||and 35 seconds this enter,114380,25
pm9KJ-JP75E,474.4,6 33 p m,false,6:33pm,disconnected we're calling the police||update 6 33 p m no sign of Jeremy tried||calling him but his phone has been,77042,24
ndLoxFErIr4,640.4,6 33 p m,false,6:33pm,see i've got the mini map and||at 6 33 p m or 18 33 if you're on a||24-hour clock,603039,20
z_p2orrDbxE,38.3,6:33 p m,false,6:33pm,given that the numerous so kings have||had a little effect at 6:33 p m at||night Jenkins returns home to find the,60927,1
gvnmgmVM7Wk,440,6 33 p m,false,6:33pm,the game which I don't even know what||time it is 6 33 p m so the game is going||to be starting up pretty soon actually,66884,17
eurTquMpqow,84.4,6:33 p m,false,6:33pm,the doctor declared Lockett unconscious||at 6:33 p m the viewing rooms curtains||were lowered while the second and third,57183,25