id,timestamp,token,manual,time,lines,views,category
pPbWjUM7Jpk,293.4,7:34pm,true,7:34pm,"It literally says||first seen at 7:34pm||So, that’s pretty much when they",1102227,24
9-3INjCA_FM,1369.8,7:34pm,true,7:34pm,"- God damn it||All right, I'm gonna call it, time of death 7:34pm||You're gonna be all right?",63906,1
Qwe1vyTfeC8,100.9,7:34 pm,true,7:34pm,"Tonight, the vice president has clarified,||in a letter sent to all of us, at 7:34 pm ,||that this resolution has absolutely no other purpose",424999,25
gaY1KeC9u2w,115.1,7 34 PM,true,7:34pm,EXPLAIN WHAT HAPPENED||7 34 PM TWO CALLS CAME IN AND WERE||INTERRED AS PRIORITY,54282,25
b9rn-ojETqk,70.5,7 34 pm,true,7:34pm,12 hour clock subtract 12 from that hour this||gives us 7 34 pm||If you'd like to support your,16937,27
5dwVhjk_md0,1996.6,7 34 pm,false,7:34pm,has been successful thousands of times||disney workers dialed 9-1-1 at 7 34 pm farbenoff was taken to florida hospital||celebration health where he was,300321,27
OONfEsP6iJY,149.1,7 34 pm,false,7:34pm,as seen from Arizona at 705 p m and this||lasted until 7 34 pm and I recorded||that's Mars right there this is a camera,247757,27
OONfEsP6iJY,248.7,7 34 PM,false,7:34pm,there you can see Mars did indeed dip||behind the moon and at 7 34 PM it is now||completely invisible right here I,247757,27
UCPW1s9kHNU,1319.4,7 34 PM,false,7:34pm,one right here you see Thursday flight||arrived at 7 34 PM notice it says last||scene near matthewtown Bahamas that's,236885,25
TkoRuBnDZ5E,131.5,7 34 pm,false,7:34pm,Shadow Legends for sponsoring this video||at 7 34 pm on December 21st the hack was||finally public the Koya server staff,293882,24
2oeTJTWNlB4,464.2,7 34 pm,false,7:34pm,available so the plan is they're going||to undock at 7 34 pm eastern time on saturday and the landing||should be 2 42 p m,221007,28
nfe0GhoSaBQ,1146.7,7 34 PM,false,7:34pm,approach||the last transmission is received 7 34 PM the aircraft is expected to maintain its||altitude at 1 240 feet until the pilots,386445,28
N8GF5zPJu0c,818.8,7 34 pm,false,7:34pm,Nightfall was creeping closer last light||on that day would be around 7 34 pm at||that time the decision was made for,134151,26
qQakTgXwnTc,59.8,7 34 pm,false,7:34pm,the plane left san francisco at 6 44 pm||and arrived at eugene at 7 34 pm once the plane had taken off from eugene||flight 956 was assigned an altitude of,132143,28
kBVb2Oct8fs,40.4,7 34 pm,false,7:34pm,southern railway the area was known to||be rather respectful until one day the 7 34 pm passenger train from chairing||cross passed under a bridge several boys,102548,27
2fkBng5cc2Q,363.9,7 34 PM,false,7:34pm,Department complex showcases car pulling||the parking lot at approximately 7 34 PM the video shows the car was occupied by||one person shows the person wiping down,92877,24
2zNchWA3LQw,2399.2,7 34 PM,false,7:34pm,had that same position||at 7 34 PM after less than five hours of||deliberation the jury returns with a,219391,1
d3aPxTRiJ8Q,956.9,7 34 PM,false,7:34pm,found are they still missing well on||July 13 2022 at 7 34 PM Eastern Time||Lulu belt 2K would make a new post,75049,24
by9msZZDTD8,29.3,7 34 pm,false,7:34pm,point in time where the sun finishes||setting is at 7 34 pm eastern time but||that will be very similar for the rest,53108,27
7sG0m70YdOM,96.7,7 34 PM,false,7:34pm,you were able to see it in person if not||7 34 PM check your doorbell cameras||because they do a really good job of,36495,25
A-0wS2nOC8o,48.1,7 34 pm,false,7:34pm,old male who was shot multiple times was||pronounced dead at 7 34 pm the 19 year old female is in critical||condition undergoing surgery,35925,25
LvxBFnl33Eg,6.9,7 34 PM,false,7:34pm,are in Mundelein Illinois we're on||January 21st 2022 at 7 34 PM a Mundelein||Police Sergeant observed a white Honda,111160,27
i3W2IoTNfks,1378,7 34 pm,false,7:34pm,role of duct tape had been purchased at||a nearby Walgreens store at 7 34 pm on||March the 15th 2007,32781,24
MiSUfdVN3gQ,208.6,7 34 pm,false,7:34pm,want to be like this starting the vlog||in my pjs all day at 7 34 pm and um i||edited,27891,22
5dwVhjk_md0,1996.8,7:34 p m,true,7:34pm,"""The performance has been successful thousands of times ""||Disney workers dialed at 911 at 7:34 p m||Varbanov was taken to Florida Hospital Celebration Health,",300321,27
BVYjyO24EqM,90.5,7:34 p m,false,7:34pm,now let's go to discus night of crash||7:34 p m what did they mean night of||crash Leila I'd like to welcome everyone,1929928,20
F2-OboKKTlw,140.6,7:34 p m,false,7:34pm,whole world out there you can say the||whole world just kidding 7:34 p m January 2nd 2018 2440 subscribers left||yup you sorry I did the math so quick,1597061,20
8SLJtrG2abM,277,7 34 p m,false,7:34pm,in their right mind would do such a||thing my bedtime is 7 34 p m sharp oh god it's 7 32 p m i||gotta finish this video fast,1025388,23
ihhuZIqi2-4,252.6,7:34 p m,false,7:34pm,house I mean I have no idea what to do||about that 7:34 p m man dressed as a||nerd female dressed as crazy which,761114,23
7z2d5vPYu0k,2470.1,7 34 p m,false,7:34pm,had that same position||at 7 34 p m after less than five hours||of deliberation the jury returns with a,593894,24
y_6LIEyNILU,19.8,7 34 p m,false,7:34pm,time in real life||I'm playing this at 7 34 p m so that's||pretty weird anyways let's get started,717030,20
LKhEOeLvspo,489.4,7:34 p m,false,7:34pm,I'm going to play a game||of csgo then shirt and I say at 7:34 p m gah hurry up||what there's no tree above us there's no,485069,20
Qwe1vyTfeC8,102.4,7 34 p m,false,7:34pm,letter sent to all of us||at 7 34 p m that this resolution has||absolutely,424999,25
3c-tzWxcaPo,797.5,7 34 p m,false,7:34pm,right now||currently 7 34 p m i'm about to be here||till midnight tonight,350343,20
IFsc5TXyohs,618.9,7 34 p m,false,7:34pm,news one go watch it but that literally||took up all my time it's 7 34 p m right||now it's so late and basically my dad,310477,22
atfm7B4SbOU,1333.3,7 34 p m,false,7:34pm,delicious it is||7 34 p m got here at like five but||and they're done,404255,22
zNDLPs8q2B8,152.6,7 34 p m,false,7:34pm,was there ben i know your darkest||secrets i'm in your walls august 14 7 34 p m like it has gone just||very much to the extreme i've never seen,273014,23
5qsE3mk9NIo,52.8,7:34 p m,false,7:34pm,crashed||7:34 p m I like to welcome everybody||aboard the robloxian blue hound oh look,202106,20
NiSq1CQcOb4,741.5,7:34 p m,false,7:34pm,moon happens on the 7th of April it||happens at 7:34 p m Pacific and 334||a m,189205,24
4VX5tqjrHo8,219.9,7:34 p m,false,7:34pm,would be that statement was made on||Wednesday August 28th at 7:34 p m Eastern Standard Time and was issued in||response to a question by one of Musk,179490,28
9boMXMwuJDY,1108.8,7:34 p m,false,7:34pm,story of the amazing Avery||born December 16 2017 at 7:34 p m six||pounds zero ounces seventeen and a half,156207,26
DN5fRHghjqU,110.1,7:34 p m,false,7:34pm,to a chemical test of your breath at||7:34 p m you indicated your refusal to||submit to this 10 buzzer different,150700,22
4FU2E1Nfh5w,541.4,7 34 p m,false,7:34pm,later||hey guys it is 7 34 p m and now||like,149141,22
Aol2DOGWmhk,121,7:34 p m,false,7:34pm,Eastern Standard||Time and at 7:34 p m here I'm getting a||little bit tired even though I sold a,134268,22
rFCMChESaF0,136.7,7 34 p m,false,7:34pm,3 15 in the morning also you see right||there it's 7 34 p m I go to bed really||early,129636,24
uUaVsXlP6t0,4.8,7 34 p m,false,7:34pm,investigations||it is 7 34 p m Wednesday May 25th 2022||I am here in,107933,20
stS4sQdYVnE,296.4,7:34 p m,false,7:34pm,so KTVI TV reviewed these felts Twitter||feed and cited a tweet posted at 7:34 p m Saturday about nine hours after Ali||was found dead it reads quote so you,109669,25
kfu0k7SpO-o,697.9,7:34 p m,false,7:34pm,now||7:34 p m 734 I was going to wait a||couple more hours but I'm checking in,97518,26
M6TtMzawWyA,902,7 34 p m,false,7:34pm,pata||it is right now 7 34 p m four hours||driving,91486,1
LY3AH5e51r0,1422.7,7:34 p m,false,7:34pm,doing standing over there as oh okay||where's my award I'm just 7:34 p m we've still got time to win this is one||event that I definitely don,85835,20
SpiY3c4kO50,316.1,7:34 p m,false,7:34pm,let's 7:34 p m okay okay number 9 and when it||comes to romance you,71032,24
Y-d-5qg5cBw,1075.1,7 34 p m,false,7:34pm,will be twins oh i just ran up the||stairs but it's currently 7 34 p m right||now we just got back from my parents,71922,22
lYxNXVwHALE,642,7 34 p m,false,7:34pm,out the following||at 7 34 p m so less than an hour and a||half ago at the time i'm recording,59837,24
QJ9WQJajtpE,505.6,7:34 p m,false,7:34pm,midnight Pacific Daylight Time Tuesday||at 7:34 p m Pacific Daylight Time local||law enforcement officials have reported,64605,24
MmXZsFV-gP8,49,7 34 p m,false,7:34pm,so let's get started okay||night of crash oh 7 34 p m oh little sassy little suss||if you will please examine,427446,20
NeLiYw5Y9nk,118.3,7 34 p m,false,7:34pm,what's up you guys so it is currently||the next day it's 7 34 p m princess with||my mom and,49658,22