id,timestamp,token,manual,time,lines,views
wMTZbGDGKX0,1401,3 43 am,false,3:43am,post||hi so it's currently 3 43 am so||that's where i am in life i forgot to,737600
-7jREFAIrsQ,83.2,3 43 am,false,3:43am,aborted at t-0||at 3 43 am just to note that this was||the first time that we know of that,412087
fye4Z2tiZ0U,692.1,3 43 am,false,3:43am,it's 3 43||3 43 am yeah that's kind of sweet||i'm not ever playing i think that was,483312
Zs3WENd-M8k,795.1,3 43 am,false,3:43am,finally after one hour of waiting at||exactly 3 43 am we all heard the bathroom door open his||light poured into the room,162597
GmDsmihFG-o,806.2,3 43 am,false,3:43am,the window was open||and i also noticed the clock read at 3 43 am crap||rule number five,124042
2TGyS7cq0gc,2797.6,3 43 am,false,3:43am,more solid i don't know||at 3 43 am to be how||how i could be more articulate that with,102826
yaK0y7zVvQs,1551.1,3 43 am,false,3:43am,i've been trying||it is what time is it it's 3 43 am and i'm tired i'm gonna post it after||this video,139550
NMqe7RYVGH8,228.5,3 43 am,false,3:43am,71st he will reply I'm in a van deface||then at 3 43 am he would tweet I could||have did a lot of bogus-ish that was his,228439
Y2j4QnEaATE,258.2,3:43 a m,true,3:43am,"real cops||At 3:43 a m , patrol officers from the Los||Angeles Police Department arrived to investigate",425767
EcWXCq8XD78,60.8,3:43 a m,true,3:43am,works as a driver's license always||keep one of your wallet she says at 3:43 a m Alaska time I was driving towards Sicily's pizza I was starving and sleeping when,176595
sZ-YvzhFeU4,93.6,3:43 a m,true,3:43am,", Mimi said in a facebook post that||she was pulled over for weaving at 3:43 a m Weaving at",111335
sZ-YvzhFeU4,97.3,3:43 a m,true,3:43am,Weaving at 3:43 a m While driving to a pizzeria after an early morning flight from California or||the,111335
GZDZFvbUGXA,981,3:43 a m,false,3:43am,give up but I wanted to keep pushing||alright guys at 3:43 a m I don't know||what I'm doing anymore my hands starting,14046867
2bj73ZvxfIo,961.3,3 43 a m,false,3:43am,get good sleep last night I've been up||since 3 43 a m 3 43 why do you do that I||mean not on purpose I think it,3781766
srCAHvaYbDM,491.5,3:43 a m,false,3:43am,over here right yes cuz what time is it||it is 3:43 a m in the morning right now||sure I really think we shouldn't have,1622176
cLEaPw29MOM,746.4,3:43 a m,false,3:43am,worst thing we've ever done we got out||it is 3:43 a m right now I'm gonna call||ray and tell him we out you know did,1329609
BEgLOJ7O9sQ,297.8,3:43 a m,false,3:43am,let's go come on what time is it||3:43 a m in the morning right now you||come on guys I just got some nachos over,1257433
bVv_din-NKA,144,3:43 a m,false,3:43am,23 guys||3:43 a m oh god||hopefully we're not waiting here that,1047872
ijjxfwf1zrk,1212.2,3:43 a m,false,3:43am,gym so Graham at one deny and yell||really Priam 3:43 a m and I've got Josh||who's a member of the side man who's,915301
j4wWYvbqgQE,1328.8,3:43 a m,false,3:43am,to bed please||3:43 a m jack has returned to the Big||Brother house Jack why did you leave the,646631
SC6QHdYazdA,2.2,3 43 a m,false,3:43am,we get here late as i'm in bed at||like three 3 43 a m jake||she stopped and i'm like what the,567059
yIZmUINSvQ4,788.5,3 43 a m,false,3:43am,through your window with binoculars and||then writing down okay at 3 43 a m he||was I don't know like reading a book at,600421
LgSi4oKzJJo,819.4,3 43 a m,false,3:43am,ow my head ow jeez look like a hug||jeez all right it's now 3 43 a m you||guys,525556
LDWxDQyaCcE,1972,3 43 a m,false,3:43am,wasn't used after 1208 am but the||internet router was turned off at 3 43 a m and it wasn't turned back on until||601 am and the towers were like,515090
jXN5bGHF4dQ,3.1,3 43 a m,false,3:43am,what's going on guys asian guy here||currently live at 3 43 a m at www twitch tv for slash asian guy||stream,260568
SYpnAGb1vTw,1233.2,3 43 a m,false,3:43am,speaking better than me i am in here at||3 43 a m wait||hey girl she's about to yep show it i,201420
uCCFO-B8coc,623.2,3:43 a m,false,3:43am,yeah I just finished editing up to this||point yes the time is 3:43 a m in the||morning oh right now guys I am just,110193
Gj1IUtxAm9I,16.7,3:43 a m,false,3:43am,to introduce you to someone really||special so last Sunday at 3:43 a m I||had my baby oh my gosh,101220
ZdZGvmv8EYM,2052.8,3 43 a m,false,3:43am,roughly what time I started pushing I||gave birth at 3 43 a m but Cass propped||up his phone and started filming the,217720
ZdZGvmv8EYM,2715.9,3 43 a m,false,3:43am,2023 what time||3 43 a m and she weighed eight pound||three,217720