id,timestamp,token,manual,time,lines,views
8hFwBTQZbz8,223.4,8:25am,true,8:25am,Our flight to Chicago this morning||departs at 8:25am from Gate C7||If you ever fly,493676
8LXcVe-x3Y4,953.6,8 25am,true,8:25am,"Yes||Do you remember receiving a phone call on 25 August at about 8 25am ?||No, sir, no call",383401
Js_VktTwRhk,848.8,8 25am,true,8:25am,"Alright, we'll set off from here in an hour||Time check, 8 25am||Dinesh, Rajkamal, Sathiya,",284192
5fwYXe3hLeY,585.2,8 25am,false,8:25am,her mailbox great okay half an hour||later at 8 25am bridget makes another||attempt at contacting her daughter,161631
QdQ3gY0IaY8,1033.1,8:25 AM,true,8:25am,"Morning, Gods||It's 8:25 AM Look at what people are doing on the top at this time||Everyone's faces",3991108
QdQ3gY0IaY8,1033.1,8:25 AM,true,8:25am,"Morning, Gods||It's 8:25 AM Look at what people are doing on the top at this time||Everyone's faces",3991108
QdQ3gY0IaY8,1087.3,8:25 AM,true,8:25am,"Morning, Gods||It's 8:25 AM Look at what people are doing on the top at this time||Everyone's faces",3991108
QdQ3gY0IaY8,1087.3,8:25 AM,true,8:25am,"Morning, Gods||It's 8:25 AM Look at what people are doing on the top at this time||Everyone's faces",3991108
X8XZriAdB1g,84.1,8:25 AM,true,8:25am,right||to operate a flight landing at Heathrow at 6:30 AM and departing at 8:25 AM This is the most popular time of day to operate flights as its when overnight,2986138
5wxeyHAkJ7Y,48.2,8:25 AM,true,8:25am,"in Vegas||So it was 7 AM, I got on Southwest com and booked an 8:25 AM flight leaving Los Angeles, going to Las vegas||So now I am running to my",1708769
6xCKkjjPeuU,496.3,8: 25 AM,true,8:25am,"phoned in the false alarm as a diversionary tactic||8: 25 AM , Mitchell and Stewart make their move||CRASH",512400
mzoVdlYcrN4,41.5,8:25 AM,true,8:25am,"than on tomorrow's show||And I thought as I got on my computer at 8:25 AM this morning to pull up the stream, I should||see if Donald Trump has been",264669
8LXcVe-x3Y4,969.8,8 25 am,true,8:25am,No call||The phone record shows that you received a call from someone at about 8 25 am Who called you?||Oh yes,383401
S_-I2Lai4aQ,179.3,8:25 am,true,8:25am,"name 70 kilometers east of the city of Linares||On May 30th of 2023 at 8:25 am local time, a series of volcano tectonic quakes caused||by the fracturing of rock, possibly",148510
cL9PsCLJpAA,838.9,8 25 am,false,8:25am,utility company||at 8 25 am the public found out what was happening||at three mile island not from the plant,2937299
TzwbFj5LfvQ,38.7,8 25 am,false,8:25am,i work out twice before everyone wakes||up it's currently 8 25 am just finished||dissecting my arms in the gym really 8,2334921
emvlGNsuRsI,417.6,8 25 am,false,8:25am,lightyear because of a thunderstorm he||sets his alarm clock to 8 25 am however||the next morning instead of going off at,772052
4QPNxmryQRU,14.8,8 25 am,false,8:25am,to survive||8 25 am denipro City||818 a blast underneath the glass Bridge,549580
C7aAlGj_DqI,247.8,8 25 am,false,8:25am,and there was no response her mother||says that at the 8 25 am call the call jumped right to the||mailbox which could indicate that her,503100
rTeWE9RYaBc,606.6,8 25 am,false,8:25am,house||8 25 am the mother calls her again to no||avail she decides to call jessica's,370997
lRFflvuL43Y,342.6,8 25 am,false,8:25am,that would be confirmed when a friend of||jessica said she called him at 8 25 am just before she left the house and asked||if he was walking to school he,341239
8LXcVe-x3Y4,973.2,8 25 am,false,8:25am,a call from someone||at about 8 25 am who called you||oh yeah i remember now i got call got,383401
t1XU-KfkUD4,301.7,8 25 am,false,8:25am,on April 16th the crew ate breakfast||without interruptions however at 8 25 am the radar operator reported a cluster of||enemy aircraft too many to count,260916
097a08zyfOc,1474.5,8 25 am,false,8:25am,while taking a shower in the||marcos paz prison on the 16th at 8 25 am he was found dead in his cell||the autopsy found that he had died of,221938
eevLAmkrBzI,53,8 25 am,false,8:25am,first mode to obtain a scroll||is spawned at the nimbus village at 8 25 am pm||so that's where it spawns the chances of,178761
S_-I2Lai4aQ,178.1,8 25 am,false,8:25am,70 kilometers east of the city of||lanares on May 30 8th of 2023 at 8 25 am local time a series of volcano tectonic||Quakes caused by the fracturing Iraq,148510
5fwYXe3hLeY,535.7,8 25 am,false,8:25am,rooter for the last time||at 7 46 a m half an hour later at 8 25 am brigitte makes another attempt at||contacting her daughter rebecca or becky,161631
Pe2-rqVS9cQ,152.6,8 25 am,false,8:25am,well let's see it's 6 p m right now||school usually starts at 8 25 am so||we've got about maybe 13 hours in here,148243
uCca6x2C6NI,409,8:25 a m,true,8:25am,", you ain't got nothing more to worry about ""||That was on May 27 at 8:25 a m And Lilian was born on what day?||May 23",4322019
IDBl2oMQxA4,210.5,8:25 A M,true,8:25am,"WEIRD ABOUT TRUMP'S ASSANGE TWEET||HE TWEETED THE FIRST PART OF THIS SENTENCE AT 8:25 A M , BUT||FINISHED THE THOUGHT 20 MINUTES LATER",2186929
rcV5DMPyUio,144.7,8:25 a m,true,8:25am,"- Here we are||- It is Wednesday, it is 8:25 a m||- I don't mean to embarrass you,",588858
6yotH0GTJ6Q,1363.2,8:25 a m,true,8:25am,", you ain't got nothing more to worry about ""||That was on May 27 at 8:25 a m And Lilian was born on what day?||May 23",194064
MISigfCCN7Y,111.4,8:25 a m,false,8:25am,dog in my homework on CBBC every Sunday||at 8:25 a m starting on November the||24th so it's it's this Sunday when you,4356745
uCca6x2C6NI,408.6,8 25 a m,false,8:25am,about||that was on may 27th at 8 25 a m and lillian was born on what day may the||23rd,4322019
DkZKG-SQ1WU,1365.5,8:25 a m,false,8:25am,left for work leaving his wife and||daughters in bed asleep at 8:25 a m Chris stages are called to Shannon's||phone he then accesses the internet to,3734996
DkZKG-SQ1WU,1862.1,8:25 a m,false,8:25am,7:40 a m||and 8:25 a m earlier that||morning as well as most recently at 2:11,3734996
X8XZriAdB1g,88,8:25 a m,false,8:25am,and departing at||8:25 a m this is the most popular time||of day to operate flights as it's when,2986138
N6gaJ125Kxw,217.6,8 25 a m,false,8:25am,is there school today Oreo boys are at||school it's 8 25 a m Les is at school||we're gonna open up this Tick Tock,3635544
BFLBS4KIE_o,169.4,8:25 a m,false,8:25am,you get a lot of departures out of||Boston around 8:25 a m after working||planes for more than an hour Hartley get,2479845
AKitPD1tQOM,267.3,8:25 a m,false,8:25am,today is Tuesday June 9th is currently||about 8:25 a m and we are gonna be||getting discharged oh my gosh I'm,2140024
zQkUEhwUgRw,959.5,8 25 a m,false,8:25am,respond to this notice the account will||be escalated this was yesterday at 8 25 a m today at 204 PM a payment will be||going out today so so hold on,2176970
5wxeyHAkJ7Y,49.4,8:25 a m,false,8:25am,I got||on Southwest comment booked in 8:25 a m like leaving Los Angeles going to Las||Vegas so now I am running dry over,1708769
zQkUEhwUgRw,959.5,8 25 a m,false,8:25am,respond to this notice the account will||be escalated this was yesterday at 8 25 a m today at 204 PM a payment will be||going out today so so hold on,2176970
qe7-esTGr3A,918.4,8 25 a m,false,8:25am,m 7 A M 8 A M when did I go to bed||that day 8 25 a m 8 24 December 17th and||then again the next day up until 2 40,1657586
FpYtolulP8w,483.5,8 25 a m,false,8:25am,I have never been to Rome before||the flight costs 18 pounds it's at 8 25 a m in the morning which means I need to||get up at like six I'll,2291216
W0AegWeWJg4,1175.9,8 25 a m,false,8:25am,it is with a heavy heart that we||announced at 8 25 a m today Steve priest||founding member of The Suite passed away,1325405
DN9gmSbqvtM,471.4,8 25 a m,false,8:25am,m i'm 10 minutes early wait||i don't know what he looks like 8 25 a m huh hey excuse me i'm are you going to||meet someone in the cafeteria,1000781
kce49pa0JLU,388.6,8:25 a m,false,8:25am,Liberty City the local time is bah-bah||8:25 a m and according to information i||gleaned off of google this is a,765718
5H3lbj9RF1A,1912.8,8 25 a m,false,8:25am,homicide detectives began interrogating||rifkin at 8 25 a m on june 28 1993||they questioned him for eight hours but,665957
1QenVqjOu5Q,54810.5,8 25 a m,false,8:25am,it's 8 25 a m and I'm beginning to||question my sanity it feels like a lot||more,1236048
rcV5DMPyUio,144.8,8:25 a m,false,8:25am,New York City and then here we are it is||a Wednesday it is 8:25 a m I don't mean||to embarrass you but it's actually,588858
8uceluhF4f8,39.6,8 25 a m,false,8:25am,on reserve and i'm just like okay cool||it signs in at 8 25 a m no big deal and||then i get off the phone with him and i,509677
KdJ6Q6LkoKU,1464.2,8 25 a m,false,8:25am,observed coming from the building it was||soon engulfed in flames at 8 25 a m Martin was seen running from the Flames||removing his clothing that was on fire,742083
OqRaKHUqjWg,230.7,8:25 a m,false,8:25am,if the espionage involves Julius Assange||Thursday January 5th 8:25 a m the||dishonest media likes saying that I am,460662
aPyx1Skp6z0,49.8,8 25 a m,false,8:25am,go to||better get to class 8 25 a m what i'm leads the bell didn't even ring||is myla here here tristan,442620
MgGr0F15EiI,151.6,8 25 a m,false,8:25am,always came back stronger I also took||these pictures December 11th at 8 25 a m on an empty stomach after cardio and he||goes on to tag a bunch of,334082
Suhirt99Hy8,1002.6,8:25 a m,false,8:25am,the firefighters continue to battle the||blaze after the initial call in an 8:25 a m tweet the Police Department||announced shutting down Junipero Serra,318994
JB7-f0SlEtY,176.1,8 25 a m,false,8:25am,born at 507 a m on february 11||2019 while brett went to heaven at 8 25 a m the same day||what a tragic story,313973
S2lVNEwR56M,1411.9,8 25 a m,false,8:25am,currently||48 degrees in here and it is 8 25 a m so||we'll check back in,370609
CD6MLoFD7C8,248.2,8 25 a m,false,8:25am,jackson's and the date is september 5th||2018 at the time of 8 25 a m it was on a sunday and it also||says underneath shadow06,308383
mzoVdlYcrN4,41.6,8:25 a m,false,8:25am,than on tomorrow's show and I||thought as I got on my computer at 8:25 a m this morning to pull up the stream||I should see if Donald Trump has been,264669
8LXcVe-x3Y4,957,8 25 a m,false,8:25am,on the 25th||of august at about 8 25 a m no sir no call no call no call||the phone record shows that you receive,383401
BkFrLOeHkdk,90.4,8:25 a m,false,8:25am,the 1st of July and will fly twice daily||leaving Dubai as ek8 62 at 8:25 a m and||arriving into Muscat at 9:40 a m,255088
ilK5gW9hHcY,396.1,8:25 a m,false,8:25am,right we'll set off from here in an hour||time check 8:25 a m Dinesh Raju Tamil Satya||I'm scene investigation of is Azul from,258184
-BDKyJ-MqOs,184.6,8:25 a m,false,8:25am,Thomas Street she spoke to the boy's||father at 8:25 a m to let him know she||would be there shortly she was wearing a,261039
FUG9qkgBLio,415.7,8:25 a m,false,8:25am,guys I'm sure||oh no it's not 8:25 so it's not 8:25 a m and I'm gonna be having this||foundation on for 16 hours so I'm,266598
zUwZL5dYngQ,1042.5,8:25 a m,false,8:25am,it's now the next day it is a Monday the||2nd of September at 8:25 a m sorry are||we gonna set my Allah I had my lunch set,227100
G8EsQMToIi4,257,8:25 a m,false,8:25am,let's see what happen oh my god we have||a clock it's 8:25 a m just pray above||my map so I'm just gonna run straight,205269
6yotH0GTJ6Q,1364,8 25 a m,false,8:25am,more to worry about||that was on May 27th at 8 25 a m and||Lillian was born on what day,194064
WxIoPNPqHQE,50.3,8:25 a m,false,8:25am,and then||8:25 a m so sometimes I just upload all||you know a lot of videos I've got,167329
3wTRBS16T4w,1842.8,8 25 a m,false,8:25am,under surveillance||he had checked out at around 8 25 a m in||the morning,173277