id,timestamp,token,manual,time,lines,views
h4lLqmltZNs,827,9 23 pm,true,9:23pm,she is worried about her daughter as she currently||sleeps at 9 23 pm she messages a man named patrick||for fuel money and tells him that she doesn,1434917
5-DiRM4CFPI,419.8,9 23 pm,false,9:23pm,starting and what they could expect||later that night at 9 23 pm she did||another facebook post that said going to,6213770
GV7rHtPjYWw,1067.4,9 23 pm,false,9:23pm,he's not the killer and since||we can see here that it's already 9 23 pm we should expect the real killer to||be arriving soon now we have to give,1983380
h4lLqmltZNs,828.5,9 23 pm,false,9:23pm,that she is worried about her daughter||as she currently sleeps at 9 23 pm she||messages a man named patrick for fuel,1434917
-7jREFAIrsQ,447.1,9 23 pm,false,9:23pm,is that now on the night of the 21st the||road was closed at 9 23 pm with the pad being cleared soon||thereafter it is believed that the,412087
YN_fd012dz0,277.4,9 23 pm,false,9:23pm,ed woodward was resigning after 16 years||and at 9 23 pm the clubs started to fall||manchester city announced that they were,307716
nhcXb0CgKyk,571.1,9 23 pm,false,9:23pm,presence of god above everything else||can i ask you a question at 9 23 pm is||there anybody that still needs god's,260145
WIaobau2gX0,1069.3,9 23 pm,false,9:23pm,that's||um 9 23 pm and I do understand that she||did not receive it says the package been,244915
_R0P-nPPyyY,104.4,9 23 PM,false,9:23pm,the 23rd September Smackdown ratings||Peak at 9 23 PM the time some fans||thought the rabbit or a clue would,166176
YN_01FJJzn4,205,9 23 pm,false,9:23pm,when they immediately knew something was||wrong so that same friday at around 9 23 pm mia's family calls the orange county||police department and lets them know,155909
k-92V5dEcro,55.9,9:23 p m,true,9:23pm,"camera died and I had to go put it to chart and it is now 9:23 p m||Since I always get asked about my skincare, I thought it would be a good",601618
QE7-jPjoyYM,858.2,9 23 p m,true,9:23pm,peter griffin his heinous crime took place in||bellevue nebraska at exactly 9 23 p m at a sonic||parking lot we intentionally lightened his heinous,420214
pDhAdN829CA,13,9:23 P M,true,9:23pm,", I HAVE MY READING GLASSES ON BECAUSE AT||READING GLASSES ON BECAUSE AT 9:23 P M WHEN I KNOW YOU WERE",213143
pDhAdN829CA,15.4,9:23 P M,true,9:23pm,"WHEN I KNOW YOU WERE||9:23 P M||WHEN I KNOW YOU WERE WORKING, ""THE WASHINGTON POST""",213143
pfSNJlCl4ZA,91.1,9:23 p m,false,9:23pm,you every week I say we do weekly||drawing time on on Thursdays at 9:23 p m and where are you no one wants to||see summer Ted,3889641
UgwkRxKxyls,3251.3,9 23 P M,false,9:23pm,yo chat I'm not dead like okay here||ready all right 9 23 P M okay 9 24 p m 9 24 pm at the top||okay this is not,796325
PwbU7llS8mI,511.1,9 23 p m,false,9:23pm,tried getting fed didn't work so it's||now 9 23 p m guys we've got a little no||no back yeah that's Mama dada's,687893
UCJNo7yEuK4,27.2,9:23 p m,false,9:23pm,missions as fast as we physically could||begin right at 9:23 p m and go grab a||few cars grab some guns and might I add,634307
k-92V5dEcro,58.6,9 23 p m,false,9:23pm,put it to charge||and it is now 9 23 p m since i always get asked about my||skincare i thought it would be a good,601618
9odoj7qZc6Q,362.1,9:23 p m,false,9:23pm,meant to be hey guys update time so it||is currently at 9:23 p m Tila laughs||actually like a long time ago I haven't,591297
JmeWHJwjfIo,82,9:23 p m,false,9:23pm,would think right now I didn't do that||we did at 9:23 p m so you eat mashed||potatoes late at night did and who would,514477
ipOeKaNXbL0,1963.4,9:23 p m,false,9:23pm,get one||alright guys so it is 9:23 p m to go to||food so we did go with the falafel wrap,429536
rEMKuiWLez0,1237.6,9:23 p m,false,9:23pm,next a message received yesterday at||9:23 p m mr||Wayne,434038
QE7-jPjoyYM,857.8,9 23 p m,false,9:23pm,peter griffin his heinous crime took||place in bellevue nebraska at exactly 9 23 p m at a sonic parking lot we||intentionally lightened his heinous,420214
u4Aby8rYgE4,1644.6,9 23 p m,false,9:23pm,yeah i will be back shortly||all right guys and we are back it is 9 23 p m and we do have this||massive box here so this box is all the,409521
8k7iVkkVSXY,54.3,9 23 p m,false,9:23pm,a good one||let's get started 9 23 p m probably not||a good time to start off,353513
BfZDLO-GWfA,310.8,9 23 p m,false,9:23pm,okay so three hours have passed as you||guys can see it is 9 22 9 23 p m right||now and i've just been kind of,341758
RJxxO-fkkEs,0,9 23 p m,false,9:23pm,hey guys so it is 9 23 p m right now||pretty much 9 30 at night and Quan and I||are headed to,500994
RHvszpTFfOE,714.5,9:23 p m,false,9:23pm,Tauri to make her wait - are you||sleeping so brides are open 9:23 p m on||May 19 May 19 19th 2016,236749
W5R8gWcDfa4,41.6,9:23 p m,false,9:23pm,ginger the||redheaded robber appearing at 9:23 p m on the eve of Good Friday carrying a||large trash bag into the basement of the,227680
pDhAdN829CA,4.8,9:23 p m,false,9:23pm,Rachel I have my reading glasses on||because at 9:23 p m when I know you||were working the Washington Post,213143
sAOXXwFt6_U,436,9:23 p m,false,9:23pm,get really hungry I'm glad it's||night it's a it's officially 9:23 p m and I have yet to eat dinner growing||stir fried chick strip right chicken and,173295
6JjUHPInDMw,138.2,9 23 p m,false,9:23pm,reveal a chronology of the mounting||chaos at 9 23 p m concert goer ellen||elise evans filmed fans climbing speaker,154322
FdkecQJO0hA,163.4,9 23 p m,false,9:23pm,you've got to practice patience this||massive Peak as well also tied into 9 23 p m which was in the original teaser and||man WWE was so smart because this is,145331
u2YPCe0UYRA,489.5,9:23 p m,false,9:23pm,already so there we go for the evening||on this Thursday so it's now 9:23 p m and waving goodbye from up here in Ohio||all five of us are for sex,124892
Vk6CrWJdRto,158.8,9:23 p m,false,9:23pm,choose||our commas day 9:23 p m on Tuesday June||last will I'm currently at my 97 9 move,105390