id,timestamp,token,manual,time,lines,views
VR3TwQRZEng,185.5,9:43am,true,9:43am,High octane||Rhs:Its 9:43am and we're leaving from isb||Its sunny today,430982
ZL5zcafzpHk,368.7,9:43am,true,9:43am,"station five miles from Pore Island||Then, at 9:43am , nine twin-engine Japanese||bombers detected an escort of four",410792
1oOLQjzPOFA,193,9:43am,true,9:43am,was a long day for the flight crew who left the city of Sao Paulo 9:43am for the||8 hour and twenty-minute flight to Belem||The trip would normally not,161378
xRpPtuymV24,60.1,9:43 AM,true,9:43am,Did a missile hit the pentagon?||At 9:43 AM a Boeing 757 commercial plane flew into the Pentagon||Conspiracy theorists believe that the impact,2698688
DPHGUQrixWc,737.9,9 43 am,false,9:43am,four four five six vincennes out||it's 9 43 am a routine encounter in the||persian gulf has become,3415069
xRpPtuymV24,58.2,9 43 am,false,9:43am,9||did a missile hit the pentagon at 9 43 am a boeing 757 commercial plane flew||into the pentagon,2698688
GHAMn34O9FU,1068.9,9 43 am,false,9:43am,footage then showed he arrived back at||home at 9 43 am that morning and he was||now wearing a different outfit compared,1471754
4nF3TRoB9n8,523.9,9 43 am,false,9:43am,responded to many there was a total of||164 text messages between 9 43 am and 8||12 P M,885356
7ygE6az6pCQ,1716.6,9 43 am,false,9:43am,threshold||the play begins at 9 43 am in egypt||as the egyptian military mobilizes in,587557
n_voc6fHHX4,109.9,9:43 am,false,9:43am,somebody was catching their breath and||it's the same red soccer ball again 9:43 am very funny Liam you may be my twin||brother but I think you're being,395756
EEY95sYHzL0,179,9 43 am,false,9:43am,plus rep comments look plus rep comment||at 27th november 9 43 am one at 9 42 am||the same day another one at 9 42 a m,383107
ig5tr7f8UTU,290.5,9 43 am,false,9:43am,was a total of 164 text messages between||9 43 am and at 12 p m April texted||Michael at about 10 45 am saying I,294392
xwCIQuehPBk,162.6,9 43 am,false,9:43am,to change the trajectory of this virus||and on november 25th at 9 43 am mayor hancock tweeted the following past||the potatoes not,263274
t0kGlfMOQ7Q,754.3,9 43 am,false,9:43am,at 9 20 am and the fitbit was then||stationary from 9 37 am to 9 43 am after a few minutes of non-movement||during which time detectives believe,237538
bgbFa0WfG-M,1693.5,9 43 am,false,9:43am,surveillance cameras captured michael at||9 43 am he was driving mark's white station||wagon into the parking lot of a lowe,208635
X-1SK6sVqlQ,180.7,9 43 am,false,9:43am,and hung up the phone||it was currently 9 43 am so i had all||day to get ready and to relax a little,166798
bDFzXE12NTA,653.4,9 43 am,false,9:43am,you can fire||it's 9 43 am a routine encounter in the||persian gulf has become,114901
73CJAheVtgM,2024.7,9 43 am,false,9:43am,codes depth Ascent rate||9 43 am polar prints updates when able||please,145030
BqVhBKcIWG4,7.1,9:43 A M,true,9:43am,"""In the Name of Love"" by Martin Garrix & Bebe Rexha||- 9:43 A M - It's so early||- What does time",2933266
TLcLxqU2h1U,21.6,9:43 A M,true,9:43am,HE WAS IN LABOR||BY 9:43 A M||HER WATER HAD,773707
EDFA3n7tz-I,9.2,9 43 a m,false,9:43am,is now present in a suit||and I will also advise that at 9 43 a m this morning I was advised that the jury||had reached verdicts in this matter,3985926
VL2sOMTMVu8,98.5,9:43 a m,false,9:43am,on to it there you go||alright let's call them on its 9:43 a m oh it's early I love usually a morning||person I love your furnace background,2798247
OKPmYG57Kd4,8,9 43 a m,false,9:43am,Mr Brooks is now present in a suit||and I will also advise that at 9 43 a m this morning I was advised that the jury||had reached verdicts in this matter,1721404
AN7iIXMJL9E,408.7,9:43 a m,false,9:43am,kitchen I looked at my watch which was||stopped at 9:43 a m the clock on the||microwave said 5:17 I then looked at and,1191770
e7v3IIR-oPw,599.7,9:43 a m,false,9:43am,bit better but in the mean time it's not||the worst well it's 9:43 a m and that||is just the first of many trips that we,973541
eY8ARsfUXKk,0.1,9 43 a m,false,9:43am,hello everyone and good morning it is 9 43 a m right now for me and i don't know||how i'm functioning yesterday i,676790
V0GDPSudW9c,280.1,9 43 a m,false,9:43am,about returning to the family home||Michael texted April 164 times between 9 43 a m and 8 12 p m and she replied to||many of them at around 10,501635
wvOs9MU1hYg,705.7,9 43 a m,false,9:43am,s||it's 9 43 a m a routine encounter in the||Persian Gulf has become deadly serious,517869
KSnhJgjJkik,356.3,9 43 a m,false,9:43am,got my matcha we worked out it's||been a good good morning it's 9 43 a m I||woke up at five,379941
TIAh59C9VDk,150.5,9 43 a m,false,9:43am,gotta get it together so time is||currently 9 43 a m and I gotta leave||here at about four I mean I know you may,983673
TLcLxqU2h1U,16,9:43 a m,false,9:43am,she was||in labor by 9:43 a m her water had||broken but when deputies told nurses,773707
DtTlz1mNhxY,1579.9,9:43 a m,false,9:43am,9:30 a m||9:43 a m we're signai 43m pig eyes||welcome back to my youtube channel like,212324
7o-6cE7YrKM,124,9:43 a m,false,9:43am,enough for me||9:43 a m right now and I'm craving some||pizza make some pizza 300 mil of warm,181462
JyOF1gTU4EE,16.3,9 43 a m,false,9:43am,yo what's going on surprise squad it is||9 43 a m on november 3rd i'm||expecting a very special package today,161197
-IGu8tv2Az0,3045.7,9:43 a m,false,9:43am,to call for ambulances a second||emergency call which was made at 9:43 a m the first ambulance arrived on the||scene just 14 minutes later just another,174651
YHrMb_Ja_xw,716.6,9 43 a m,false,9:43am,that we're being kind of picky because||it's 9 43 a m so that means the world is||our oyster if you're not happy with it,138278
uAtBtxqZpHI,285.6,9:43 a m,false,9:43am,10 a m||got it at about 9:43 a m according to what I have for my||livestream footage and this one's a,151138
q6x7FlB-OPQ,7.1,9 43 a m,false,9:43am,is now present in a suit||and I will also advise that at 9 43 a m this morning I was advised that the jury||had reached verdicts in this matter,134746
37PLDoXH2M4,133.8,9:43 a m,false,9:43am,4th 1991 during her third operation West||died on the operating table at 9:43 a m at the age of 58||her funeral was held at Christ's Church,107386
ymmiWKWfRKI,2094.9,9 43 a m,false,9:43am,hello available at the rim job||uh-huh okay and that would be 9 43 a m a m what's the temperature see what can||be done what's up good,148446